"Bug ID","Product","Component","Assignee","Status","Resolution","Summary","Changed","Depends on","Opened","OS","Number of Comments","Last Resolved","Last Visit","Crash Signature","Duplicate Count","Classification","Priority","Rank","Version","Votes","CC Count","Bug Interest"
399646,"Firefox","Disability Access","nobody","UNCONFIRMED"," ---","Tabs do not resize when using large font, high contrast themes","2011-05-14 13:33:48",,"2007-10-12 15:24:49","Linux",2,,,,0,"Client Software"," --",,"3.0 Branch",1,1,
405113,"Firefox","Disability Access","nobody","UNCONFIRMED"," ---","For all secured sites( a bank, or ebay or verisign or google when there is something per.»« Authsonnal) a window appears saying: «XYZ received a message with an authentification code of incorrect message","2017-01-30 09:12:10",,"2007-11-23 06:58:46","Windows Vista",1,,,,0,"Client Software"," --",,"2.0 Branch",1,2,
408171,"Firefox","Disability Access","nobody","UNCONFIRMED"," ---","need PERSISTANT handicapped reading  mode: MULTI FUNCTION WITH USER PRESETS OPTIONS PAGE","2017-01-03 20:14:16",,"2007-12-13 03:20:30","Windows 98",9,,,,0,"Client Software"," --",,"unspecified",0,5,
451410,"Firefox","Disability Access","nobody","UNCONFIRMED"," ---","Mouse doesn't work in popup window if the background is a map. It works fine in firefox2.0.0.16.","2011-02-22 14:50:55",,"2008-08-20 10:32:51","All",3,,,,0,"Client Software"," --",,"unspecified",0,1,
465361,"Firefox","Disability Access","nobody","UNCONFIRMED"," ---","incremental link search should prioritize visible links","2013-03-19 17:34:12",,"2008-11-17 09:52:00","All",3,,,,0,"Client Software"," --",,"unspecified",1,2,
470158,"Firefox","Disability Access","nobody","UNCONFIRMED"," ---","Alert accessible event should not be fired for bookmark page dialog","2011-05-14 22:02:48",,"2008-12-17 19:09:19","Windows XP",3,,,,0,"Client Software"," --",,"3.5 Branch",0,5,
471231,"Firefox","Disability Access","nobody","UNCONFIRMED"," ---","Need font size-changing for hi-res displays","2011-03-06 20:30:38",,"2008-12-26 18:33:24","Windows XP",3,,,,0,"Client Software"," --",,"3.0 Branch",1,0,
471441,"Firefox","Disability Access","nobody","UNCONFIRMED"," ---","Accessibility cannot grab F11 key","2011-11-10 08:38:02",,"2008-12-29 11:59:28","Linux",2,,,,0,"Client Software"," --",,"unspecified",0,1,
490334,"Firefox","Disability Access","nobody","UNCONFIRMED"," ---","Cups instances disappear in Print dialog","2015-09-18 02:45:35",,"2009-04-27 11:24:09","Linux",3,,,,0,"Client Software"," --",,"7 Branch",0,2,
495721,"Firefox","Disability Access","nobody","UNCONFIRMED"," ---","View>Page Style>No Style shouldn't mess with table borders","2009-05-31 18:32:53",,"2009-05-31 18:32:53","All",1,,,,0,"Client Software"," --",,"unspecified",0,0,
540155,"Firefox","Disability Access","nobody","UNCONFIRMED"," ---","make dpi settings more convenient, don't use interpolation to scale icons","2011-02-12 22:13:40",,"2010-01-16 05:00:38","Windows 7",4,,,,0,"Client Software"," --",,"3.6 Branch",0,1,
558282,"Firefox","Disability Access","nobody","UNCONFIRMED"," ---","Floating un-ordered list boxes do not correctly implement Microsoft Active Accessibility","2011-02-12 22:11:50",,"2010-04-09 02:36:21","Windows 7",2,,,,0,"Client Software"," --",,"3.6 Branch",0,1,
572291,"Firefox","Disability Access","nobody","UNCONFIRMED"," ---","Double Numbers Displayed on Webpage in Speech Recognition","2010-09-23 14:40:33",,"2010-06-15 22:35:33","Windows 7",2,,,,0,"Client Software"," --",,"unspecified",0,2,
574317,"Firefox","Disability Access","nobody","UNCONFIRMED"," ---","Handle to the window that is displaying the caret is 0 when moving caret in WYSIWYG editor.","2011-03-11 01:42:55",,"2010-06-24 04:05:02","Windows XP",1,,,,0,"Client Software"," --",,"3.6 Branch",1,1,
580562,"Firefox","Disability Access","nobody","UNCONFIRMED"," ---","access keys: please provide mechanism at least as good as Konqueror","2016-05-04 08:10:35",,"2010-07-21 01:34:43","Windows 7",2,,,,0,"Client Software"," --",,"3.6 Branch",1,1,
585509,"Firefox","Disability Access","nobody","UNCONFIRMED"," ---","Adjusting font size under Edit->Preferences->Content->Fonts and Colors does not alter font size in textarea.","2015-08-31 02:28:39",,"2010-08-08 16:36:22","Linux",2,,,,0,"Client Software"," --",,"unspecified",0,1,
589107,"Firefox","Disability Access","nobody","UNCONFIRMED"," ---","Old Menu visible when pressing alt, is not readable","2010-08-20 02:19:11",,"2010-08-20 02:19:11","Windows 7",1,,,,0,"Client Software"," --",,"unspecified",0,0,
611402,"Firefox","Disability Access","nobody","UNCONFIRMED"," ---","XUL:menulist and HTML:select should follow native GtkComboBox keyboard accessibility","2010-11-11 12:53:32",,"2010-11-11 11:31:45","Linux",2,,,,0,"Client Software"," --",,"unspecified",0,0,
625327,"Firefox","Disability Access","nobody","UNCONFIRMED"," ---","""No"" button in ""Cancel Upgrade of <Plugin>"" dialog is cut in High contrast Mode","2011-03-21 05:10:53",,"2011-01-13 03:29:05","Windows XP",2,,,,0,"Client Software"," --",,"3.6 Branch",0,0,
634909,"Firefox","Disability Access","nobody","UNCONFIRMED"," ---","JAWS 12 does not read dialog content intermittently. (seems wrong role returned by FF)","2011-03-23 23:18:52",,"2011-02-17 08:05:05","Windows XP",9,,,,0,"Client Software"," --",,"3.6 Branch",0,3,
653366,"Firefox","Disability Access","nobody","UNCONFIRMED"," ---","Background of the newly loaded page is white for a few seconds on black high contrast color scheme","2011-04-28 03:18:28",,"2011-04-28 00:42:28","Windows 7",2,,,,0,"Client Software"," --",,"4.0 Branch",0,2,
666544,"Firefox","Disability Access","nobody","UNCONFIRMED"," ---","presence of html5 required attribute = alert low and alert high states","2016-10-27 08:01:28",,"2011-06-23 04:26:07","Windows Vista",7,,,,0,"Client Software"," --",,"unspecified",1,5,
686301,"Firefox","Disability Access","nobody","UNCONFIRMED"," ---","Mozilla Firefox 4+ issue with JAWS. FF not reporting tooltip text/alert for dijit.form.ValidationTextBox","2011-09-12 08:42:43",,"2011-09-12 07:43:02","Windows 7",1,,,,0,"Client Software"," --",,"5 Branch",0,2,
698710,"Firefox","Disability Access","nobody","UNCONFIRMED"," ---","In high contrast mode, ""border-width"" does not work for some elements like ""input"", ""select""","2017-02-07 13:00:59",452800,"2011-11-01 04:14:09","Windows 7",2,,,,0,"Client Software"," --",,"7 Branch",1,1,
705744,"Firefox","Disability Access","nobody","UNCONFIRMED"," ---","Pop-up window closes on Accessibility API call","2011-11-28 10:07:45",,"2011-11-28 09:48:14","Mac OS X",3,,,,0,"Client Software"," --",,"8 Branch",0,2,
720080,"Firefox","Disability Access","nobody","UNCONFIRMED"," ---","Firefox does not respect ""Simulated Secondary Click"" in Ubuntu","2016-01-11 05:58:20",,"2012-01-20 22:30:54","Linux",1,,,,0,"Client Software"," --",,"9 Branch",0,1,
737015,"Firefox","Disability Access","nobody","UNCONFIRMED"," ---","View>Stop and View>Reload menu items are missing on Linux","2012-11-20 08:23:35",,"2012-03-19 07:28:43","Linux",2,,,,0,"Client Software"," --",,"11 Branch",0,4,
788428,"Firefox","Disability Access","nobody","UNCONFIRMED"," ---","ARIA alertdialog role does not fire system alert event when its visibility changes from hidden to visible","2015-01-19 08:11:11",,"2012-09-05 01:30:31","Windows Vista",19,,,,0,"Client Software"," --",,"15 Branch",0,4,
801812,"Firefox","Disability Access","nobody","UNCONFIRMED"," ---","Use Shift+F10 for context menu on Mac","2017-01-03 20:20:10",,"2012-10-15 13:17:47","Mac OS X",4,,,,0,"Client Software"," --",,"unspecified",0,3,
808538,"Firefox","Disability Access","nobody","UNCONFIRMED"," ---","Why Firefox shows ""server busy"" prompt ?","2017-09-20 23:21:45",,"2012-11-05 05:26:35","Windows 7",3,,,,0,"Client Software"," --",,"16 Branch",0,4,
835276,"Firefox","Disability Access","nobody","UNCONFIRMED"," ---","Firefox disables Screenreader","2013-01-29 06:44:11",,"2013-01-28 01:53:16","Windows 7",2,,,,0,"Client Software"," --",,"18 Branch",0,2,
851347,"Firefox","Disability Access","nobody","UNCONFIRMED"," ---","Autocomplete interferes with use of onscreen / virtual keyboard input to awesome bar and search","2013-03-18 10:01:50",,"2013-03-14 16:28:37","Linux",4,,,,0,"Client Software"," --",,"22 Branch",0,3,
882753,"Firefox","Disability Access","nobody","UNCONFIRMED"," ---","o Labels of specific combo boxes and list boxes are made insufficiently for JAWS to read","2016-05-31 20:28:19",,"2013-06-13 09:52:34","Windows 7",7,,,,0,"Client Software"," --",,"17 Branch",0,4,
884926,"Firefox","Disability Access","nobody","UNCONFIRMED"," ---","Provide longdesc keyboard support","2013-07-18 09:00:49",,"2013-06-19 10:34:55","Mac OS X",12,"2013-07-16 15:42:28",,,0,"Client Software"," --",,"21 Branch",1,4,
897475,"Firefox","Disability Access","nobody","UNCONFIRMED"," ---","Plugin Installation popup window is not accessible for JAWs screen reader.","2013-07-29 06:03:45",,"2013-07-24 07:21:35","Windows 7",1,,,,0,"Client Software"," --",,"22 Branch",0,1,
908358,"Firefox","Disability Access","nobody","UNCONFIRMED"," ---","Save As dialog not completely read by screen reader (JAWS)","2014-03-21 09:01:55",,"2013-08-22 12:22:11","Windows 7",8,,,,0,"Client Software"," --",,"23 Branch",0,3,
934377,"Firefox","Disability Access","nobody","UNCONFIRMED"," ---","I'd like an ""invert colors"" accessibility feature on Windows","2013-11-12 06:04:49",,"2013-11-04 00:41:20","Windows XP",5,,,,0,"Client Software"," --",,"25 Branch",0,3,
940862,"Firefox","Disability Access","nobody","UNCONFIRMED"," ---","Unfortunately Ubuntu 12.04 since Firefox 25.0 the a11y broken","2013-11-25 06:58:11",,"2013-11-19 22:27:43","Linux",6,,,,0,"Client Software"," --",,"25 Branch",0,2,
1010716,"Firefox","Disability Access","nobody","UNCONFIRMED"," ---","Message warning about disabled plugins is not accessible","2014-05-19 20:44:14",,"2014-05-15 00:47:55","All",5,,,,0,"Client Software"," --",,"29 Branch",0,5,
1021028,"Firefox","Disability Access","nobody","UNCONFIRMED"," ---","Regression: Orca can't read correctly Firefox >= 25","2014-06-06 03:16:15",,"2014-06-05 08:36:54","Linux",1,,,,0,"Client Software"," --",,"29 Branch",1,1,
1066165,"Firefox","Disability Access","nobody","UNCONFIRMED"," ---","After using accessibility tool FF31 freezes while modifying the DOM with huge elements","2014-10-04 06:04:39",,"2014-09-11 10:02:36","Windows 7",7,,,,0,"Client Software"," --",,"31 Branch",1,4,
1079145,"Firefox","Disability Access","nobody","UNCONFIRMED"," ---","ARIA alert role fires system alert event when its dynamically modified, even with `aria-expanded=""false""`","2014-12-16 11:15:12",,"2014-10-07 02:06:35","Windows 7",10,,,,0,"Client Software"," --",,"32 Branch",0,5,
1100986,"Firefox","Disability Access","nobody","UNCONFIRMED"," ---","Cannot read Web site elements with physical mouse in version 33 while using Window-Eyes screen reader.","2014-11-19 10:39:15",,"2014-11-18 07:34:55","Windows 7",3,,,,0,"Client Software"," --",,"33 Branch",0,3,
1106045,"Firefox","Disability Access","nobody","UNCONFIRMED"," ---","<input>s within <div>s within <a>s create focus cycles","2015-01-05 01:36:46",,"2014-11-28 05:18:20","Linux",4,,,,0,"Client Software"," --",,"33 Branch",0,2,
1108126,"Firefox","Disability Access","nobody","UNCONFIRMED"," ---","Unicode number in un-renderable character doesn't zoom","2014-12-05 15:54:56",,"2014-12-05 15:46:55","Windows 7",2,,,,0,"Client Software"," --",,"33 Branch",1,1,
1197356,"Firefox","Disability Access","nobody","UNCONFIRMED"," ---","IAccessibleText::textAtOffset does not work for paragraph","2015-08-23 10:39:13",,"2015-08-21 13:42:31","Windows 7",1,,,,0,"Client Software"," --",,"40 Branch",0,1,
1215858,"Firefox","Disability Access","nobody","UNCONFIRMED"," ---","OS X's Speak Selected Text speaks incorrect text","2018-10-19 06:46:23",,"2015-10-17 13:30:56","Mac OS X",2,,,,0,"Client Software"," --",,"44 Branch",0,2,
1227088,"Firefox","Disability Access","nobody","UNCONFIRMED"," ---","Some pages some times only show the title to accessibility programs like JAWS","2015-12-02 02:57:26",,"2015-11-23 03:52:54","Unspecified",2,,,,0,"Client Software"," --",,"42 Branch",0,2,
1231067,"Firefox","Disability Access","nobody","UNCONFIRMED"," ---","Firefox is unusable with on-screen keyboard in the gnome desktop","2018-06-23 05:59:26",,"2015-12-07 23:53:12","Linux",7,,,,0,"Client Software"," --",,"45 Branch",0,5,
1488290,"Firefox","Disability Access","nobody","UNCONFIRMED"," ---","Some pages with sticky headers inflict extra animated scrolling after page up or page down","2018-09-19 07:39:36",,"2018-09-03 14:54:55","Unspecified",13,,,,0,"Client Software"," --",,"61 Branch",0,4,
1502441,"Firefox","Disability Access","nobody","UNCONFIRMED"," ---","Jaws (2018) and NVDA (2017.2) do not render any content in Firefox v60.2 ESR","2018-10-29 09:10:50",,"2018-10-26 09:35:18","Unspecified",2,,,,0,"Client Software"," --",,"60 Branch",1,3,
724477,"Firefox","Disability Access","nobody","UNCONFIRMED"," ---","The sub-menu of 'Character encoding' can't be read by orca speech","2012-02-07 03:24:33",,"2012-02-06 00:21:46","Solaris",3,,,,0,"Client Software","P3",,"10 Branch",0,4,
1436026,"Firefox","Disability Access","nobody","UNCONFIRMED"," ---","No way to focus the Firefox alerts via keyboard","2018-04-16 07:55:56",,"2018-02-06 05:26:53","Unspecified",9,,,,0,"Client Software","P3",,"58 Branch",0,5,
1206443,"Firefox","Disability Access","nobody","UNCONFIRMED"," ---","We immediately warn about reload prevention even for reloads scheduled for a long time from now (e.g. 20 minutes) with no indication to the user","2018-01-31 08:33:24",,"2015-09-19 15:45:04","Linux",12,,,,1,"Client Software","P5",,"47 Branch",0,4,
1437434,"Firefox","Disability Access","nobody","UNCONFIRMED"," ---","Add option to narrate text when text is selected like in read mode","2018-04-16 07:56:33",,"2018-02-11 23:55:21","All",1,,,,0,"Client Software","P5",,"58 Branch",0,2,
422981,"Firefox","Disability Access","enndeakin","NEW"," ---","[a11y] better/different handling needed for onfocus blur","2018-08-06 01:14:04",,"2008-03-14 11:20:06","All",14,,,,0,"Client Software"," --",,"Trunk",0,10,
1249721,"Firefox","Disability Access","mzehe","NEW"," ---","Accessibility issue with 'new tab' notification saying 'Click under the gear icon'.","2016-02-19 11:04:31",,"2016-02-19 11:04:31","Unspecified",1,,,,0,"Client Software"," --",,"Trunk",0,0,
369713,"Firefox","Disability Access","nian.liu","NEW"," ---","make xul elements which has image attribute to support nsIAccessibleImage interface","2010-07-26 21:15:28",357430,"2007-02-08 01:27:14","Linux",2,,,,0,"Client Software"," --",,"Trunk",1,3,
277103,"Firefox","Disability Access","nobody","NEW"," ---","Need support for Dragon NaturallySpeaking voice editing API","2017-04-15 19:34:01",,"2005-01-05 05:34:48","Windows XP",5,,,,0,"Client Software"," --",,"unspecified",3,2,
332275,"Firefox","Disability Access","nobody","NEW"," ---","Set a Default Text Size (or Page Zoom Level) in Tools > Options > Content > Default Page Size","2018-10-30 16:31:58",,"2006-03-30 14:01:23","All",66,,,,4,"Client Software"," --",,"unspecified",26,46,
343205,"Firefox","Disability Access","nobody","NEW"," ---","Firefox high contrast theme bugs","2018-04-02 07:22:09","61188, 198855, 237534, 239914, 305797, 315491, 334441, 334445, 334462, 334472, 334578, 334579, 334598, 345753, 345755, 348368, 348637, 349700, 352288, 357073, 370531, 374157, 378744, 379402, 413945, 451157, 451160, 451331, 452800, 455835, 545635, 554963, 575974, 582951, 611690, 639134, 661858, 697836, 712867, 942427, 963950, 986324, 993387, 1008583, 1008603, 1008730, 1009367, 1010725, 1010946, 1010960, 1012629, 1050753, 1062485, 1064503, 1079098, 1181803, 1266172","2006-06-29 17:57:05","All",6,,,,0,"Client Software"," --",,"unspecified",2,11,
347043,"Firefox","Disability Access","nobody","NEW"," ---","Cannot read Page Info dialogs with large fonts","2007-10-14 08:59:29",,"2006-08-02 12:40:03","Windows XP",1,,,,0,"Client Software"," --",,"Trunk",1,5,
348133,"Firefox","Disability Access","nobody","NEW"," ---","Cookies detail fields have no accesskeys","2014-06-12 23:34:22",,"2006-08-09 16:02:37","All",1,,,,0,"Client Software"," --",,"Trunk",0,3,
353445,"Firefox","Disability Access","nobody","NEW"," ---","The widget in autocomplete is not accessible.","2006-09-19 22:03:31",,"2006-09-19 20:01:20","SunOS",1,,,,0,"Client Software"," --",,"Trunk",1,5,
354139,"Firefox","Disability Access","nobody","NEW"," ---","get_accParent() for menubar popup returns ROLE_WINDOW instead of correct object","2007-04-07 22:55:21",,"2006-09-25 08:03:44","Windows XP",2,,,,0,"Client Software"," --",,"2.0 Branch",0,1,
360003,"Firefox","Disability Access","nobody","NEW"," ---","getRangeExtents reports (0, 0, 0, 0) for list item bullets","2010-07-26 21:22:47",,"2006-11-08 13:07:23","Linux",10,,,,0,"Client Software"," --",,"unspecified",3,5,
361066,"Firefox","Disability Access","nobody","NEW"," ---","Window Eyes tab ""Next Link or Graphic"" Navigation fails to work","2017-12-08 23:21:12",,"2006-11-17 08:49:29","Windows XP",3,,,,1,"Client Software"," --",,"Trunk",1,2,
368026,"Firefox","Disability Access","nobody","NEW"," ---","The search icon glowing is not compliant with gnome theme setting.","2011-12-13 04:03:45",,"2007-01-23 23:13:50","Linux",2,,,,0,"Client Software"," --",,"Trunk",1,2,
368877,"Firefox","Disability Access","nobody","NEW"," ---","Firefox chrome accessibility tracking bug","2013-04-10 20:14:55","194937, 287743, 327347, 332794, 340493, 340783, 344585, 344588, 346893, 346895, 347215, 347874, 349054, 352349, 352547, 363955, 371276, 371279, 375008, 377773, 379755, 380458, 384229, 392128, 393094, 393248","2007-01-31 12:38:51","All",1,,,,0,"Client Software"," --",,"2.0 Branch",1,2,
374212,"Firefox","Disability Access","nobody","NEW"," ---","Metabug: Bugs blocking Orca support","2018-03-22 08:11:28","144000, 158757, 205846, 332663, 332792, 335340, 337557, 340765, 340809, 343516, 343904, 348179, 348901, 354346, 357969, 360003, 360184, 360510, 360578, 363214, 364373, 364376, 365973, 366340, 366498, 366527, 366815, 367364, 367905, 368346, 368835, 369389, 369855, 370455, 371273, 371276, 371279, 371941, 371955, 372545, 372624, 372778, 373575, 373996, 375934, 376013, 376468, 376481, 376887, 377514, 378408, 378468, 379424, 379678, 379878, 380054, 380412, 380458, 380695, 380706, 380976, 381131, 382270, 382318, 383482, 383567, 384101, 384187, 384265, 384667, 385024, 385070, 385121, 386235, 387273, 387347, 387418, 387496, 387710, 387732, 387838, 387843, 387925, 387981, 387990, 388185, 388187, 388191, 388608, 388665, 389851, 390154, 390298, 390414, 390629, 391023, 391671, 391841, 391991, 392203, 392818, 393279, 393860, 393899, 394201, 394260, 394387, 394493, 394547, 394688, 394689, 394868, 395041, 395400, 395699, 395902, 396799, 396930, 397219, 397485, 397606, 397608, 397611, 398052, 398156, 399128, 399158, 405248, 409009, 409439, 409497, 411581, 411913, 411914, 411920, 413777, 416742, 419474, 419786, 420993, 422981, 423224, 423364, 423409, 424264, 427330, 427841, 434249, 440568, 440590, 441233, 441610, 443097, 445062, 445938, 445968, 446469, 448235, 448836, 449254, 453605, 459152, 464559, 466332, 493354, 494802, 501580, 503428, 504561, 510688, 524001, 524115, 527461, 546053, 546068, 547506, 567571, 576838, 579639, 579964, 580535, 593631, 623927, 625950, 634126, 638326, 652291, 686909, 693343, 708692, 736983, 737101, 743568, 743569, 786143, 861681, 876540, 919508, 924915, 935254, 935567, 945907, 947265, 956032, 957254, 957306, 960228, 960241, 960382, 960515, 961696, 961737, 968152, 972845, 974238, 1013584, 1020338, 1026132, 1052000, 1052478, 1052498, 1052504, 1052525, 1056334, 1066974, 1096071, 1113153, 1132668, 1141181, 1141220, 1155875, 1165433, 1170242, 1174204, 1178817, 1179483, 1190882, 1197254, 1203861, 1204171, 1208767, 1210108, 1210447, 1210630, 1210982, 1212351, 1212481, 1213402, 1213476, 1213516, 1227124, 1249848, 1251457, 1251992, 1260598, 1266226, 1272685, 1304631, 1305402, 1305446, 1308908, 1313376, 1346535, 1348340, 1355423, 1376138, 1384987, 1436418, 1448007","2007-03-16 06:52:42","Linux",9,,,,0,"Client Software"," --",,"unspecified",4,13,
408332,"Firefox","Disability Access","nobody","NEW"," ---","can not access html contents with </br> tag","2008-08-21 02:34:59",,"2007-12-13 23:35:57","SunOS",6,,,,0,"Client Software"," --",,"unspecified",1,6,
427997,"Firefox","Disability Access","nobody","NEW"," ---","Let user know about the presence of alternate stylesheets","2008-04-16 11:35:33",,"2008-04-09 07:50:49","All",3,,,,0,"Client Software"," --",,"Trunk",6,1,
433022,"Firefox","Disability Access","nobody","NEW"," ---","Too many nodes in the MSAA tree have a description of ""click""","2008-09-17 23:54:50",,"2008-05-09 10:28:16","Windows XP",12,,,,0,"Client Software"," --",,"unspecified",0,3,
449515,"Firefox","Disability Access","nobody","NEW"," ---","It's unable to move focus onto the caption  on left/right side of table","2008-08-07 07:18:33",,"2008-08-06 20:23:46","OpenSolaris",1,,,,0,"Client Software"," --",,"3.0 Branch",0,3,
451160,"Firefox","Disability Access","nobody","NEW"," ---","Text on hovered page combobox is invisible on high contrast inverse theme on Gnome","2014-06-09 00:04:06",,"2008-08-18 23:42:38","Linux",1,,,,0,"Client Software"," --",,"Trunk",0,3,
461983,"Firefox","Disability Access","nobody","NEW"," ---","Fix semantics for feed view pages","2008-10-28 08:58:52",,"2008-10-28 08:58:52","All",1,,,,0,"Client Software"," --",,"unspecified",0,0,
462367,"Firefox","Disability Access","nobody","NEW"," ---","Accessibility programs seem to be unable to consistently manipulate text fields (ex: address bar)","2009-04-06 23:53:37",,"2008-10-30 09:34:27","Linux",6,,,,0,"Client Software"," --",,"unspecified",2,3,
472142,"Firefox","Disability Access","nobody","NEW"," ---","report state changes when aria property value changes to/from ""undefined""","2009-01-13 02:38:49",467144,"2009-01-05 09:33:25","All",1,,,,0,"Client Software"," --",,"unspecified",0,1,
475260,"Firefox","Disability Access","nobody","NEW"," ---","<label class=""text-link"" /> does not send oncommand event","2009-01-25 16:26:29",,"2009-01-25 09:22:27","Linux",2,,,,0,"Client Software"," --",,"3.0 Branch",0,1,
488835,"Firefox","Disability Access","nobody","NEW"," ---","Hold down the Home button to go to homepage","2009-04-17 12:37:26",,"2009-04-17 04:54:25","All",1,,,,0,"Client Software"," --",,"unspecified",0,1,
568508,"Firefox","Disability Access","nobody","NEW"," ---","JAWS - CK Editor - Table navigation inconsistent","2010-12-10 07:28:46",,"2010-05-27 09:10:14","Windows 7",4,,,,0,"Client Software"," --",,"unspecified",0,4,
569313,"Firefox","Disability Access","nobody","NEW"," ---","Redundant ""Toolbar"" in name of ""Navigation Toolbar""","2014-08-08 17:48:39",,"2010-05-31 22:36:29","Windows 7",6,,,,0,"Client Software"," --",,"Trunk",0,3,
589059,"Firefox","Disability Access","nobody","NEW"," ---","Voiceover doesn't work with the browser.","2015-10-25 03:36:05",,"2010-08-19 21:52:40","Mac OS X",4,,,,0,"Client Software"," --",,"Trunk",2,4,
626907,"Firefox","Disability Access","nobody","NEW"," ---","On OS X we need the ability to have certain menu items appear only for keyboard access","2018-08-12 17:55:26",,"2011-01-18 17:28:10","Mac OS X",10,,,,0,"Client Software"," --",,"unspecified",0,8,
641356,"Firefox","Disability Access","nobody","NEW"," ---","html5 input type=""url"" with an associated datalist does not indicate that a datalist is present","2011-10-07 08:25:50",,"2011-03-13 12:37:23","Windows Vista",4,,,,0,"Client Software"," --",,"unspecified",0,3,
644485,"Firefox","Disability Access","nobody","NEW"," ---","Add an Accessibility Tab to Firefox Options","2012-12-13 12:45:29",,"2011-03-23 23:05:17","All",7,,,,0,"Client Software"," --",,"Trunk",0,6,
648413,"Firefox","Disability Access","nobody","NEW"," ---","help -> about minefield  inaccessible","2011-04-07 16:36:15",,"2011-04-07 16:35:08","Linux",1,,,,0,"Client Software"," --",,"unspecified",0,1,
688297,"Firefox","Disability Access","nobody","NEW"," ---","Add Studio Dyslexia Font as Accessibility option for Dyslexic users","2018-05-25 03:13:39",,"2011-09-21 15:05:26","All",5,,,,0,"Client Software"," --",,"9 Branch",1,5,
722178,"Firefox","Disability Access","nobody","NEW"," ---","Microsoft Magnifier tool does not focus (follow) text editing cursor properly when the cursor is not at the end of a line of text.","2016-05-28 12:01:10",656089,"2012-01-29 11:05:26","Windows 7",11,,,,0,"Client Software"," --",,"9 Branch",1,8,
727819,"Firefox","Disability Access","nobody","NEW"," ---","Make PDF.js accessible","2013-08-07 10:25:19",861157,"2012-02-16 06:53:09","Mac OS X",16,,,,0,"Client Software"," --",,"unspecified",2,15,
732872,"Firefox","Disability Access","nobody","NEW"," ---","Firefox runs extremely slowly when Windows Speech Recognition is running [meta]","2017-05-25 21:56:50","754830, 754857, 754879, 756381, 756383, 756969, 756973, 756975, 756983, 757670","2012-03-04 19:12:10","Windows 7",21,,,,0,"Client Software"," --",,"7 Branch",1,7,
746205,"Firefox","Disability Access","nobody","NEW"," ---","CSS issues render color selection in FF useless","2012-09-29 13:02:43",,"2012-04-17 10:03:50","Linux",17,,,,0,"Client Software"," --",,"unspecified",1,5,
764118,"Firefox","Disability Access","nobody","NEW"," ---","svg element role is diagram","2013-11-15 02:10:25",,"2012-06-12 13:05:10","Windows Vista",19,,,,0,"Client Software"," --",,"14 Branch",0,5,
801748,"Firefox","Disability Access","nobody","NEW"," ---","Does not warn/prevent some types of redirects when accessibility.blockautorefresh is true","2017-01-28 19:51:48",,"2012-10-15 10:55:34","All",22,,,,0,"Client Software"," --",,"21 Branch",1,7,
