"Bug ID","Product","Component","Assignee","Status","Resolution","Summary","Changed","Depends on","Opened","OS","Number of Comments","Last Resolved","Last Visit","Crash Signature","Duplicate Count","Classification","Priority","Rank","Version","Votes","CC Count","Bug Interest"
826742,"Firefox","File Handling","nobody","NEW"," ---","nsExternalHelperAppService.cpp : Assertion: Empty aExtension parameter! (from DEBUG BUILD of TB)","2016-06-22 11:13:18",,"2013-01-04 09:14:08","Linux",19,,,,0,"Client Software"," --",,"unspecified",0,3,
828087,"Firefox","File Handling","nobody","NEW"," ---","Investigate mechanism for determining the ""causing window"" of a download for the launcher dialog","2016-06-22 11:17:16",,"2013-01-08 16:49:03","All",11,,,,0,"Client Software"," --",,"unspecified",2,8,
829806,"Firefox","File Handling","nobody","NEW"," ---","Firefox doesn't detect the correct File extension for a PDF","2016-06-22 11:17:54",,"2013-01-11 15:18:46","Mac OS X",3,,,,0,"Client Software"," --",,"unspecified",0,2,
832913,"Firefox","File Handling","nobody","NEW"," ---","DoS using unknown content-type objects","2016-06-22 11:15:51",113941,"2013-01-21 02:26:10","All",3,,,,0,"Client Software"," --",,"unspecified",0,2,
849513,"Firefox","File Handling","nobody","NEW"," ---","Uploading files from /proc or /sys either never starts or will never finish","2016-06-22 11:24:19",,"2013-03-09 06:27:12","Linux",2,,,,0,"Client Software"," --",,"unspecified",0,2,
864851,"Firefox","File Handling","nobody","NEW"," ---","Treat certain resources served ""text/plain"" as if they had no Content-Type header","2017-10-13 18:26:01",,"2013-04-23 09:46:03","All",18,"2013-04-23 18:40:48",,,0,"Client Software"," --",,"unspecified",5,8,
875904,"Firefox","File Handling","nobody","NEW"," ---","downloaded files have incorrect names","2016-06-22 11:28:44",,"2013-05-24 12:26:26","Windows 7",5,,,,0,"Client Software"," --",,"unspecified",0,2,
886130,"Firefox","File Handling","nobody","NEW"," ---","Allow 'select helper application' dialogue to use KDE 'select program' dialogue/menu","2014-06-07 06:21:46",,"2013-06-23 08:40:06","Linux",14,,,,0,"Client Software"," --",,"21 Branch",3,7,
888143,"Firefox","File Handling","nobody","NEW"," ---","problem with magnet link after i upgrade to firefox 22 in ubuntu 12.04 [linux]","2014-09-20 04:11:45",,"2013-06-27 21:08:19","Linux",10,,,,1,"Client Software"," --",,"22 Branch",1,6,
906022,"Firefox","File Handling","nobody","NEW"," ---","audio player should have a possibility to download the file","2013-10-27 05:11:39",,"2013-08-16 06:33:01","All",4,,,,0,"Client Software"," --",,"24 Branch",0,2,
911607,"Firefox","File Handling","nobody","NEW"," ---","Undefined print function in head_handlerService.js","2016-06-22 11:27:53",,"2013-09-01 16:26:07","All",1,,,,0,"Client Software"," --",,"unspecified",0,0,
929038,"Firefox","File Handling","nobody","NEW"," ---","(RFE) In Filesutils.jsm, incorporate a mapping function of I/O error code to a short English message.","2016-06-22 11:14:57",,"2013-10-21 10:28:06","All",7,,,,0,"Client Software"," --",,"unspecified",0,1,
933303,"Firefox","File Handling","nobody","NEW"," ---","handlerApps.js fails to kill iCal on Mac OS X (cannot create mochitest-plain tests in widget/tests)","2016-06-22 11:24:31",,"2013-10-31 09:00:13","Mac OS X",6,,,,0,"Client Software"," --",,"unspecified",0,5,
934084,"Firefox","File Handling","nobody","NEW"," ---","Firefox does not sanitize special characters in page titles for Save As...","2018-02-06 03:12:23",,"2013-11-02 01:24:23","Linux",7,,,,0,"Client Software"," --",,"26 Branch",0,4,
936990,"Firefox","File Handling","nobody","NEW"," ---","(META) The return value of PR_Close() should be checked (like any other system calls).","2016-10-19 06:31:56","936987, 937669, 938683, 938687, 938693, 939530, 939531, 939535","2013-11-10 21:33:28","All",5,,,,0,"Client Software"," --",,"unspecified",0,4,
943886,"Firefox","File Handling","nobody","NEW"," ---","A download filename starting with ~ (tilde) affects the download location","2017-08-18 07:39:00",,"2013-11-27 07:07:44","Mac OS X",9,,,,0,"Client Software"," --",,"unspecified",0,5,
946537,"Firefox","File Handling","nobody","NEW"," ---","firefox unprepared for unreadable local directory (opening a local file path w/o permission fails silently)","2013-12-05 08:21:01",,"2013-12-04 17:23:00","Linux",2,,,,0,"Client Software"," --",,"27 Branch",0,1,
952897,"Firefox","File Handling","nobody","NEW"," ---","Firefox could not handle the correct Chinese encoding when download the file","2013-12-22 23:14:28",,"2013-12-22 22:45:30","Mac OS X",2,,,,0,"Client Software"," --",,"29 Branch",1,1,
956113,"Firefox","File Handling","nobody","NEW"," ---","Download does not gracefully handle filenames with a colon","2016-06-22 11:14:49",,"2014-01-02 11:03:29","Windows 8.1",3,,,,0,"Client Software"," --",,"unspecified",0,2,
961233,"Firefox","File Handling","nobody","NEW"," ---","nsIWebHandlerApp uriTemplate not reset when changing to a non web protocol handler","2015-08-27 05:05:24",,"2014-01-17 14:03:46","All",5,,,,0,"Client Software"," --",,"Trunk",0,3,
973060,"Firefox","File Handling","nobody","NEW"," ---","Save as Type: Text Files not preserved on consecutive saves as","2016-01-08 09:42:04",,"2014-02-14 13:52:35","Windows 7",3,,,,0,"Client Software"," --",,"27 Branch",0,2,
976266,"Firefox","File Handling","nobody","NEW"," ---","infinite loop specifying Firefox as the helper app for a type/protocol Firefox doesn't handle (e.g. telnet:)","2015-11-07 06:51:19",,"2014-02-24 13:12:00","Windows 8",7,"2014-02-24 21:30:23",,,1,"Client Software"," --",,"27 Branch",0,1,
986350,"Firefox","File Handling","nobody","NEW"," ---","""Email Link...""/mailto links stop working when the configured email program has been uninstalled, no user feedback provided","2015-11-07 06:54:01",,"2014-03-21 01:07:28","All",10,,,,0,"Client Software"," --",,"Trunk",0,4,
995003,"Firefox","File Handling","nobody","NEW"," ---","Firefox launches Flash Player plugin for Flash at web URLs, but tries to download local (file:// URLs) Flash instead of executing it.","2016-12-11 23:48:38",,"2014-04-10 16:46:16","Linux",4,,,,0,"Client Software"," --",,"28 Branch",0,6,
1014060,"Firefox","File Handling","nobody","NEW"," ---","User blocked when installing addon from xpi file while file picker is open","2014-05-21 09:11:52",,"2014-05-21 09:11:52","All",1,,,,0,"Client Software"," --",,"29 Branch",0,0,
1028733,"Firefox","File Handling","nobody","NEW"," ---","Folder to which a file was saved in Private session, and used for opening in normal session","2016-06-22 11:17:10",,"2014-06-22 13:36:25","All",3,,,,0,"Client Software"," --",,"unspecified",0,2,
1034989,"Firefox","File Handling","nobody","NEW"," ---","Tests for File -> Save As and files with a leading period","2017-09-28 02:42:03",1402279,"2014-07-06 12:14:09","Linux",10,,,,0,"Client Software"," --",,"33 Branch",0,2,
1035988,"Firefox","File Handling","nobody","NEW"," ---","Open file selector for uploads reverts to ""Recently used files"" instead of ""Recently used folders"".","2014-08-16 12:11:21",,"2014-07-08 11:38:03","All",7,,,,0,"Client Software"," --",,"33 Branch",1,3,
1055950,"Firefox","File Handling","nobody","NEW"," ---","Form with mailto: action is wrongly escaping spaces chars","2016-06-22 11:28:31",,"2014-08-19 23:57:06","All",6,,,,0,"Client Software"," --",,"unspecified",1,3,
1060861,"Firefox","File Handling","nobody","NEW"," ---","Default upload folder","2015-07-03 22:56:38",,"2014-08-30 13:39:03","All",2,,,,0,"Client Software"," --",,"32 Branch",1,3,
1061280,"Firefox","File Handling","nobody","NEW"," ---","File save not working for some websites with long file names","2014-11-03 05:04:48",,"2014-09-01 10:54:03","All",6,,,,0,"Client Software"," --",,"34 Branch",1,3,
1063062,"Firefox","File Handling","nobody","NEW"," ---","Never Active plugin still shows as the active one at Preferences applications pane","2014-09-04 12:33:58",,"2014-09-04 12:33:58","All",1,,,,0,"Client Software"," --",,"unspecified",0,0,
1063071,"Firefox","File Handling","nobody","NEW"," ---","Preferences Applications pane should list all available plugins for each content type","2014-09-04 12:44:09",,"2014-09-04 12:44:09","All",1,,,,0,"Client Software"," --",,"unspecified",0,0,
1064367,"Firefox","File Handling","nobody","NEW"," ---","On file download: NS_ERROR_NOT_AVAILABLE: Async version must be used nsHelperAppDlg.js:209","2014-11-18 14:50:25",,"2014-09-08 09:15:50","Linux",1,,,,0,"Client Software"," --",,"Trunk",0,1,
1064740,"Firefox","File Handling","nobody","NEW"," ---","Missing support for ReSTructured text","2016-06-22 11:13:04",,"2014-09-09 01:37:38","Linux",3,,,,0,"Client Software"," --",,"unspecified",0,1,
1079981,"Firefox","File Handling","nobody","NEW"," ---","Firefox tries to display a download instead of downloading and shows gibberish (ÐÏ à¡± á���������������)","2016-02-25 03:01:21",,"2014-10-08 10:17:41","Windows 7",6,,,,0,"Client Software"," --",,"Trunk",0,3,
1083728,"Firefox","File Handling","nobody","NEW"," ---","Should not decide stuff based on the extension if the extension is known to map to two different kinds of things.","2016-06-22 11:26:27",1071433,"2014-10-16 03:44:30","All",7,,,,0,"Client Software"," --",,"unspecified",0,11,
1122248,"Firefox","File Handling","nobody","NEW"," ---","[e10s] Images saved from data URI images in e10s get no extension by default","2015-01-16 21:44:44",,"2015-01-15 14:05:02","All",5,,,,0,"Client Software"," --",,"Trunk",1,3,
1131784,"Firefox","File Handling","nobody","NEW"," ---","Links to local files are not blocked properly when saving via Ctrl-click","2015-03-30 12:34:42",,"2015-02-10 13:49:10","Linux",4,,,,0,"Client Software"," --",,"35 Branch",0,3,
1133062,"Firefox","File Handling","nobody","NEW"," ---","Issue when loading a PDF file into an already opened window using an external PDF viewer","2016-05-27 05:04:07",,"2015-02-13 13:11:46","Windows 7",4,,,,0,"Client Software"," --",,"35 Branch",0,2,
1144492,"Firefox","File Handling","nobody","NEW"," ---","Pref network.dir.format 3 results in endless tab creation","2015-03-23 04:21:04",,"2015-03-17 19:05:20","All",6,,,,0,"Client Software"," --",,"36 Branch",0,1,
1148248,"Firefox","File Handling","nobody","NEW"," ---","Save file – Allow Save As, to Rename","2017-01-22 19:46:22",,"2015-03-26 18:29:05","Mac OS X",2,,,,0,"Client Software"," --",,"36 Branch",0,2,
1153287,"Firefox","File Handling","nobody","NEW"," ---","Use the ""download"" attribute of HTML <a> elements for the filename suggestion in ""Save Link As..."" timeouts","2015-04-10 08:50:26",850378,"2015-04-10 08:43:48","All",1,,,,0,"Client Software"," --",,"Trunk",0,1,
1182948,"Firefox","File Handling","nobody","NEW"," ---","firefox filechooser filters tiff files incorrectly","2016-06-22 11:13:48",,"2015-07-12 19:22:26","Unspecified",16,,,,0,"Client Software"," --",,"unspecified",0,4,
1184314,"Firefox","File Handling","nobody","NEW"," ---","Add mailto link handling to browser defaults","2016-12-02 11:42:31",,"2015-07-15 13:37:54","Unspecified",2,,,,0,"Client Software"," --",,"40 Branch",0,3,
1195015,"Firefox","File Handling","nobody","NEW"," ---","Not opening pdf files on android (fennec fdroid)","2015-08-20 02:28:24",,"2015-08-15 09:28:20","Android",1,,,,0,"Client Software"," --",,"40 Branch",0,2,
1204196,"Firefox","File Handling","nobody","NEW"," ---","PDF handling is broken in firefox","2016-02-12 12:59:39",,"2015-09-11 22:34:24","Unspecified",6,,,,0,"Client Software"," --",,"40 Branch",0,4,
1207152,"Firefox","File Handling","nobody","NEW"," ---","Misconfigured Javaws causes pleathera of tabs","2015-11-23 01:49:24",,"2015-09-22 06:40:22","Unspecified",4,,,,0,"Client Software"," --",,"38 Branch",0,2,
1210353,"Firefox","File Handling","nobody","NEW"," ---","download window drag and drop only copies first selected","2015-11-10 09:35:19",,"2015-10-01 04:05:18","Windows 7",8,,,,0,"Client Software"," --",,"44 Branch",0,3,
1210768,"Firefox","File Handling","nobody","NEW"," ---","swf upload error when uploading from drive created with subst","2016-06-22 11:12:56",,"2015-10-02 06:07:52","Unspecified",1,,,,0,"Client Software"," --",,"unspecified",0,2,
1213419,"Firefox","File Handling","nobody","NEW"," ---","File browser in Firefox not disappearing until JavaScript has finished executing","2016-06-22 11:12:23",,"2015-10-09 13:41:05","Unspecified",13,,,,0,"Client Software"," --",,"unspecified",0,2,
1216064,"Firefox","File Handling","nobody","NEW"," ---","Application icons may not be shows on ""Launch application""","2017-10-25 00:25:06",,"2015-10-19 02:17:28","Unspecified",15,,,,0,"Client Software"," --",,"41 Branch",0,5,
1231127,"Firefox","File Handling","nobody","NEW"," ---","""Open with"" option missing for files sent as Content-Type: application/octet-stream","2016-06-22 11:26:24",,"2015-12-08 07:11:54","Linux",9,,,,0,"Client Software"," --",,"unspecified",0,2,
1240316,"Firefox","File Handling","nobody","NEW"," ---","Setting browser.altClickSave to true does not have desired result","2016-01-17 17:51:24",,"2016-01-16 13:20:09","All",5,,,,0,"Client Software"," --",,"43 Branch",1,3,
1246121,"Firefox","File Handling","nobody","NEW"," ---","Network drive (e.g. smb://) does not display in the places sidebar of the open file dialog","2016-02-09 00:49:45",,"2016-02-05 03:46:55","Linux",2,,,,0,"Client Software"," --",,"unspecified",0,2,
1248520,"Firefox","File Handling","nobody","NEW"," ---","Allow viewing .cpp files in the browser","2016-06-22 11:12:17",,"2016-02-15 20:34:35","Unspecified",2,,,,0,"Client Software"," --",,"unspecified",0,1,
1252223,"Firefox","File Handling","nobody","NEW"," ---","[e10s] test_bug293834.html fails on OSX 10.10 (Component returned failure code: 0x80520012 (NS_ERROR_FILE_NOT_FOUND) [nsIFileInputStream.init] at chrome://specialpowers/content/specialpowersAPI.js:143)","2016-06-22 11:29:59",,"2016-02-29 12:31:18","Mac OS X",3,,,,0,"Client Software"," --",,"unspecified",0,2,
1503371,"Firefox","File Handling","nobody","NEW"," ---","Large local files with many pictures load extremely slow","2018-11-09 15:44:10",,"2018-10-30 12:11:27","Unspecified",4,,,,0,"Client Software"," --",,"63 Branch",0,1,
1504641,"Firefox","File Handling","nobody","NEW"," ---","Firefox stalls when uploading a file that is dragged in from Thunderbird","2018-11-09 06:09:23",,"2018-11-05 03:20:05","Unspecified",6,,,,0,"Client Software"," --",,"60 Branch",0,2,
200289,"Firefox","File Handling","sdagley","NEW"," ---","Lack of consistency in placing downloaded files (""Desktop Folder"")","2016-06-22 11:28:42",,"2003-04-02 06:38:02","Mac OS X",42,,,,2,"Client Software"," --",,"unspecified",4,12,
57342,"Firefox","File Handling","nobody","NEW"," ---","Add ""View as Text/HTML/..."" option for unknown mime content-type","2018-10-19 19:17:16","52441, 69938, 176919, 217432, 217433, 217434, 227113, 369787, 504441","2000-10-19 15:43:57","All",217,"2002-10-15 03:39:38",,,33,"Client Software","P1",,"unspecified",180,173,
351766,"Firefox","File Handling","nobody","NEW"," ---","Download dialog should display entire URL to file (and be selectable)","2018-05-31 23:59:17",,"2006-09-07 21:42:42","All",8,,,,0,"Client Software","P2",,"unspecified",2,8,
1305177,"Firefox","File Handling","nobody","NEW"," ---","Provide observer notification to allow extensions to cancel external app launch (Tor 19273)","2018-07-11 08:23:10",,"2016-09-23 16:08:29","Unspecified",10,,,,0,"Client Software","P2",,"unspecified",0,10,
40098,"Firefox","File Handling","bugzillaabuse","NEW"," ---","Unknown File Type prompt doesn't go away after selecting ""Save File..""","2016-06-22 11:17:42",28584,"2000-05-21 23:35:35","Windows 2000",15,"2000-12-29 05:22:41",,,1,"Client Software","P3",,"unspecified",1,2,
21482,"Firefox","File Handling","nobody","NEW"," ---","Improvement to Save File dialog: folder based on URL","2016-06-22 11:26:00",,"1999-12-10 20:13:35","All",8,,,,0,"Client Software","P3",,"unspecified",2,4,
24278,"Firefox","File Handling","nobody","NEW"," ---","The download window is not resizable!","2016-07-30 23:50:30",,"2000-01-18 15:21:55","Linux",36,,,,0,"Client Software","P3",,"unspecified",2,8,
27493,"Firefox","File Handling","nobody","NEW"," ---","Default open/save directory isn't smart","2016-06-22 11:27:39",30453,"2000-02-11 19:41:00","All",45,,,,5,"Client Software","P3",,"unspecified",4,23,
45441,"Firefox","File Handling","nobody","NEW"," ---","[Mac] html files saved without .html extension are viewed as plain text","2016-06-22 11:29:22",,"2000-07-13 16:57:43","Mac OS X",29,"2004-02-04 03:03:28",,,1,"Client Software","P3",,"unspecified",1,12,
54940,"Firefox","File Handling","nobody","NEW"," ---","must define list of default MIME type associations for Helper Apps Preferences","2016-06-22 11:28:34","52441, 58811, 61408, 68514, 95504, 106074, 162742","2000-10-02 13:57:41","All",61,,,,4,"Client Software","P3",,"unspecified",5,29,
58744,"Firefox","File Handling","nobody","NEW"," ---","3rd party download managers not supported","2018-10-15 01:43:29",,"2000-11-01 09:39:25","All",91,"2000-11-01 21:18:12",,,7,"Client Software","P3",,"unspecified",42,45,
59808,"Firefox","File Handling","nobody","NEW"," ---","Change nsSpecialSystemDirectory::operator=(OS_TemporaryDirectory) to violate FHS","2016-06-22 11:24:23",,"2000-11-10 17:44:14","All",14,,,,2,"Client Software","P3",,"unspecified",3,18,
62253,"Firefox","File Handling","nobody","NEW"," ---","Option to force to save an URL explicitly","2016-06-22 11:29:29",,"2000-12-07 13:06:21","All",18,,,,2,"Client Software","P3",,"unspecified",5,8,
65770,"Firefox","File Handling","nobody","NEW"," ---","File Download not recognizing disk full [before downloading, on dismissing file picker]","2016-06-22 11:27:50",55690,"2001-01-17 14:06:28","All",46,"2001-04-22 01:44:52",,,18,"Client Software","P3",,"unspecified",16,39,
68515,"Firefox","File Handling","nobody","NEW"," ---","Use Internet Config as base for Helper Apps pref UI","2016-06-22 11:27:14","68513, 68514","2001-02-11 12:27:11","Mac OS X",16,,,,0,"Client Software","P3",,"unspecified",3,9,
87218,"Firefox","File Handling","nobody","NEW"," ---","helper app ignores user-defined application [file type]","2018-11-05 04:49:27",78943,"2001-06-21 18:04:05","Windows NT",17,,,,0,"Client Software","P3",,"unspecified",4,16,
106074,"Firefox","File Handling","nobody","NEW"," ---","Helper App Management","2018-11-05 04:49:31","86640, 106075, 106076, 106077, 106078, 106079","2001-10-22 13:10:21","All",7,,,,0,"Client Software","P3",,"unspecified",4,6,
106075,"Firefox","File Handling","nobody","NEW"," ---","Define RDF datasource interface","2018-11-05 04:49:31",,"2001-10-22 13:13:07","All",7,,,,0,"Client Software","P3",,"unspecified",3,4,
106076,"Firefox","File Handling","nobody","NEW"," ---","Win32 implementation of new RDF datasource interface","2018-11-05 04:49:31",,"2001-10-22 13:14:59","All",7,,,,0,"Client Software","P3",,"unspecified",2,4,
106077,"Firefox","File Handling","nobody","NEW"," ---","Mac OS implementation of new RDF datasource interface","2018-11-05 04:49:31",,"2001-10-22 13:15:26","All",7,,,,0,"Client Software","P3",,"unspecified",2,2,
106079,"Firefox","File Handling","nobody","NEW"," ---","Modify uriloader and uriloader\exthandler to use composite datasource","2018-11-05 04:49:31",,"2001-10-22 13:17:30","All",9,,,,0,"Client Software","P3",,"unspecified",2,5,
218257,"Firefox","File Handling","nobody","NEW"," ---","Should not be able to use Firefox for Open With","2018-10-22 03:19:10",,"2003-09-03 19:48:06","Windows",71,,,,45,"Client Software","P3",,"unspecified",14,71,
229688,"Firefox","File Handling","nobody","NEW"," ---","type description in ""opening foo"" dialog doesn't match mime type","2018-11-05 06:25:33",,"2003-12-29 15:22:59","Windows 2000",15,,,,0,"Client Software","P3",,"unspecified",1,2,
252012,"Firefox","File Handling","nobody","NEW"," ---","Won't autorun webshots photos (application/x-webshots)","2016-01-13 10:38:02",,"2004-07-18 12:02:03","Windows XP",4,,,,0,"Client Software","P3",,"unspecified",1,3,
378971,"Firefox","File Handling","nobody","NEW"," ---","Use system default ftp handler, where present","2016-01-31 19:47:35",,"2007-04-26 19:14:41","Mac OS X",14,,,,0,"Client Software","P3",,"Trunk",0,7,
395637,"Firefox","File Handling","nobody","NEW"," ---","sort alphabetically, but with common types on top, in Applications prefpane","2018-11-05 04:51:30",377784,"2007-09-10 01:31:13","All",19,,,,0,"Client Software","P3",,"Trunk",1,6,
397699,"Firefox","File Handling","nobody","NEW"," ---","Implement application selector (nsIMIMEInfo.possibleLocalHandlers) for Mac","2016-06-22 11:29:30",,"2007-09-26 14:46:07","Mac OS X",9,,,,0,"Client Software","P3",,"unspecified",1,7,
404434,"Firefox","File Handling","nobody","NEW"," ---","need icons for default handler in new protocol handling dialog","2016-06-22 11:15:10","397699, 397700","2007-11-19 18:43:50","All",18,,,,1,"Client Software","P3",,"unspecified",2,18,
408739,"Firefox","File Handling","nobody","NEW"," ---","clicking already downloading link doesn't pop dlmgr until first download is complete","2018-11-05 06:26:32",,"2007-12-17 14:53:22","All",22,,,,0,"Client Software","P3",,"unspecified",1,9,
440892,"Firefox","File Handling","nobody","NEW"," ---","network.protocol-handler.warn-external are ignored","2017-07-28 12:09:15",,"2008-06-20 17:15:00","All",17,,,,1,"Client Software","P3",,"Trunk",5,26,
646552,"Firefox","File Handling","nobody","NEW"," ---","mailto: links ignore target=""_blank""","2018-06-25 09:55:21",1116478,"2011-03-30 10:56:42","Windows 7",28,,,,1,"Client Software","P3",,"17 Branch",22,28,
1065675,"Firefox","File Handling","nobody","NEW"," ---","[e10s] An empty tab is remain opening when open pdf link with external Adobe Reader application","2018-11-05 04:54:26",,"2014-09-10 15:19:04","Windows 7",8,,,,0,"Client Software","P3",,"Trunk",2,6,
1129740,"Firefox","File Handling","nobody","NEW"," ---","Intermittent test_unsafeBidiChars.xhtml | Test timed out.","2016-09-01 11:49:44",,"2015-02-04 17:01:55","Windows XP",7,,,,0,"Client Software","P3",,"unspecified",0,0,
1222286,"Firefox","File Handling","nobody","NEW"," ---","Intermittent browser_save_video_frame.js | A promise chain failed to handle a rejection: - at chrome://mochikit/content/browser-test.js:764 - TypeError: this.SimpleTest.isExpectingUncaughtException is not a function","2017-06-13 14:54:33",1372738,"2015-11-05 18:12:39","Unspecified",3,,,,0,"Client Software","P3",,"unspecified",0,0,
1240342,"Firefox","File Handling","nobody","NEW"," ---","[e10s] Tab not closed properly if it was opened for a load that gets turned into a download","2018-11-05 04:55:29",,"2016-01-16 19:31:22","Unspecified",5,,,,0,"Client Software","P3",,"unspecified",2,2,
1252764,"Firefox","File Handling","nobody","NEW"," ---","When I click on a link for a downloadable document, Firefox does not automatically open that link. I have to select open link in new tab before it will download the document.","2016-07-25 01:24:27",,"2016-03-01 23:15:42","Unspecified",7,,,,0,"Client Software","P3",,"44 Branch",0,6,
1263176,"Firefox","File Handling","nobody","NEW"," ---","Firefox displays TWINUI instead of the app's name for Windows' Universal apps associated by extension or mime type","2017-10-02 05:47:27",,"2016-04-08 07:49:19","Windows 8",4,,,,0,"Client Software","P3",,"unspecified",0,3,
1263356,"Firefox","File Handling","nobody","NEW"," ---","Recent used external applications list (open with..) doesn't appear when downloading a file","2017-05-22 22:18:32",,"2016-04-09 01:20:35","Windows",10,,,,0,"Client Software","P3",,"unspecified",1,2,
1267869,"Firefox","File Handling","nobody","NEW"," ---","Firefox doesn't use icon (DefaultIcon) for custom protocol handlers registered via registry","2017-05-21 19:13:43",,"2016-04-26 16:15:55","All",10,,,,1,"Client Software","P3",,"46 Branch",0,7,
1270402,"Firefox","File Handling","nobody","NEW"," ---","Firefox File Handling Flow Enhancement","2018-11-05 04:56:22","1270418, 1270419","2016-05-05 01:05:47","Unspecified",5,,,,0,"Client Software","P3",,"unspecified",2,5,
1270403,"Firefox","File Handling","nobody","NEW"," ---","Firefox Protocol Handling Flow Enhancement","2018-11-05 04:56:22","1270415, 1270416","2016-05-05 01:05:56","Unspecified",4,,,,0,"Client Software","P3",,"unspecified",1,5,
1271118,"Firefox","File Handling","nobody","NEW"," ---","Prevent from creating unlimited ""Launch Application"" and ""Opening"" external software prompts","2018-05-21 09:22:50",,"2016-05-08 05:51:00","Windows 7",10,,,,2,"Client Software","P3",,"unspecified",3,10,
1278112,"Firefox","File Handling","nobody","NEW"," ---","Intermittent browser_download_always_ask_preferred_app.js | A promise chain failed to handle a rejection: - at resource://app/components/nsBrowserGlue.js:845 - TypeError: win is null","2016-07-10 03:23:14",,"2016-06-05 07:59:21","Unspecified",2,,,,0,"Client Software","P3",,"unspecified",0,1,
1287020,"Firefox","File Handling","nobody","NEW"," ---","Clean up preload 3rd party web services","2016-07-17 03:06:20",,"2016-07-14 19:50:18","Unspecified",2,,,,0,"Client Software","P3",,"unspecified",0,5,
1297912,"Firefox","File Handling","nobody","NEW"," ---","Add a regression test for ensuring that mimetype from server wouldn't affect the content-type the browser submit","2016-08-29 01:57:03",306471,"2016-08-24 19:02:48","Unspecified",5,,,,0,"Client Software","P3",,"unspecified",0,6,
1302316,"Firefox","File Handling","nobody","NEW"," ---","Entry point for end user to edit minetype-extension mapping","2016-09-30 03:21:07",,"2016-09-12 21:10:34","Unspecified",6,,,,0,"Client Software","P3",,"unspecified",0,6,
1304666,"Firefox","File Handling","nobody","NEW"," ---","Button order in Application Chooser is wrong on Windows","2017-11-16 10:30:58",,"2016-09-22 02:59:13","Unspecified",22,,,,1,"Client Software","P3",,"49 Branch",0,10,
