"Bug ID","Product","Component","Assignee","Status","Resolution","Summary","Changed","Depends on","Opened","OS","Number of Comments","Last Resolved","Last Visit","Crash Signature","Duplicate Count","Classification","Priority","Rank","Version","Votes","CC Count","Bug Interest"
1353698,"Firefox","Migration","nobody","NEW"," ---","Edge bookmarks/reading list migration should convert read: Edge reader mode URLs","2018-02-06 19:18:17",,"2017-04-05 03:51:54","Unspecified",1,,,,0,"Client Software","P3",,"Trunk",0,0,
1360253,"Firefox","Migration","nobody","NEW"," ---","Use lazy MigrationUtils getter and stop using Preferences.jsm from AutoMigrate.jsm","2017-11-13 16:36:28",,"2017-04-27 08:49:15","Unspecified",1,,,,0,"Client Software","P3",,"53 Branch",0,1,
1381081,"Firefox","Migration","nobody","NEW"," ---","INTERMITTENT: Saving bbcamerica.com bbc.com cnn.com and abv.bg to the toolbar sometimes get lost or moved to the bookmarks folder","2017-07-19 18:48:49",,"2017-07-14 11:31:23","Windows 7",6,,,,0,"Client Software","P3",,"56 Branch",0,5,
1387302,"Firefox","Migration","nobody","NEW"," ---","When importing multiple usernames/passwords for the same domain from Chrome it is hard to remember which is the default","2017-10-30 16:21:10",,"2017-08-03 18:47:20","Unspecified",2,,,,0,"Client Software","P3",,"Trunk",0,2,
1391008,"Firefox","Migration","nobody","NEW"," ---","Post-startup crash safe mode dialog recommends refresh profile too much, implications unclear","2017-09-14 14:37:03",,"2017-08-16 11:54:03","Unspecified",8,,,,0,"Client Software","P3",,"unspecified",1,5,
1393332,"Firefox","Migration","nobody","NEW"," ---","Import Saved Addresses and Credit Cards from Chrome","2017-08-30 19:37:12",,"2017-08-23 20:56:08","Unspecified",1,,,,0,"Client Software","P3",,"unspecified",1,2,
1398298,"Firefox","Migration","nobody","NEW"," ---","Offer to install UBlock or AdBlock if user had it installed in Chrome","2017-10-27 15:34:02",1410839,"2017-09-08 12:25:36","Unspecified",12,,,,0,"Client Software","P3",,"unspecified",0,16,
1398930,"Firefox","Migration","nobody","NEW"," ---","Migration of corrupt Chrome history taking 18+ hours","2017-10-25 01:30:47",,"2017-09-11 13:52:56","Unspecified",19,,,,0,"Client Software","P3",,"unspecified",0,13,
1416382,"Firefox","Migration","nobody","NEW"," ---","Auto-migration should auto-show the bookmark toolbar if some bookmarks were imported there","2017-11-10 15:27:48",,"2017-11-10 15:27:48","All",1,,,,0,"Client Software","P3",,"Trunk",0,0,
1417647,"Firefox","Migration","nobody","NEW"," ---","Don't show the refresh bar for a new profile","2017-11-15 21:58:31",,"2017-11-15 12:54:10","Unspecified",2,,,,0,"Client Software","P3",,"unspecified",0,0,
1418455,"Firefox","Migration","nobody","NEW"," ---","Remove callback from `migrate` functions for profile migration","2017-12-07 00:21:48",1338800,"2017-11-17 11:42:35","All",2,,,,0,"Client Software","P3",,"unspecified",0,0,
1418480,"Firefox","Migration","nobody","NEW"," ---","Allow specifying a maximum time per resource for profile migrations","2017-11-17 13:07:48",,"2017-11-17 13:07:48","Unspecified",1,,,,0,"Client Software","P3",,"unspecified",0,4,
1424079,"Firefox","Migration","nobody","NEW"," ---","Convert _maybeToggleBookmarkToolbarVisibility to use async Places APIs","2017-12-07 14:34:41",,"2017-12-07 14:34:41","Unspecified",1,,,,0,"Client Software","P3",,"Trunk",0,1,
1425160,"Firefox","Migration","nobody","NEW"," ---","Use GetCachedEntries instead of GetEntries from the nsCategoryCache in nsPlacesMacros.h","2017-12-13 15:55:59",,"2017-12-13 15:55:59","Unspecified",1,,,,0,"Client Software","P3",,"unspecified",0,7,
1432533,"Firefox","Migration","nobody","NEW"," ---","Avoid file.exists() --> read file antipattern in migrator code","2018-01-24 23:45:28",862127,"2018-01-23 09:26:17","All",1,,,,0,"Client Software","P3",,"unspecified",0,4,
1436327,"Firefox","Migration","nobody","NEW"," ---"," @mozilla.org/profile/migrator/iehistoryenumerator;1 service is not tested","2018-02-26 17:06:43",,"2018-02-07 04:24:40","Unspecified",1,,,,0,"Client Software","P3",,"Trunk",1,0,
1438972,"Firefox","Migration","nobody","NEW"," ---","Make non-Chrome profile migrator IO async","2018-03-28 09:26:06",862127,"2018-02-16 11:44:51","Unspecified",2,,,,1,"Client Software","P3",,"Trunk",0,2,
1442271,"Firefox","Migration","nobody","NEW"," ---","Cookie imports fail on newer versions of Chrome and/or Linux","2018-03-07 08:17:30",,"2018-03-01 07:22:30","Unspecified",3,,,,0,"Client Software","P3",,"Trunk",0,2,
1495010,"Firefox","Migration","nobody","NEW"," ---","Closing Firefox after migration leads to a crash","2018-10-23 15:05:36",,"2018-09-28 09:13:53","Windows",8,,,"[@ AsyncShutdownTimeout | profile-change-teardown | Extension shutdown: formautofill@mozilla.org]",0,"Client Software","P3",,"Trunk",0,4,
670989,"Firefox","Migration","nobody","NEW"," ---","Breakdown - Offer Firefox Sync as a Migration option when starting a new profile","2016-05-20 09:13:56",,"2011-07-12 10:44:56","Windows 7",12,,,,1,"Client Software","P4",,"unspecified",3,20,
1284106,"Firefox","Migration","nobody","NEW"," ---","Make possible import data from (new) Opera","2017-11-13 16:40:06",,"2016-07-03 14:02:00","Unspecified",1,,,,0,"Client Software","P5",,"47 Branch",1,1,
1360472,"Firefox","Migration","nobody","NEW"," ---","If a user signs into their Firefox Account on first run we should automatically undo any automigrated data","2017-07-26 23:21:54",,"2017-04-28 01:07:04","Unspecified",3,,,,0,"Client Software","P5",,"53 Branch",1,4,
1392396,"Firefox","Migration","nobody","NEW"," ---","Intermittent browser/components/migration/tests/unit/test_IE_bookmarks.js |  - Got all the expected parents - 1 == 0","2017-10-26 06:24:31",,"2017-08-21 13:31:30","Unspecified",29,,,,0,"Client Software","P5",,"unspecified",0,8,
1416120,"Firefox","Migration","nobody","NEW"," ---","Intermittent browser/components/migration/tests/browser/browser_undo_notification_wording.js | leaked 4 window(s) until shutdown [url = about:home]","2017-11-26 17:25:12",,"2017-11-09 21:07:09","Unspecified",4,,,,0,"Client Software","P5",,"unspecified",0,0,
248352,"Firefox","Migration","asaf","ASSIGNED"," ---","Preserve sort order when migrating bookmarks from IE","2015-07-27 23:17:32",,"2004-06-23 10:29:57","Windows",14,,,,8,"Client Software"," --",,"Trunk",6,15,
718280,"Firefox","Migration","asaf","ASSIGNED"," ---","deCOM migrators","2018-11-05 04:53:11","710259, 710895, 718586, 718608, 737804","2012-01-15 05:31:34","All",10,,,,0,"Client Software","P3",,"unspecified",2,5,
1360109,"Firefox","Migration","bmao","ASSIGNED"," ---","[UX] Auto-migration UX Spec","2017-08-03 08:18:04",1360472,"2017-04-26 23:23:25","Unspecified",3,,,,0,"Client Software","P5",,"54 Branch",1,10,
1415911,"Firefox","Migration","dothayer","ASSIGNED"," ---","Intermittent browser/components/migration/tests/unit/test_MigrationUtils_timedRetry.js | testgetRowsFromDBWithoutLocksRetries - [testgetRowsFromDBWithoutLocksRetries : 253] A promise chain failed to handle a rejection: Error(s) encountered during statemen","2018-11-04 23:11:41",,"2017-11-09 08:05:33","Unspecified",55,,,,1,"Client Software","P5",,"unspecified",0,2,
461908,"Firefox","Migration","nobody","REOPENED"," ---","Import manager misplacement of ""Next"" and ""Finish""","2013-02-25 16:07:29",,"2008-10-27 20:38:04","Windows XP",4,"2013-02-25 23:46:26",,,0,"Client Software"," --",,"Trunk",0,2,
1440193,"Firefox","Migration","nobody","REOPENED"," ---","Intermittent browser/components/migration/tests/marionette/test_refresh_firefox.py TestFirefoxRefresh.testReset | application crashed [@ MOZ_CrashOOL]","2018-10-01 00:07:36",,"2018-02-21 19:16:57","Unspecified",14,"2018-06-11 23:41:40",,"[@ MOZ_CrashOOL]",0,"Client Software","P5",,"unspecified",0,1,