"Bug ID","Product","Component","Assignee","Status","Resolution","Summary","Changed","Depends on","Opened","OS","Number of Comments","Last Resolved","Last Visit","Crash Signature","Duplicate Count","Classification","Priority","Rank","Version","Votes","CC Count","Bug Interest"
840908,"Firefox","Migration","nobody","UNCONFIRMED"," ---","import of favorites from IExplores only brings in the first folder","2013-02-18 03:03:19",,"2013-02-13 01:06:19","Windows 7",6,,,,0,"Client Software"," --",,"18 Branch",0,2,
1202922,"Firefox","Migration","nobody","UNCONFIRMED"," ---","Importing Safari Accessibility settings - minimum font size","2018-05-02 11:16:41",,"2015-09-08 17:10:46","Mac OS X",5,,,,0,"Client Software"," --",,"40 Branch",0,1,
1351171,"Firefox","Migration","nobody","UNCONFIRMED"," ---","Following Firefox Refresh, login info doesn't appear. FF restart is needed.","2017-03-28 09:22:49",,"2017-03-27 20:53:47","Unspecified",3,,,,0,"Client Software"," --",,"Trunk",0,1,
1362369,"Firefox","Migration","nobody","UNCONFIRMED"," ---","firefox doesn't ask to import bookmarks on first run","2017-12-07 00:30:03",,"2017-05-05 05:05:22","Unspecified",3,,,,0,"Client Software"," --",,"55 Branch",0,0,
1372204,"Firefox","Migration","nobody","UNCONFIRMED"," ---","Import from Chrome incorrectly handles non-ASCII characters in login and password","2017-12-14 08:09:24",,"2017-06-12 05:53:02","Unspecified",3,,,,0,"Client Software","P2",,"53 Branch",0,1,
1425231,"Firefox","Migration","nobody","UNCONFIRMED"," ---","imported bookmark from google chrome disappear after restart Firefox;workaround found","2018-04-13 15:41:09",,"2017-12-14 06:47:04","Unspecified",4,,,,0,"Client Software","P3",,"57 Branch",0,2,
764761,"Firefox","Migration","asaf","NEW"," ---","Cleanup migration start-up path","2012-06-14 03:54:26",,"2012-06-14 03:53:50","All",1,,,,0,"Client Software"," --",,"unspecified",0,0,
706017,"Firefox","Migration","m_kato","NEW"," ---","test harness for Google Chrome migration","2015-10-31 17:35:44",,"2011-11-29 01:09:50","All",6,,,,0,"Client Software"," --",,"Trunk",0,9,
707601,"Firefox","Migration","m_kato","NEW"," ---","Rewrite Opera profile migration in js","2017-08-10 13:58:04","539133, 718608","2011-12-04 20:43:22","All",10,,,,4,"Client Software"," --",,"Trunk",2,14,
270045,"Firefox","Migration","nobody","NEW"," ---","IE cookie import assumes domain cookies, leading to duplicates","2015-05-07 00:06:11",,"2004-11-15 13:29:00","All",15,"2005-10-13 17:16:08",,,1,"Client Software"," --",,"Trunk",2,5,
313797,"Firefox","Migration","nobody","NEW"," ---","Start Page confirmation should provide confirmation after setting has been imported","2011-08-05 21:26:10",,"2005-10-25 13:44:35","Mac OS X",1,,,,0,"Client Software"," --",,"1.5.0.x Branch",2,3,
326701,"Firefox","Migration","nobody","NEW"," ---","Import from Safari does not import favicons","2012-05-08 08:48:57",,"2006-02-10 11:35:59","Mac OS X",4,,,,0,"Client Software"," --",,"Trunk",0,7,
330539,"Firefox","Migration","nobody","NEW"," ---","import sequence should indicate to user when user is committing to import","2012-04-24 16:07:49",,"2006-03-14 22:59:51","All",2,,,,0,"Client Software"," --",,"unspecified",0,2,
363488,"Firefox","Migration","nobody","NEW"," ---","saved form history not imported from safari","2012-04-15 06:47:06",344284,"2006-12-11 13:16:22","Mac OS X",3,,,,0,"Client Software"," --",,"Trunk",0,8,
405217,"Firefox","Migration","nobody","NEW"," ---","when migrating from IE, don't import default IE bookmarks if we can determine that the user hasn't used IE (or IE's bookmarks?)","2011-04-07 13:13:21",,"2007-11-24 08:13:52","Windows XP",1,,,,0,"Client Software"," --",,"Trunk",1,2,
415968,"Firefox","Migration","nobody","NEW"," ---","Inconsistent Migration Behavior on non-Vista/XP VMS","2013-02-27 17:14:11",,"2008-02-06 12:14:09","Windows Vista",12,,,,1,"Client Software"," --",,"Trunk",1,9,
429479,"Firefox","Migration","nobody","NEW"," ---","During post-startup migration, Firefox settings which were already set by the user should not be overridden","2012-04-24 16:11:51",,"2008-04-17 05:04:53","All",3,,,,0,"Client Software"," --",,"Trunk",0,4,
454008,"Firefox","Migration","nobody","NEW"," ---","[meta] Support for migration from Google Chrome","2018-04-21 19:49:20","505192, 589589, 674168, 706733, 707044","2008-09-06 14:51:06","All",4,,,,3,"Client Software"," --",,"Trunk",11,18,
455008,"Firefox","Migration","nobody","NEW"," ---","EnableLUA=1 on XP causes IE cookie migration to fail","2012-04-18 15:20:29",,"2008-09-12 07:53:27","Windows XP",18,,,,0,"Client Software"," --",,"3.0 Branch",0,5,
468709,"Firefox","Migration","nobody","NEW"," ---","""start fresh"" option for returning Firefox users to migrate from another browser","2014-05-31 22:11:22",,"2008-12-09 13:50:08","All",3,,,,0,"Client Software"," --",,"unspecified",1,7,
488130,"Firefox","Migration","nobody","NEW"," ---","Search box search providers not migrated from IE","2013-05-08 11:32:54",,"2009-04-13 09:28:38","Windows XP",2,,,,0,"Client Software"," --",,"Trunk",1,7,
537930,"Firefox","Migration","nobody","NEW"," ---","Import of IE bookmarks have .URL extension","2014-06-30 01:38:12",,"2010-01-05 07:16:59","All",12,,,,1,"Client Software"," --",,"Trunk",1,7,
538654,"Firefox","Migration","nobody","NEW"," ---","Investigate real-time migration of password data from IE","2016-04-04 19:52:13",,"2010-01-08 12:25:19","Windows 7",2,,,,0,"Client Software"," --",,"unspecified",2,8,
546588,"Firefox","Migration","nobody","NEW"," ---","first-ever run importer experience is awful","2013-12-14 03:35:30",,"2010-02-16 22:53:56","Windows 7",3,,,,0,"Client Software"," --",,"unspecified",1,6,
589589,"Firefox","Migration","nobody","NEW"," ---","Breakdown: Chrome profile migration for Import Wizard and Migration Assistant - passwords, form data, and settings","2017-12-06 12:39:31","505192, 707044, 718608, 744919, 1423714","2010-08-22 12:12:39","All",22,"2011-04-26 15:46:08",,,1,"Client Software"," --",,"Trunk",21,25,
700898,"Firefox","Migration","nobody","NEW"," ---","test harness for migration tools (Opera, IE, Safari and etc)","2013-05-25 17:22:09",706017,"2011-11-08 18:49:43","All",1,,,,0,"Client Software"," --",,"Trunk",0,7,
706008,"Firefox","Migration","nobody","NEW"," ---","Migrators should notify users on Migration:ItemError to warn on incomplete migration","2017-04-10 08:22:04",,"2011-11-29 00:32:55","All",3,,,,1,"Client Software"," --",,"Trunk",0,3,
711995,"Firefox","Migration","nobody","NEW"," ---","Favicons are not loaded for imported Chrome bookmark pages","2018-09-03 01:05:39",,"2011-12-19 07:50:01","All",3,,,,0,"Client Software"," --",,"Trunk",0,4,
713818,"Firefox","Migration","nobody","NEW"," ---","Sort out ""safe opening"" of downloads story for people migrating from Safari","2015-03-19 08:21:45",,"2011-12-28 00:27:47","All",2,,,,0,"Client Software"," --",,"unspecified",0,2,
713820,"Firefox","Migration","nobody","NEW"," ---","New Safari Migrator: Top Sites and Reading List issues","2012-01-20 14:18:13",,"2011-12-28 01:17:21","Mac OS X",3,,,,0,"Client Software"," --",,"unspecified",1,2,
715315,"Firefox","Migration","nobody","NEW"," ---","Ensure source Firefox profile is not in use during migration","2012-05-10 12:27:27",,"2012-01-04 13:32:38","All",4,,,,0,"Client Software"," --",,"unspecified",1,4,
716557,"Firefox","Migration","nobody","NEW"," ---","Unable to select which items to import from another browser when running Firefox for the first time","2015-07-27 22:33:41",,"2012-01-09 08:18:50","All",3,,,,0,"Client Software"," --",,"10 Branch",0,3,
718220,"Firefox","Migration","nobody","NEW"," ---","IE migrator should import favicons","2012-04-18 14:08:34",,"2012-01-14 12:32:43","Windows Vista",2,,,,0,"Client Software"," --",,"unspecified",0,1,
719321,"Firefox","Migration","nobody","NEW"," ---","Update list of migrated IE prefs","2012-04-18 14:04:56",710895,"2012-01-18 20:17:32","Windows 7",6,,,,0,"Client Software"," --",,"unspecified",0,2,
725904,"Firefox","Migration","nobody","NEW"," ---","Firefox Reset: handle when Sync is set up in source profile","2014-03-26 16:28:24",,"2012-02-09 17:49:32","All",6,,,,1,"Client Software"," --",,"unspecified",3,11,
731144,"Firefox","Migration","nobody","NEW"," ---","Too hard to find how to migrate from another browser if you missed the first-time train","2017-12-04 21:56:21",,"2012-02-28 01:20:11","Mac OS X",7,,,,2,"Client Software"," --",,"unspecified",1,7,
735568,"Firefox","Migration","nobody","NEW"," ---","Add return value to Migrate and check it during profile reset migration.","2017-08-18 07:46:40",,"2012-03-13 21:31:23","All",7,,,,0,"Client Software"," --",,"Trunk",1,3,
737804,"Firefox","Migration","nobody","NEW"," ---","Implement regular/periodic/automatic background migration, replacing the wizard with a simple dialog asking what types of data to import","2016-12-05 18:55:48",1187190,"2012-03-21 04:14:06","All",5,,,,2,"Client Software"," --",,"unspecified",3,5,
737861,"Firefox","Migration","nobody","NEW"," ---","New Safari Migrator: Thumbnails for Top Sites","2012-03-26 04:56:06",710259,"2012-03-21 07:32:39","Mac OS X",5,,,,0,"Client Software"," --",,"unspecified",0,1,
743196,"Firefox","Migration","nobody","NEW"," ---","Investigate if Chrome migrator time conversion may hit the js uint64 limit","2012-04-06 03:30:28",,"2012-04-06 03:30:28","All",1,,,,0,"Client Software"," --",,"unspecified",0,1,
756390,"Firefox","Migration","nobody","NEW"," ---","""Reset Firefox"" doesn't show up for rebranding and ff-on-xr","2016-03-21 23:50:16",,"2012-05-18 01:40:57","All",7,,,,0,"Client Software"," --",,"13 Branch",0,4,
825558,"Firefox","Migration","nobody","NEW"," ---","Windows version does not import *all* bookmarks/settings from IE","2014-06-26 08:52:29",829995,"2012-12-30 19:32:16","Windows 7",13,,,,1,"Client Software"," --",,"unspecified",2,4,
835515,"Firefox","Migration","nobody","NEW"," ---","Nightly becomes unresponsive when importing months of history from Chrome","2017-08-02 13:01:03",,"2013-01-28 12:32:50","Windows 8",8,,,,0,"Client Software"," --",,"Trunk",0,3,
888560,"Firefox","Migration","nobody","NEW"," ---","Offer to re-migrate a user's profile if it's gone unused for months","2016-04-07 22:50:45",498181,"2013-06-28 19:39:07","All",2,,,,1,"Client Software"," --",,"unspecified",1,1,
915126,"Firefox","Migration","nobody","NEW"," ---","Resetting Firefox with about:welcomeback open doesn't work well","2018-10-31 07:30:25",,"2013-09-11 05:26:24","All",2,,,,0,"Client Software"," --",,"25 Branch",0,2,
927393,"Firefox","Migration","nobody","NEW"," ---","Should fire quit-application-requested before resetting Firefox","2013-10-16 08:33:04",,"2013-10-16 06:53:34","Mac OS X",1,,,,0,"Client Software"," --",,"unspecified",0,3,
929450,"Firefox","Migration","nobody","NEW"," ---","Firefox sometimes doesn't reopen after Resetting Firefox","2018-11-11 14:34:41",,"2013-10-22 05:45:27","Linux",13,,,,0,"Client Software"," --",,"unspecified",0,10,
946757,"Firefox","Migration","nobody","NEW"," ---","Failed to import visit count history from Chrome","2014-07-29 03:06:24",,"2013-12-05 08:17:00","All",5,"2014-01-07 08:04:02",,,0,"Client Software"," --",,"Trunk",1,2,
1042981,"Firefox","Migration","nobody","NEW"," ---","library: importing settings from other browser, ""finish"" button does not close the wizard","2018-03-02 08:45:34",,"2014-07-23 15:05:18","Windows 7",2,,,,0,"Client Software"," --",,"31 Branch",0,2,
1053569,"Firefox","Migration","nobody","NEW"," ---","Improve the UX of the dialog shown during a reset","2014-09-22 10:07:03",,"2014-08-13 17:24:10","All",2,,,,0,"Client Software"," --",,"32 Branch",1,3,
1098304,"Firefox","Migration","nobody","NEW"," ---","Unable to load pages if 'Restore ony the ones you want' option is enabled in about:welcomeback","2015-11-07 06:52:50",,"2014-11-13 05:42:43","All",10,,,,0,"Client Software"," --",,"36 Branch",0,8,
1127623,"Firefox","Migration","nobody","NEW"," ---","Extra space below the tab list on about:welcomeback (maybe about:sessionrestore too?)","2016-01-26 02:09:15",,"2015-01-29 17:02:01","Mac OS X",2,,,,0,"Client Software"," --",,"unspecified",0,2,
1128510,"Firefox","Migration","nobody","NEW"," ---","Refresh Firefox should save a human-readable list of the previously-installed addons too","2015-02-02 09:13:10",,"2015-02-02 06:21:56","All",2,,,,0,"Client Software"," --",,"unspecified",0,2,
1129021,"Firefox","Migration","nobody","NEW"," ---","Reconsider what is migrated from Safari","2015-02-04 13:35:01",,"2015-02-03 09:39:34","All",3,,,,0,"Client Software"," --",,"Trunk",0,3,
1139682,"Firefox","Migration","nobody","NEW"," ---","Implement new migration panel design","2015-11-07 06:53:10",1126319,"2015-03-04 16:06:30","All",2,,,,0,"Client Software"," --",,"39 Branch",2,3,
1143175,"Firefox","Migration","nobody","NEW"," ---","Add the ability to display a message screen for Mac & Linux to the migrator","2015-11-07 06:52:18",1103164,"2015-03-13 14:41:36","Mac OS X",1,,,,0,"Client Software"," --",,"39 Branch",0,2,
1159732,"Firefox","Migration","nobody","NEW"," ---","No option to import data from other browsers when Developer Edition starts-up and there are no profiles","2018-09-05 15:05:47",,"2015-04-29 07:16:47","All",2,,,,0,"Client Software"," --",,"39 Branch",0,2,
1162397,"Firefox","Migration","nobody","NEW"," ---","Check that the Chrome migrator is doing the correct thing with domain vs. host cookies","2015-05-07 05:31:25",505192,"2015-05-07 00:06:11","All",1,,,,0,"Client Software"," --",,"unspecified",0,2,
1163165,"Firefox","Migration","nobody","NEW"," ---","Decrypt Google Chrome cookies on Windows","2018-03-01 12:43:57",,"2015-05-08 14:05:51","Windows",1,,,,0,"Client Software"," --",,"unspecified",0,0,
1163166,"Firefox","Migration","nobody","NEW"," ---","Decrypt Google Chrome cookies on OS X","2018-03-01 12:43:57",,"2015-05-08 14:07:16","Mac OS X",1,,,,0,"Client Software"," --",,"unspecified",0,0,
1163167,"Firefox","Migration","nobody","NEW"," ---","Decrypt Google Chrome cookies on Linux","2018-03-01 12:43:57",,"2015-05-08 14:08:21","Linux",1,,,,0,"Client Software"," --",,"unspecified",0,0,
1171683,"Firefox","Migration","nobody","NEW"," ---","Propose Similar Add-ons to Those Used in Other Browser","2017-12-20 22:54:43",,"2015-06-04 13:35:34","All",3,,,,2,"Client Software"," --",,"unspecified",0,2,
1191175,"Firefox","Migration","nobody","NEW"," ---","Password Import from IE not available for HTTP basic authentication","2016-12-05 18:55:57",,"2015-08-04 20:30:11","Windows",3,,,,0,"Client Software"," --",,"unspecified",1,3,
1199759,"Firefox","Migration","nobody","NEW"," ---","Keep track of errors in Edge reading list migration with keyed histogram","2015-08-28 12:23:28",,"2015-08-28 12:23:28","Unspecified",1,,,,0,"Client Software"," --",,"Trunk",0,1,
1202978,"Firefox","Migration","nobody","NEW"," ---","Refactor MSMigrationUtils ctypes helpers","2015-09-15 13:16:57",,"2015-09-08 21:56:55","Unspecified",1,,,,0,"Client Software"," --",,"unspecified",0,1,
1207189,"Firefox","Migration","nobody","NEW"," ---","Consider using TypedURLsVisitCount for MS Edge typedURL migration","2015-09-22 08:32:37",1205053,"2015-09-22 08:32:37","Unspecified",1,,,,0,"Client Software"," --",,"Trunk",0,1,
1209034,"Firefox","Migration","nobody","NEW"," ---","[Windows] Bookmarks are not migrated while importing data from about:preferences#security","2015-09-28 06:11:55",,"2015-09-28 06:11:55","Windows",1,,,,0,"Client Software"," --",,"Trunk",0,1,
1209048,"Firefox","Migration","nobody","NEW"," ---","[Windows] The default browser is not automatically selected while importing data from about:preferences#security","2015-09-28 06:35:16",,"2015-09-28 06:35:16","Windows",1,,,,0,"Client Software"," --",,"Trunk",0,1,
1213284,"Firefox","Migration","nobody","NEW"," ---","Favicons not imported from Edge","2015-10-09 06:51:18",,"2015-10-09 06:51:18","Windows 10",1,,,,0,"Client Software"," --",,"Trunk",0,0,
1213294,"Firefox","Migration","nobody","NEW"," ---","The imported passwords are not displayed in Saved Passwords window","2015-10-09 08:19:45",,"2015-10-09 07:18:24","Windows",1,,,,0,"Client Software"," --",,"Trunk",0,1,
1213303,"Firefox","Migration","nobody","NEW"," ---","Bookmark folder that contains the imported reading list items has the same name as the imported bookmarks folder","2015-10-09 08:19:47",,"2015-10-09 07:46:32","Windows 10",1,,,,0,"Client Software"," --",,"42 Branch",0,1,
1213861,"Firefox","Migration","nobody","NEW"," ---","An empty folder is imported if there are no bookmarks in Edge/IE favorites toolbar","2015-10-12 07:27:12",,"2015-10-12 07:27:12","All",1,,,,0,"Client Software"," --",,"Trunk",0,0,
1214154,"Firefox","Migration","nobody","NEW"," ---","Investigate migration error rates after bug 731025 has had enough time to gather data","2017-09-01 13:53:21",,"2015-10-13 03:47:40","Unspecified",8,,,,0,"Client Software"," --",,"Trunk",0,4,
1216186,"Firefox","Migration","nobody","NEW"," ---","Chromium and Canary bookmarks are imported into ""From Google Chrome"" on non-startup migration","2015-10-20 07:35:24",,"2015-10-19 09:00:10","All",2,,,,0,"Client Software"," --",,"unspecified",0,2,
1217599,"Firefox","Migration","nobody","NEW"," ---","Audit other browser profile migrators for not reporting errors with the migration","2016-09-15 16:48:31",731025,"2015-10-22 14:28:57","Unspecified",5,,,,0,"Client Software"," --",,"Trunk",0,3,
1225466,"Firefox","Migration","nobody","NEW"," ---","Several issues with Edge migration on newer builds of Windows 10","2018-01-26 03:06:14","1225798, 1225800, 1226198, 1226556, 1229076, 1237679","2015-11-17 06:04:01","Windows 10",15,,,,0,"Client Software"," --",,"Trunk",1,7,
1226036,"Firefox","Migration","nobody","NEW"," ---","Don't offer to import from Safari if the only thing I've used Safari for is to download Firefox","2016-03-02 05:52:41",,"2015-11-18 15:38:00","Unspecified",3,,,,0,"Client Software"," --",,"Trunk",0,2,
1239715,"Firefox","Migration","nobody","NEW"," ---","Migration of Safari user-created Bookmark-folders broken","2016-01-14 08:52:29",,"2016-01-14 08:52:29","Mac OS X",1,,,,0,"Client Software"," --",,"46 Branch",0,0,
1270296,"Firefox","Migration","nobody","NEW"," ---","Record in FX_MIGRATION_SOURCE_BROWSER when the migration window closes or is cancelled","2016-05-04 15:51:58",,"2016-05-04 15:51:58","All",1,,,,0,"Client Software"," --",,"Trunk",0,0,
1276998,"Firefox","Migration","nobody","NEW"," ---","Add-ons are restored after Refresh if sync is enabled","2016-06-08 10:52:59",,"2016-05-31 09:34:45","Unspecified",13,,,,0,"Client Software"," --",,"unspecified",1,6,
1283557,"Firefox","Migration","nobody","NEW"," ---","Migration from IE doesn't work (broken) on win64 builds of Firefox (win10?)","2016-06-30 10:31:44",,"2016-06-30 10:31:44","Unspecified",1,,,,0,"Client Software"," --",,"50 Branch",0,3,
1289217,"Firefox","Migration","nobody","NEW"," ---","Importing large history from Chrome causes Firefox to freeze","2016-10-12 02:19:28",,"2016-07-25 13:02:18","Mac OS X",5,,,,0,"Client Software"," --",,"50 Branch",0,3,
1332225,"Firefox","Migration","nobody","NEW"," ---","[meta] Investigate Firefox hanging while importing bookmarks/history/passwords from Google Chrome","2018-02-16 07:59:30","1249008, 1338522, 1338800, 1338812, 1339413, 1341097, 1344282, 1344759, 1346796, 1346979, 1347530, 1414892, 1417266, 1418443, 1418455, 1418480, 1421701, 1421703, 1421704, 1425160, 1426245, 1426721","2017-01-19 01:35:54","Unspecified",36,,,,0,"Client Software"," --",,"51 Branch",3,12,
1353792,"Firefox","Migration","nobody","NEW"," ---","Notification about autoimport/automigration of data from a different browser mentions ""these sites"" even on about:home","2017-04-05 09:55:48",,"2017-04-05 09:51:35","Unspecified",2,,,,0,"Client Software"," --",,"54 Branch",0,2,
1357448,"Firefox","Migration","nobody","NEW"," ---","Lower limits for Chrome history imports","2017-10-25 02:31:27",1340115,"2017-04-18 08:36:20","Unspecified",1,,,,0,"Client Software"," --",,"53 Branch",0,4,
1361450,"Firefox","Migration","nobody","NEW"," ---","Remove the existing notification bar from migration","2017-05-02 11:02:47",1361286,"2017-05-02 11:02:47","Unspecified",1,,,,0,"Client Software"," --",,"unspecified",0,0,
1457487,"Firefox","Migration","nobody","NEW"," ---","[32bit] Firefox starts with one blank page after migrating from any browser","2018-05-16 03:18:12",,"2018-04-27 08:28:25","Windows",8,,,,0,"Client Software"," --",,"Trunk",0,1,
1474700,"Firefox","Migration","nobody","NEW"," ---","add a browse button for the import wizard","2018-07-10 12:50:08",,"2018-07-10 12:49:18","Unspecified",1,,,,0,"Client Software"," --",,"unspecified",0,0,
1485286,"Firefox","Migration","nobody","NEW"," ---","Import Chrome's mobile bookmarks when running migration","2018-08-22 01:29:11",,"2018-08-22 01:29:11","Unspecified",1,,,,0,"Client Software"," --",,"Trunk",0,2,
1017919,"Firefox","Migration","nobody","NEW"," ---","Reset Firefox: Preserve extensions but disable all of them","2018-07-19 14:50:16","888624, 1053594","2014-05-29 17:15:21","All",20,,,,3,"Client Software","P2",,"Trunk",5,18,
1018667,"Firefox","Migration","nobody","NEW"," ---","Create a plan for accessing/importing Safari passwords (from OS X Keychain)","2018-11-02 09:27:02",,"2014-05-31 21:40:43","Mac OS X",12,,,,0,"Client Software","P2",,"unspecified",6,21,
1163644,"Firefox","Migration","nobody","NEW"," ---","Data importers/migrators for Microsoft Edge browser","2018-11-05 06:07:20","1179346, 1192032, 1192034, 1192035, 1192036, 1192037, 1192039, 1193387, 1194443, 1199678, 1200849, 1205053, 1225466, 1225798, 1225800","2015-05-11 08:41:08","Windows 10",22,,,,1,"Client Software","P2",,"unspecified",3,18,
1236916,"Firefox","Migration","nobody","NEW"," ---","[MAC] History not imported anymore from Safari 8 on","2018-09-05 15:04:18",,"2016-01-05 06:03:49","Mac OS X",7,,,,0,"Client Software","P2",,"Trunk",0,5,
1421485,"Firefox","Migration","nobody","NEW"," ---","Imported chrome browsing history ignores visit_count and shows recently visited history instead of top sites","2017-12-10 09:43:03",1332225,"2017-11-28 17:12:15","Unspecified",9,,,,0,"Client Software","P2",,"Trunk",0,4,
1423714,"Firefox","Migration","nobody","NEW"," ---","Import logins from Chrome on OS X","2017-12-17 10:07:57",,"2017-12-06 12:39:31","Mac OS X",1,,,,0,"Client Software","P2",,"Trunk",0,3,
1493103,"Firefox","Migration","nobody","NEW"," ---","[Mac 10.14] Data Migration from Safari is not working due to lack of ""Full Disk Access"" permission","2018-10-22 14:45:13",,"2018-09-21 01:37:07","Mac OS X",21,,,,0,"Client Software","P2",,"Trunk",1,4,
712240,"Firefox","Migration","asaf","NEW"," ---","Safari migrator does not import cookies","2018-11-05 04:53:11",716837,"2011-12-20 02:01:35","Mac OS X",13,,,,1,"Client Software","P3",,"unspecified",0,4,
490009,"Firefox","Migration","nobody","NEW"," ---","Migration wizard isn't launched after initial installation of Firefox","2018-11-05 04:51:57",,"2009-04-24 10:02:46","Windows XP",26,,,,0,"Client Software","P3",,"3.5 Branch",1,11,
1114565,"Firefox","Migration","nobody","NEW"," ---","Refreshing Firefox twice in a row will not delete the old profile and will not restart Firefox","2017-10-25 14:18:44",,"2014-12-22 04:59:28","All",4,,,,0,"Client Software","P3",,"35 Branch",1,5,
1192039,"Firefox","Migration","nobody","NEW"," ---","Import form data from Microsoft Edge","2015-08-20 09:02:45",,"2015-08-06 15:14:47","Unspecified",2,,,,0,"Client Software","P3",,"Trunk",1,1,
1248077,"Firefox","Migration","nobody","NEW"," ---","[QX cluster] Improvements to the importer for onboarding","2018-11-05 04:55:29","1271766, 1271774, 1271775, 1271778, 1271798, 1271799, 1271800, 1275114, 1276694, 1277294, 1279501, 1281256, 1285574, 1297479, 1343076","2016-02-12 14:59:33","All",3,,,,0,"Client Software","P3",,"unspecified",1,6,
1271778,"Firefox","Migration","nobody","NEW"," ---","[UX] Come up with a design for how to surface the fact that data has been automatically migrated (including any errors?) and offer the user an opt-out","2018-11-05 04:56:40",,"2016-05-10 13:43:43","Unspecified",6,,,,0,"Client Software","P3",,"Trunk",2,4,
1271800,"Firefox","Migration","nobody","NEW"," ---","Flip the pref on automatic migration from other browsers on startup","2018-11-05 04:56:40","1271775, 1271778, 1271799, 1277294, 1279240, 1285041, 1285574, 1285575, 1285577, 1289172, 1309613, 1343076","2016-05-10 14:25:40","Unspecified",2,,,,0,"Client Software","P3",,"Trunk",1,4,
1277294,"Firefox","Migration","nobody","NEW"," ---","Avoid showing the migration dialog if there are multiple profiles to import from and surface import post-startup","2018-11-05 04:56:41",1271775,"2016-06-01 09:49:54","Unspecified",2,,,,0,"Client Software","P3",,"Trunk",1,1,
1279589,"Firefox","Migration","nobody","NEW"," ---","Add telemetry probes for migrator runtime","2016-09-12 17:54:34",,"2016-06-10 11:22:22","Unspecified",2,,,,0,"Client Software","P3",,"Trunk",0,1,
1285574,"Firefox","Migration","nobody","NEW"," ---","Decide what to do when (a) we can't determine the default browser or (b) the default browser doesn't have data (fall back to other browsers?)","2018-11-05 04:57:04",,"2016-07-08 08:40:24","Unspecified",2,,,,0,"Client Software","P3",,"Trunk",1,2,
1290495,"Firefox","Migration","nobody","NEW"," ---","Refresh prompt shows up on reinstall even after profile is deleted","2016-08-13 08:41:05",,"2016-07-29 08:40:04","Unspecified",6,,,,0,"Client Software","P3",,"unspecified",0,4,
1332219,"Firefox","Migration","nobody","NEW"," ---","Handle Chrome password imports using data scheme types >2","2017-12-06 12:41:51",,"2017-01-19 01:27:51","Unspecified",1,,,,0,"Client Software","P3",,"51 Branch",0,2,
1346205,"Firefox","Migration","nobody","NEW"," ---","FX_MIGRATION_ERRORS records values using empty keys","2017-05-19 03:42:47",,"2017-03-10 05:25:39","All",15,,,,0,"Client Software","P3",,"Trunk",0,3,
