"Bug ID","Product","Component","Assignee","Status","Resolution","Summary","Changed","Depends on","Opened","OS","Number of Comments","Last Resolved","Last Visit","Crash Signature","Duplicate Count","Classification","Priority","Rank","Version","Votes","CC Count","Bug Interest"
461145,"Firefox","Page Info Window","nobody","UNCONFIRMED"," ---","show more information about loaded javascript and stylesheets","2011-10-02 02:53:29",,"2008-10-22 05:56:22","Windows XP",5,,,,0,"Client Software"," --",,"unspecified",0,1,
582670,"Firefox","Page Info Window","nobody","UNCONFIRMED"," ---","There should be an option under Page Info/Permissions to block JavaScript for that particular domain.","2011-10-01 03:21:26",,"2010-07-28 11:01:26","Linux",2,,,,0,"Client Software"," --",,"unspecified",1,1,
603904,"Firefox","Page Info Window","nobody","UNCONFIRMED"," ---","Page Info counts meta tags in xml document but doesn't show them","2012-01-05 16:48:18",,"2010-10-13 02:48:06","All",2,,,,0,"Client Software"," --",,"Trunk",0,0,
630831,"Firefox","Page Info Window","nobody","UNCONFIRMED"," ---","Page Info ▸ Security ▸ View Cookies shows cookies from other sites within same 2nd level domain","2012-03-25 13:07:51",,"2011-02-02 03:52:45","Linux",4,"2012-03-17 04:50:40",,,0,"Client Software"," --",,"Trunk",0,0,
635887,"Firefox","Page Info Window","nobody","UNCONFIRMED"," ---","cookies list about 1st lvl domains, not about 2nd lvl doms","2011-02-28 03:46:09",,"2011-02-22 06:28:59","Windows XP",3,,,,0,"Client Software"," --",,"3.6 Branch",0,1,
746436,"Firefox","Page Info Window","nobody","UNCONFIRMED"," ---","Add Internet Protocol version (IPv4 or IPv6) to Page Info","2012-04-17 20:21:18",,"2012-04-17 19:16:41","All",2,,,,0,"Client Software"," --",,"unspecified",1,1,
808356,"Firefox","Page Info Window","nobody","UNCONFIRMED"," ---","A quick access to media download is required","2012-11-06 04:27:07",,"2012-11-03 20:24:28","Windows 7",1,,,,0,"Client Software"," --",,"16 Branch",0,1,
881472,"Firefox","Page Info Window","nobody","UNCONFIRMED"," ---","Address/Type scrollable grid is rendering during load of view image info, which looks sloppy","2013-08-14 16:49:21",,"2013-06-10 14:19:43","Mac OS X",6,,,,0,"Client Software"," --",,"24 Branch",0,1,
1119880,"Firefox","Page Info Window","nobody","UNCONFIRMED"," ---","More Black Screen","2015-01-09 10:18:30",,"2015-01-09 10:18:30","Windows 7",1,,,,0,"Client Software"," --",,"34 Branch",0,0,
1135549,"Firefox","Page Info Window","nobody","UNCONFIRMED"," ---","HTML5 audio not showing in Page Info","2015-03-16 10:08:27",,"2015-02-22 18:46:26","Linux",1,,,,0,"Client Software"," --",,"36 Branch",0,1,
1149963,"Firefox","Page Info Window","nobody","UNCONFIRMED"," ---","Technical Details of Page Info missing encryption type","2015-04-15 17:18:54",,"2015-04-01 05:03:05","Windows 7",6,,,,0,"Client Software"," --",,"37 Branch",0,1,
1153856,"Firefox","Page Info Window","nobody","UNCONFIRMED"," ---","Media info shows ""video"" instead of ""audio"".","2015-04-13 06:58:33",,"2015-04-13 06:56:48","Windows 7",2,,,,0,"Client Software"," --",,"37 Branch",0,0,
1155277,"Firefox","Page Info Window","nobody","UNCONFIRMED"," ---","Split the long string showing the encryption type in 'Site Identity Button'|More Info|Security","2016-01-02 21:32:16",,"2015-04-16 10:15:47","All",1,,,,0,"Client Software"," --",,"37 Branch",0,1,
1255702,"Firefox","Page Info Window","nobody","UNCONFIRMED"," ---","Several strings should use a proper plural form in Page Info","2016-03-11 09:01:03",,"2016-03-10 21:25:55","Unspecified",1,,,,0,"Client Software"," --",,"unspecified",0,1,
1255769,"Firefox","Page Info Window","nobody","UNCONFIRMED"," ---","Page Info Media dimensions often shows 0x0","2016-03-11 12:01:43",,"2016-03-11 04:13:15","Unspecified",1,,,,0,"Client Software"," --",,"48 Branch",0,0,
1328226,"Firefox","Page Info Window","nobody","UNCONFIRMED"," ---","Website options window > more information (UI bug)","2017-01-03 04:24:41",,"2017-01-03 01:30:40","Windows 7",1,,,,0,"Client Software"," --",,"50 Branch",0,1,
1364730,"Firefox","Page Info Window","nobody","UNCONFIRMED"," ---","Cannot save HTML5 videos using MSE from Info Window","2017-05-14 00:37:52",,"2017-05-14 00:26:40","Unspecified",1,,,,0,"Client Software"," --",,"Trunk",0,1,
1410668,"Firefox","Page Info Window","nobody","UNCONFIRMED"," ---","page site ownership information statement misphrased","2017-10-23 02:31:25",,"2017-10-21 14:27:08","Linux",2,,,,0,"Client Software"," --",,"56 Branch",0,1,
1433908,"Firefox","Page Info Window","nobody","UNCONFIRMED"," ---","nsIPluginHost.getPermissionStringForType throwing NS_ERROR_NOT_AVAILABLE","2018-04-12 02:20:14",,"2018-01-29 06:13:49","Linux",10,,,,0,"Client Software"," --",,"59 Branch",0,4,
1447900,"Firefox","Page Info Window","nobody","UNCONFIRMED"," ---","page info uses incorrect colors","2018-03-29 10:34:32",,"2018-03-21 23:26:49","Unspecified",6,,,,0,"Client Software"," --",,"59 Branch",0,3,
1452537,"Firefox","Page Info Window","nobody","UNCONFIRMED"," ---","Cannot copy from Media tab in Page Info window","2018-10-26 20:41:26",,"2018-04-08 22:01:06","Mac OS X",2,,,,0,"Client Software"," --",,"59 Branch",0,1,
1457557,"Firefox","Page Info Window","nobody","UNCONFIRMED"," ---","Describing mixed content as ""broken encryption"" is surprising","2018-09-20 05:53:14",,"2018-04-27 12:47:06","All",9,,,,0,"Client Software"," --",,"59 Branch",0,3,
1203030,"Firefox","Page Info Window","nobody","UNCONFIRMED"," ---","Allow remove logged status for basic authentication site in Page Info","2018-09-05 15:07:02",260839,"2015-09-09 01:11:14","All",5,,,,0,"Client Software","P5",,"38 Branch",0,4,
239200,"Firefox","Page Info Window","db48x","NEW"," ---","Page Info - page size is not updated when content added","2012-03-21 20:31:22",737642,"2004-03-30 11:17:23","Windows 2000",4,,,,0,"Client Software"," --",,"Trunk",2,3,
1191869,"Firefox","Page Info Window","jimmyw22","NEW"," ---","Content process sends back stale data to pageinfo. Need to receive a message to stop content task when page info dialog is closed.","2015-08-06 08:46:41",1175794,"2015-08-06 08:46:41","Unspecified",1,,,,0,"Client Software"," --",,"unspecified",0,0,
201742,"Firefox","Page Info Window","nobody","NEW"," ---","make the cipher suite name in the page info -> security dialog selectable/copyable","2016-07-01 13:32:14",,"2003-04-11 19:51:40","All",5,,,,0,"Client Software"," --",,"unspecified",1,3,
234374,"Firefox","Page Info Window","nobody","NEW"," ---","page info shows wrong file type for autodetected images loaded via file","2013-02-26 06:57:34",,"2004-02-14 17:15:04","All",14,,,,0,"Client Software"," --",,"unspecified",2,4,
265169,"Firefox","Page Info Window","nobody","NEW"," ---","also report size of fully loaded page (with media)","2007-03-16 22:11:19",,"2004-10-19 17:24:50","All",2,,,,0,"Client Software"," --",,"Trunk",0,1,
271370,"Firefox","Page Info Window","nobody","NEW"," ---","Page Info should show if the page was received gzipped or not","2012-03-21 20:31:22",737642,"2004-11-23 05:04:05","All",4,,,,0,"Client Software"," --",,"unspecified",3,1,
286077,"Firefox","Page Info Window","nobody","NEW"," ---","Page info does not show images downloaded in JavaScript","2007-03-16 22:21:35",,"2005-03-14 07:25:04","Linux",3,,,,0,"Client Software"," --",,"unspecified",2,1,
350147,"Firefox","Page Info Window","nobody","NEW"," ---","Local image size won't be displayed.","2018-05-02 23:05:34",737642,"2006-08-24 21:08:31","Windows XP",3,,,,0,"Client Software"," --",,"unspecified",1,2,
350575,"Firefox","Page Info Window","nobody","NEW"," ---","Invalid/expired certificates are not marked within ""page info""","2015-03-17 06:39:41",377076,"2006-08-29 05:17:42","All",3,,,,0,"Client Software"," --",,"unspecified",3,6,
353721,"Firefox","Page Info Window","nobody","NEW"," ---","Media Preview window in Page Info should change its background depending on the image color","2012-08-03 01:07:47",,"2006-09-21 17:23:42","All",6,,,,0,"Client Software"," --",,"Trunk",0,5,
372097,"Firefox","Page Info Window","nobody","NEW"," ---","Flash MIME type not displayed as delivered by server","2011-02-21 07:13:58",,"2007-02-28 01:49:37","Windows XP",4,,,,0,"Client Software"," --",,"unspecified",2,5,
376378,"Firefox","Page Info Window","nobody","NEW"," ---","when I open any RSS/ATOM file, there is ""application/xhtml+xml"" type in page info","2008-06-20 16:45:24",,"2007-04-03 10:31:06","All",5,,,,0,"Client Software"," --",,"Trunk",0,5,
377396,"Firefox","Page Info Window","nobody","NEW"," ---","Unused tabs should be disabled not hidden","2014-06-13 16:33:03",,"2007-04-13 05:59:44","All",26,,,,0,"Client Software"," --",,"Trunk",1,9,
388243,"Firefox","Page Info Window","nobody","NEW"," ---","opening ""page info"" dialog can be slow to open for large histories","2015-03-19 08:20:12",388314,"2007-07-15 12:47:59","Windows XP",10,,,,0,"Client Software"," --",,"Trunk",1,8,
404170,"Firefox","Page Info Window","nobody","NEW"," ---","Phishing info in Security Tab","2015-03-17 06:37:00",,"2007-11-17 08:19:28","All",5,,,,0,"Client Software"," --",,"Trunk",0,5,
406453,"Firefox","Page Info Window","nobody","NEW"," ---","display more info when partially encrypted","2013-11-22 05:36:07",,"2007-12-02 12:08:52","All",2,,,,0,"Client Software"," --",,"Trunk",1,3,
407929,"Firefox","Page Info Window","nobody","NEW"," ---","Page Info ""Block Cookies"" should block cookies of the domain","2016-12-11 03:18:48",,"2007-12-11 09:48:36","Linux",3,,,,0,"Client Software"," --",,"Trunk",2,5,
410274,"Firefox","Page Info Window","nobody","NEW"," ---","Security information confusing when the connection is partially encrypted","2015-03-19 08:19:50",,"2007-12-30 14:50:04","All",8,,,,0,"Client Software"," --",,"Trunk",1,5,
415225,"Firefox","Page Info Window","nobody","NEW"," ---","Wrong suggested filename extension in ""Save Image"" dialog","2008-11-05 01:14:02",,"2008-02-01 01:27:50","All",5,,,,1,"Client Software"," --",,"Trunk",1,3,
416557,"Firefox","Page Info Window","nobody","NEW"," ---","Remove ""Block images from www.site.com"" from Page Info","2013-09-28 13:19:16","514739, 851701","2008-02-09 09:30:13","All",20,,,,1,"Client Software"," --",,"Trunk",2,14,
418525,"Firefox","Page Info Window","nobody","NEW"," ---","Pane name accesskeys are not underlined (in Page Info)","2009-07-16 10:10:17",,"2008-02-19 15:47:40","Windows Vista",2,,,,1,"Client Software"," --",,"Trunk",0,2,
419951,"Firefox","Page Info Window","nobody","NEW"," ---","Toggle ""Page Info"" with its keyboard shortcut (like ""Downloads"" does)","2014-08-08 17:50:38",,"2008-02-27 14:10:45","All",10,,,,0,"Client Software"," --",,"Trunk",1,5,
421719,"Firefox","Page Info Window","nobody","NEW"," ---","Page Info ▸ Security ▸ View Cookies shows all saved cookies for a while","2015-03-17 06:39:43",,"2008-03-08 10:45:23","All",6,,,,0,"Client Software"," --",,"Trunk",2,5,
424182,"Firefox","Page Info Window","nobody","NEW"," ---","Meaning of the ""Identity"" of SSL sites is not clear.","2015-03-17 06:36:48",,"2008-03-20 11:43:38","Windows XP",14,,,,0,"Client Software"," --",,"Trunk",3,11,
432537,"Firefox","Page Info Window","nobody","NEW"," ---","Can't view certificate when the issuer certificate is not trusted","2015-03-19 08:19:43",,"2008-05-06 15:45:35","Windows XP",9,,,,0,"Client Software"," --",,"Trunk",2,9,
480747,"Firefox","Page Info Window","nobody","NEW"," ---","page info misreports image size if it's scaled","2012-05-16 07:05:31",,"2009-02-28 13:51:43","All",4,,,,1,"Client Software"," --",,"unspecified",1,4,
491206,"Firefox","Page Info Window","nobody","NEW"," ---","Content-Type gets ignored when saving files in Page Info / Media","2012-03-10 19:19:19",,"2009-05-03 11:37:27","All",7,,,,0,"Client Software"," --",,"unspecified",2,8,
491208,"Firefox","Page Info Window","nobody","NEW"," ---","Content-Disposition gets ignored when saving files in Page Info / Media","2012-09-10 06:03:30","291837, 491206","2009-05-03 11:47:47","All",7,,,,0,"Client Software"," --",,"unspecified",1,5,
493484,"Firefox","Page Info Window","nobody","NEW"," ---","Media preview does not display frame count for images embedded using object tag and type","2009-05-24 00:19:35",,"2009-05-17 15:52:58","All",2,,,,0,"Client Software"," --",,"Trunk",1,4,
497577,"Firefox","Page Info Window","nobody","NEW"," ---","page info misreports size of videos","2012-03-21 20:31:22",737642,"2009-06-11 07:30:54","Windows NT",2,,,,0,"Client Software"," --",,"3.5 Branch",1,1,
500510,"Firefox","Page Info Window","nobody","NEW"," ---","The text in the 'Security' tab in the 'Page Info' dialog overlaps when the window is resized smaller","2009-07-06 18:19:07",,"2009-06-25 14:03:23","All",11,,,,0,"Client Software"," --",,"Trunk",1,4,
507139,"Firefox","Page Info Window","nobody","NEW"," ---","MetaData Properties window doesn't respect locale for file size and image dimensions","2010-07-22 16:58:41","252043, 542502","2009-07-29 08:18:12","All",7,,,,0,"Client Software"," --",,"Trunk",4,3,
515549,"Firefox","Page Info Window","nobody","NEW"," ---","Page Info > Media tab doesn't preview <embed> tags for plugins like flash","2012-01-10 23:35:18",,"2009-09-09 18:09:34","All",38,,,,0,"Client Software"," --",,"Trunk",2,10,
519309,"Firefox","Page Info Window","nobody","NEW"," ---","Add information about an image's color profile to the Media tab","2015-05-19 04:15:50",,"2009-09-28 15:22:03","All",1,,,,0,"Client Software"," --",,"Trunk",0,3,
528426,"Firefox","Page Info Window","nobody","NEW"," ---","Add ""View Image Info"" for background images","2013-01-22 09:42:16",,"2009-11-12 22:14:39","All",20,,,,0,"Client Software"," --",,"Trunk",1,5,
531321,"Firefox","Page Info Window","nobody","NEW"," ---","generalMetaTags should support plural forms","2009-11-26 16:50:55",,"2009-11-26 16:50:55","All",1,,,,0,"Client Software"," --",,"3.6 Branch",0,0,
549150,"Firefox","Page Info Window","nobody","NEW"," ---","Images from generated content are not shown in Page Info","2011-03-31 01:55:15","12460, 424628","2010-02-27 15:27:25","All",1,,,,0,"Client Software"," --",,"Trunk",2,3,
550686,"Firefox","Page Info Window","nobody","NEW"," ---","Page Info -> Media does not display the ""animated"" status & frame count in the ""Type"" field, for background images","2012-06-28 06:56:14",713889,"2010-03-06 06:32:35","All",22,,,,0,"Client Software"," --",,"Trunk",1,5,
561759,"Firefox","Page Info Window","nobody","NEW"," ---","don't make hardcoded lists of protocols; use protocol handler flags","2010-07-22 16:59:39",,"2010-04-26 08:11:42","Mac OS X",1,,,,0,"Client Software"," --",,"unspecified",0,1,
564078,"Firefox","Page Info Window","nobody","NEW"," ---","Firefox can't tell where an <input type=""image"">form will be submitted","2010-05-06 13:10:26",,"2010-05-05 17:28:39","All",2,,,,0,"Client Software"," --",,"Trunk",0,2,
569769,"Firefox","Page Info Window","nobody","NEW"," ---","Page Info should preserve information about chrome urls when saving","2010-06-02 23:25:53",,"2010-06-02 18:30:14","All",1,,,,0,"Client Software"," --",,"unspecified",0,1,
574114,"Firefox","Page Info Window","nobody","NEW"," ---","Page Info > Media should list and preview Canvas Elements","2010-12-21 17:59:58",,"2010-06-23 12:54:56","All",2,,,,0,"Client Software"," --",,"Trunk",1,0,
574545,"Firefox","Page Info Window","nobody","NEW"," ---","Page Info > Media should preview object tags","2010-10-11 03:50:46",515549,"2010-06-24 19:08:30","All",3,,,,0,"Client Software"," --",,"Trunk",2,3,
584285,"Firefox","Page Info Window","nobody","NEW"," ---","Meta tag list: HTML5-style charset is not displayed  / meta tags in body are displayed","2017-09-20 19:43:02",584326,"2010-08-03 22:33:27","All",23,,,,4,"Client Software"," --",,"unspecified",6,9,
614320,"Firefox","Page Info Window","nobody","NEW"," ---","browser_pageInfo.js triggers 2 strict warnings and 1 exception","2012-10-08 20:31:01",799329,"2010-11-23 10:54:01","Linux",4,,,,0,"Client Software"," --",,"Trunk",0,3,
624314,"Firefox","Page Info Window","nobody","NEW"," ---","Should show whole name of web site owner","2017-04-23 13:14:33",,"2011-01-09 21:57:18","All",6,,,,0,"Client Software"," --",,"Trunk",1,4,
628004,"Firefox","Page Info Window","nobody","NEW"," ---","The 'Cookies' Window does not react correctly on deleted&recreated cookies","2011-01-22 09:54:33",,"2011-01-22 07:28:35","Windows 7",3,,,,0,"Client Software"," --",,"unspecified",0,2,
645502,"Firefox","Page Info Window","nobody","NEW"," ---","add defense in depth warnings when certificate info looks suspicious","2014-06-29 17:55:29","489347, 642503, 645819","2011-03-27 08:35:22","All",3,,,,0,"Client Software"," --",,"unspecified",2,5,
684612,"Firefox","Page Info Window","nobody","NEW"," ---","Page Info shows wrong size for a favicon that is not found [404]","2012-03-21 20:31:22",737642,"2011-09-04 12:31:59","All",4,,,,0,"Client Software"," --",,"Trunk",0,1,
690737,"Firefox","Page Info Window","nobody","NEW"," ---","Page Info ▸ Media should also display subtitles files (SRT, WebVTT)","2017-09-09 00:30:16","629350, 833385","2011-09-30 05:55:56","All",4,,,,0,"Client Software"," --",,"Trunk",5,12,
714111,"Firefox","Page Info Window","nobody","NEW"," ---","Page Info displays wrong Page Size for gzipped requests","2012-03-21 20:31:22",737642,"2011-12-29 10:55:39","All",2,,,,0,"Client Software"," --",,"12 Branch",0,0,
717309,"Firefox","Page Info Window","nobody","NEW"," ---","Page Info >  Media lists resources that are both image tags and backgrounds twice","2012-01-11 10:56:48",,"2012-01-11 10:56:27","All",1,,,,0,"Client Software"," --",,"Trunk",0,0,
733299,"Firefox","Page Info Window","nobody","NEW"," ---","Page Info > Media > Save As should save the (pinned) cache entry rather than revalidating/redownloading","2014-12-16 02:39:24",,"2012-03-05 23:22:47","All",9,,,,0,"Client Software"," --",,"Trunk",0,3,
793948,"Firefox","Page Info Window","nobody","NEW"," ---","Add ""Allow first party only"" cookies per site in Page Info","2016-04-04 07:31:35",770691,"2012-09-24 20:23:34","All",4,,,,0,"Client Software"," --",,"Trunk",1,4,
799329,"Firefox","Page Info Window","nobody","NEW"," ---","Page Info makes inappropriate assumptions about document lifetime","2014-03-13 00:07:44",,"2012-10-08 20:31:01","All",4,,,,1,"Client Software"," --",,"Trunk",1,5,
801930,"Firefox","Page Info Window","nobody","NEW"," ---","Exception in makePreview (pageinfo.js) (imgIRequest.image NS_ERROR_FAILURE)","2013-07-15 16:29:22",,"2012-10-15 16:20:36","Mac OS X",3,,,,0,"Client Software"," --",,"Trunk",0,3,
829831,"Firefox","Page Info Window","nobody","NEW"," ---","Leak if I quit while Page Info is opening","2015-08-14 15:51:50",,"2013-01-11 16:06:44","Mac OS X",2,,,,0,"Client Software"," --",,"Trunk",0,1,
830833,"Firefox","Page Info Window","nobody","NEW"," ---","Activate Plugins: reversing Allow to ""Always ask"" is not honored","2015-07-01 12:09:31",,"2013-01-15 09:03:22","Windows 7",2,,,,0,"Client Software"," --",,"unspecified",0,1,
868779,"Firefox","Page Info Window","nobody","NEW"," ---","page info page breaks on SuperDisk_voice_coil_and_eject.svg","2013-05-07 19:41:39",,"2013-05-04 15:20:03","Windows 8",6,,,,0,"Client Software"," --",,"21 Branch",1,2,
880415,"Firefox","Page Info Window","nobody","NEW"," ---","View Image Info shows 0 KB/0 bytes for redirected content","2018-05-03 04:54:12",,"2013-06-06 13:11:10","All",19,,,,2,"Client Software"," --",,"Trunk",0,6,
883996,"Firefox","Page Info Window","nobody","NEW"," ---","[OS X] Firefox openly mocks me when I try to copy a URL out of the Page Info dialog","2015-02-05 06:52:16",,"2013-06-17 12:28:24","Mac OS X",10,,,,0,"Client Software"," --",,"unspecified",0,4,
894073,"Firefox","Page Info Window","nobody","NEW"," ---","Page Info for images, audio, video files shows render mode (Quirks Mode) and character encoding (of the previous page), also viewport.","2013-07-15 15:00:25",,"2013-07-15 14:57:39","Linux",2,,,,0,"Client Software"," --",,"Trunk",0,0,
910297,"Firefox","Page Info Window","nobody","NEW"," ---","page info causes GET request","2015-12-29 23:43:49",,"2013-08-28 09:08:48","All",5,"2013-08-30 20:28:28",,,1,"Client Software"," --",,"Trunk",0,3,
949927,"Firefox","Page Info Window","nobody","NEW"," ---","pageInfo.js - openCacheEntry - NS_ERROR_MALFORMED_URI","2013-12-12 23:51:04",,"2013-12-12 23:51:04","Mac OS X",1,,,,0,"Client Software"," --",,"Trunk",0,0,
953017,"Firefox","Page Info Window","nobody","NEW"," ---","icon not shown at first in page info -> media","2014-08-08 17:49:02",,"2013-12-23 21:29:54","All",2,,,,0,"Client Software"," --",,"28 Branch",0,1,
979400,"Firefox","Page Info Window","nobody","NEW"," ---","pageInfo.js - NS_ERROR_FAILURE in onLoadPageInfo if browser window closes first","2014-03-13 00:07:44",799329,"2014-03-04 09:25:58","Mac OS X",3,,,,0,"Client Software"," --",,"Trunk",0,0,
989973,"Firefox","Page Info Window","nobody","NEW"," ---","Page Info Associated Text shows Title for images","2014-10-16 04:30:34",,"2014-03-31 05:35:06","All",10,,,,0,"Client Software"," --",,"unspecified",0,3,
1007599,"Firefox","Page Info Window","nobody","NEW"," ---","Feeds tab of Page Info opens URL on rightclick, no way to make a copy","2016-04-14 04:36:23",,"2014-05-08 04:04:33","All",8,,,,1,"Client Software"," --",,"32 Branch",1,3,
1054276,"Firefox","Page Info Window","nobody","NEW"," ---","In the ""media"" view, the ""save as"" button saves images with the wrong extension","2017-12-31 06:59:34",,"2014-08-15 06:16:24","All",21,,,,1,"Client Software"," --",,"31 Branch",0,8,
1070240,"Firefox","Page Info Window","nobody","NEW"," ---","[UX] Page Info - Permissions style not clear","2015-08-10 10:59:29",,"2014-09-19 15:59:56","Windows 8.1",2,,,,0,"Client Software"," --",,"33 Branch",0,1,
1134753,"Firefox","Page Info Window","nobody","NEW"," ---","Dragging images from Page Info Media to my OS X desktop create files called Not specified.webloc","2015-02-19 11:07:05",,"2015-02-19 11:07:05","Mac OS X",1,,,,0,"Client Software"," --",,"unspecified",0,0,
1174410,"Firefox","Page Info Window","nobody","NEW"," ---","""View Cookies"" button does not work anymore after reloading the site","2015-06-15 06:06:08",,"2015-06-13 04:33:48","Unspecified",3,,,,0,"Client Software"," --",,"38 Branch",0,2,
1176175,"Firefox","Page Info Window","nobody","NEW"," ---","Page Info is not using ellipsis everywhere to depict overflowed content","2016-02-04 06:13:19",,"2015-06-19 00:49:27","All",1,,,,0,"Client Software"," --",,"Trunk",0,1,
1184914,"Firefox","Page Info Window","nobody","NEW"," ---","Security information in view-source is different with the identity box (popup) and the more information (Page Info).","2016-07-08 16:01:24",,"2015-07-17 04:52:42","All",5,,,,0,"Client Software"," --",,"unspecified",0,1,
1188217,"Firefox","Page Info Window","nobody","NEW"," ---","Don't use a different font face in the Certificate Viewer","2016-02-09 01:21:40",,"2015-07-27 18:56:15","All",6,,,,0,"Client Software"," --",,"unspecified",0,2,
1188770,"Firefox","Page Info Window","nobody","NEW"," ---","Meta list in the Page Info often does not display meta information in the first row","2017-11-16 00:41:57",,"2015-07-29 01:06:25","All",3,,,,0,"Client Software"," --",,"unspecified",1,2,
1211648,"Firefox","Page Info Window","nobody","NEW"," ---","Page Info window leaks","2015-10-05 13:23:21",,"2015-10-05 13:23:21","Unspecified",1,,,,0,"Client Software"," --",,"unspecified",0,0,
1215589,"Firefox","Page Info Window","nobody","NEW"," ---","Background images not initially displayed in content do not appear in the media tab the first time","2015-10-17 07:58:28",,"2015-10-16 10:22:46","Unspecified",1,,,,0,"Client Software"," --",,"unspecified",0,2,
1215928,"Firefox","Page Info Window","nobody","NEW"," ---","Wrong cookies information in Page Info - Security","2016-04-28 10:27:53",,"2015-10-18 06:47:08","All",1,,,,0,"Client Software"," --",,"unspecified",1,0,
1216920,"Firefox","Page Info Window","nobody","NEW"," ---","Cannot display X-ICON image (blob:null/...) in Page Info > Media","2016-07-08 16:03:19",,"2015-10-21 02:14:27","All",1,,,,0,"Client Software"," --",,"unspecified",0,0,
1221466,"Firefox","Page Info Window","nobody","NEW"," ---","Select All and Save As have same access key in Page Info window","2016-03-27 07:28:50",,"2015-11-04 00:41:39","Unspecified",2,,,,0,"Client Software"," --",,"unspecified",0,0,
1224960,"Firefox","Page Info Window","nobody","NEW"," ---","Conflicting accesskey in pageinfo with Select All added by Bug 418517: selectall.accesskey: ""A"" and  mediaSaveAs.accesskey: ""A""","2016-06-28 13:48:06",,"2015-11-15 15:06:32","All",14,,,,0,"Client Software"," --",,"42 Branch",0,5,
1226847,"Firefox","Page Info Window","nobody","NEW"," ---","Remove key bits from Security tab of Page Info","2015-11-25 15:49:17",,"2015-11-21 02:13:40","Unspecified",5,,,,0,"Client Software"," --",,"unspecified",0,6,
1240655,"Firefox","Page Info Window","nobody","NEW"," ---","Don't collapse the ""Save As"" button in the page info","2016-01-18 20:59:02",,"2016-01-18 20:52:07","Unspecified",2,,,,0,"Client Software"," --",,"unspecified",0,0,
1241383,"Firefox","Page Info Window","nobody","NEW"," ---","data/blob URLs should be downloaded including the file extension automatically when using Save As in the Page Info","2016-01-21 03:54:10",,"2016-01-20 19:50:15","All",1,,,,0,"Client Software"," --",,"Trunk",1,2,
1241389,"Firefox","Page Info Window","nobody","NEW"," ---","Do not forget the download folder, when doing two times Save As... of Select All in the Page Info media","2016-01-20 20:19:11",,"2016-01-20 20:11:53","All",1,,,,0,"Client Software"," --",,"Trunk",0,1,
1244716,"Firefox","Page Info Window","nobody","NEW"," ---","Cannot cancel image blocking after doing ""Block images from <site>"" in the Page Info","2016-02-01 06:26:54",,"2016-02-01 06:24:29","All",1,,,,0,"Client Software"," --",,"unspecified",0,0,
