"Bug ID","Product","Component","Assignee","Status","Resolution","Summary","Changed","Depends on","Opened","OS","Number of Comments","Last Resolved","Last Visit","Crash Signature","Duplicate Count","Classification","Priority","Rank","Version","Votes","CC Count","Bug Interest"
1465814,"Firefox","Shell Integration","m_kato","NEW"," ---","When switching between softwares with a file browser opened, Nightly's icon is broken","2018-06-04 00:01:38",,"2018-05-31 08:17:45","Unspecified",8,,,,0,"Client Software"," --",,"unspecified",0,2,
263214,"Firefox","Shell Integration","nobody","NEW"," ---","Reconsider default-browser selection mechanism for GNOME","2007-03-16 22:09:56",,"2004-10-06 11:57:09","Linux",10,,,,0,"Client Software"," --",,"1.0 Branch",1,8,
263416,"Firefox","Shell Integration","nobody","NEW"," ---","Registering absolute program location paths with gconf is bad","2009-11-04 01:15:29",,"2004-10-07 19:11:37","Linux",5,,,,0,"Client Software"," --",,"unspecified",1,6,
266008,"Firefox","Shell Integration","nobody","NEW"," ---","MacOSX ""Netscape document"" won't display properly after drag and drop","2016-01-26 12:43:32",,"2004-10-25 11:45:36","Mac OS X",20,"2004-12-11 19:00:15",,,2,"Client Software"," --",,"unspecified",1,3,
272382,"Firefox","Shell Integration","nobody","NEW"," ---","Microsoft Outlook will not open web link and other application as well i.e antivirus updates im McAfee","2017-08-18 06:59:34",,"2004-11-30 01:46:28","Windows XP",4,,,,0,"Client Software"," --",,"unspecified",2,4,
293323,"Firefox","Shell Integration","nobody","NEW"," ---","Spotlight Integration","2015-11-14 08:53:53",,"2005-05-07 21:59:31","Mac OS X",9,,,,1,"Client Software"," --",,"unspecified",21,31,
296568,"Firefox","Shell Integration","nobody","NEW"," ---","Firefox should have a firefox.desktop file for Linux builds","2018-10-11 02:32:24",,"2005-06-03 14:17:31","Linux",18,"2005-10-13 17:14:23",,,2,"Client Software"," --",,"unspecified",3,19,
297841,"Firefox","Shell Integration","nobody","NEW"," ---","nsIShellService fails on non Gnome systems","2013-09-23 15:17:27",,"2005-06-15 14:57:06","Linux",4,,,,0,"Client Software"," --",,"unspecified",2,3,
305736,"Firefox","Shell Integration","nobody","NEW"," ---","error saying ""msnim is not a registered protocol"" when clicking a link. works in IE, but not FF","2008-05-10 20:10:49",,"2005-08-24 03:53:00","Windows XP",18,,,,1,"Client Software"," --",,"Trunk",3,9,
312164,"Firefox","Shell Integration","nobody","NEW"," ---","Open link from external application don't open Firefox if it's closed","2013-08-13 17:49:17",,"2005-10-12 06:50:21","Mac OS X",14,,,,0,"Client Software"," --",,"1.5.0.x Branch",0,7,
313881,"Firefox","Shell Integration","nobody","NEW"," ---","Can't drag files (including .url files), shortcuts or links to Firefox's title bar","2012-06-15 04:57:45",,"2005-10-26 05:43:39","All",7,,,,0,"Client Software"," --",,"Trunk",4,3,
319292,"Firefox","Shell Integration","nobody","NEW"," ---","[gnome] Links from external programs should open in most recent window on current desktop","2008-04-10 05:59:51",,"2005-12-06 05:07:48","Linux",6,,,,1,"Client Software"," --",,"2.0 Branch",2,4,
329231,"Firefox","Shell Integration","nobody","NEW"," ---","does not register itself as being capable of handling (plain) XML files","2007-06-07 15:12:14",,"2006-03-03 06:54:46","Mac OS X",7,,,,0,"Client Software"," --",,"2.0 Branch",1,2,
331615,"Firefox","Shell Integration","nobody","NEW"," ---","Integration: Firefox ignores Windows XP permissions vis a vis wallpaper","2017-04-03 04:21:42",,"2006-03-24 09:37:04","Windows XP",7,,,,0,"Client Software"," --",,"1.5.0.x Branch",2,4,
337892,"Firefox","Shell Integration","nobody","NEW"," ---","drag pictures from browser onto dock icons","2017-01-05 07:53:19",,"2006-05-13 22:23:52","Mac OS X",3,,,,0,"Client Software"," --",,"unspecified",1,1,
340333,"Firefox","Shell Integration","nobody","NEW"," ---","Need API for adding/removing MIME types and protocols for which Firefox is the default handler","2018-11-01 17:24:04",,"2006-06-04 13:53:01","All",5,,,,0,"Client Software"," --",,"unspecified",2,6,
344972,"Firefox","Shell Integration","nobody","NEW"," ---","firefox icon not showing up in Activity Monitor","2018-04-26 09:59:28",,"2006-07-17 13:58:55","Mac OS X",7,,,,0,"Client Software"," --",,"Trunk",1,7,
359630,"Firefox","Shell Integration","nobody","NEW"," ---","Windows cannot find 'SHORTCUT' when clicking link from desktop after crash","2014-01-07 20:31:38",491947,"2006-11-05 14:44:12","Windows XP",25,,,,4,"Client Software"," --",,"unspecified",9,20,
360066,"Firefox","Shell Integration","nobody","NEW"," ---","PRINT (ctrl+p) dialog box does not follow XP or Vista style dialog box","2012-01-20 15:44:05",,"2006-11-08 23:46:01","All",10,,,,0,"Client Software"," --",,"Trunk",3,5,
369901,"Firefox","Shell Integration","nobody","NEW"," ---","No AppleScript way to get browser window tab URLs, titles","2017-11-15 06:20:25",608049,"2007-02-09 12:26:21","Mac OS X",6,,,,0,"Client Software"," --",,"unspecified",4,10,
370227,"Firefox","Shell Integration","nobody","NEW"," ---","Opening multiple local files without the app already running does not respect tab browser settings","2014-05-21 19:29:42",,"2007-02-12 17:24:58","Windows XP",2,,,,1,"Client Software"," --",,"Trunk",1,3,
371512,"Firefox","Shell Integration","nobody","NEW"," ---","'Set as desktop background' not working in KDE","2018-03-12 02:24:57",,"2007-02-24 05:12:01","Linux",11,,,,0,"Client Software"," --",,"unspecified",3,8,
371514,"Firefox","Shell Integration","nobody","NEW"," ---","'Set as desktop background' not working in XFCE 4.4","2009-11-04 23:21:24",,"2007-02-24 05:31:42","Linux",5,,,,0,"Client Software"," --",,"Trunk",1,3,
372920,"Firefox","Shell Integration","nobody","NEW"," ---","Vista Parental Controls Panel General UI Extensibility Link Addition","2009-07-10 13:08:10",,"2007-03-06 14:53:48","Windows Vista",1,,,,0,"Client Software"," --",,"Trunk",0,7,
375014,"Firefox","Shell Integration","nobody","NEW"," ---","support drag & drop text to dock icon for search","2009-09-01 23:14:52",,"2007-03-22 22:37:51","Mac OS X",5,,,,0,"Client Software"," --",,"unspecified",3,2,
382174,"Firefox","Shell Integration","nobody","NEW"," ---","Default command set by Firefox in GNOME has quotes, which cause a problem (Firefox path set in ""default applications"" setting on GNOME has a problem)","2007-10-30 09:01:56",,"2007-05-27 11:57:22","Linux",3,,,,0,"Client Software"," --",,"Trunk",1,1,
383523,"Firefox","Shell Integration","nobody","NEW"," ---","Firefox ignores system language preference on Mac OS X","2009-03-29 23:21:15",,"2007-06-06 16:31:41","Mac OS X",3,,,,0,"Client Software"," --",,"2.0 Branch",2,4,
389312,"Firefox","Shell Integration","nobody","NEW"," ---","Windows thinks it doesn't know where firefox.exe is","2011-02-06 21:32:26",,"2007-07-23 15:42:03","Windows XP",6,,,,0,"Client Software"," --",,"2.0 Branch",1,6,
393327,"Firefox","Shell Integration","nobody","NEW"," ---","Dock menu for Firefox could include 'Re-Open in Safe Mode'","2012-05-28 23:50:08",,"2007-08-22 17:35:44","Mac OS X",13,"2007-08-26 15:40:54",,,0,"Client Software"," --",,"Trunk",0,4,
400852,"Firefox","Shell Integration","nobody","NEW"," ---","Use firefox application picker dialog when, on protocol handling dialog, user clicks Choose..","2015-01-20 06:41:41","348808, 397678","2007-10-23 09:29:11","Windows Vista",31,,,,1,"Client Software"," --",,"Trunk",5,12,
403521,"Firefox","Shell Integration","nobody","NEW"," ---","dragging window can change focus to other tab (even in other window)","2007-11-12 18:25:32",,"2007-11-12 11:36:38","Mac OS X",2,,,,0,"Client Software"," --",,"1.5.0.x Branch",1,1,
408944,"Firefox","Shell Integration","nobody","NEW"," ---","Nightly updates clobber default browser setting for all administrator users","2011-04-07 13:11:30",,"2007-12-18 19:58:28","Windows XP",12,,,,0,"Client Software"," --",,"2.0 Branch",1,5,
410242,"Firefox","Shell Integration","nobody","NEW"," ---","underlining of access keys is not correct in Gnome","2009-12-26 21:55:44",,"2007-12-30 04:42:59","Linux",2,,,,0,"Client Software"," --",,"Trunk",0,0,
411076,"Firefox","Shell Integration","nobody","NEW"," ---","""Update History"" dialog uses incorrect ""close"" icon for button","2012-08-21 22:48:14",,"2008-01-06 18:57:36","All",9,,,,1,"Client Software"," --",,"Trunk",1,3,
411927,"Firefox","Shell Integration","nobody","NEW"," ---","[10.5] Websites improperly restricted by Parental Controls on Mac OS X 10.5 Leopard","2009-10-05 11:39:48",,"2008-01-11 09:29:21","Mac OS X",7,,,,0,"Client Software"," --",,"2.0 Branch",1,6,
412326,"Firefox","Shell Integration","nobody","NEW"," ---","gtk: tab's label focus indicator should be drawn natively","2010-05-13 10:07:16",,"2008-01-14 11:29:33","Linux",9,,,,1,"Client Software"," --",,"Trunk",2,5,
413237,"Firefox","Shell Integration","nobody","NEW"," ---","gtk: wrong text selection appearance in locationbar (compared to text selection in search field)","2008-02-07 22:10:23",,"2008-01-20 11:45:12","Linux",8,,,,0,"Client Software"," --",,"unspecified",0,5,
414209,"Firefox","Shell Integration","nobody","NEW"," ---","about dialog uses wrong arrow in ""about {program}"" button in credits mode","2008-04-10 12:34:03",,"2008-01-27 05:54:38","Linux",2,,,,1,"Client Software"," --",,"unspecified",1,6,
414625,"Firefox","Shell Integration","nobody","NEW"," ---","nodoka theme git: checkbuttons and radiobuttons have wrong focus","2008-02-01 23:07:55",142898,"2008-01-29 10:39:48","Linux",9,,,,0,"Client Software"," --",,"unspecified",1,7,
415358,"Firefox","Shell Integration","nobody","NEW"," ---","Tools ▸ Page Info and Help ▸ About Minefield use different icons for the same abstraction","2008-11-24 00:13:32",,"2008-02-02 07:51:11","Linux",9,,,,0,"Client Software"," --",,"Trunk",1,4,
420408,"Firefox","Shell Integration","nobody","NEW"," ---","Firefox does not set itself as default browser correctly on Gnome/Linux","2017-12-29 09:33:23",,"2008-02-29 17:25:06","Linux",3,,,,0,"Client Software"," --",,"Trunk",0,3,
422013,"Firefox","Shell Integration","nobody","NEW"," ---","Apple's Migration Assistant does not properly reassign Firefox Downloads folder","2008-03-11 21:33:20",,"2008-03-10 20:02:56","Mac OS X",2,,,,0,"Client Software"," --",,"unspecified",1,1,
423062,"Firefox","Shell Integration","nobody","NEW"," ---","browser window pseudo-maximizes itself the first time I unmaximize it","2009-11-26 01:52:32",,"2008-03-14 18:42:30","Linux",2,,,,0,"Client Software"," --",,"Trunk",0,6,
428468,"Firefox","Shell Integration","nobody","NEW"," ---","Firefox should handle Mac OS's ""Search in Google"" searching when Firefox is set as default browser","2008-04-10 23:06:58",,"2008-04-10 23:06:58","Mac OS X",1,,,,0,"Client Software"," --",,"unspecified",1,0,
428627,"Firefox","Shell Integration","nobody","NEW"," ---","Folder contents not listed when drag&dropped onto Firefox dock icon","2008-04-13 13:16:11",,"2008-04-11 21:51:38","Mac OS X",8,,,,0,"Client Software"," --",,"unspecified",0,2,
431001,"Firefox","Shell Integration","nobody","NEW"," ---","Dragging picture off browser window then dropping into desktop folder moves the folder to upper right corner.","2009-06-11 23:58:45",,"2008-04-26 19:53:42","Mac OS X",4,,,,0,"Client Software"," --",,"unspecified",1,3,
431675,"Firefox","Shell Integration","nobody","NEW"," ---","Firefox doesn't handle gnome virtual desktops and external links very well","2017-08-08 07:23:02",,"2008-05-01 07:01:41","Linux",3,,,,0,"Client Software"," --",,"2.0 Branch",2,3,
434378,"Firefox","Shell Integration","nobody","NEW"," ---","The window colors should be normal while restoring from the Dock","2008-05-22 07:03:19",,"2008-05-18 14:46:10","Mac OS X",8,,,,0,"Client Software"," --",,"Trunk",0,2,
436584,"Firefox","Shell Integration","nobody","NEW"," ---","Links from external apps don't work if Firefox has been open a few hours","2014-09-13 01:36:16",,"2008-05-30 13:37:45","Mac OS X",7,,,,0,"Client Software"," --",,"3.0 Branch",2,5,
438890,"Firefox","Shell Integration","nobody","NEW"," ---","Firefox 3 RC3 disables the Usage of the Apple Remote","2008-06-16 12:15:09",,"2008-06-12 11:05:05","Mac OS X",3,,,,1,"Client Software"," --",,"unspecified",1,3,
442185,"Firefox","Shell Integration","nobody","NEW"," ---","Change of system select color is not detected","2008-06-27 12:55:19",,"2008-06-26 21:07:56","Mac OS X",4,,,,0,"Client Software"," --",,"unspecified",0,1,
445532,"Firefox","Shell Integration","nobody","NEW"," ---","Ctrl-tab dialog appears centered across all displays with multiple displays enabled","2008-08-07 15:58:50",,"2008-07-16 09:57:53","Mac OS X",2,,,,0,"Client Software"," --",,"Trunk",0,0,
449548,"Firefox","Shell Integration","nobody","NEW"," ---","Shut down skips firefox quit dialog","2017-11-18 01:39:03",93789,"2008-08-06 23:54:56","Linux",14,,,,2,"Client Software"," --",,"Trunk",2,8,
452258,"Firefox","Shell Integration","nobody","NEW"," ---","Ask whether to make Firefox the default browser on shutdown rather than on startup","2015-03-19 08:20:34",,"2008-08-26 09:13:16","All",13,,,,1,"Client Software"," --",,"3.0 Branch",0,8,
454003,"Firefox","Shell Integration","nobody","NEW"," ---","The new ""Print to file"" dialog does not remember the directory.","2013-05-07 01:41:43",867544,"2008-09-06 14:03:02","Linux",3,,,,0,"Client Software"," --",,"3.0 Branch",5,3,
455086,"Firefox","Shell Integration","nobody","NEW"," ---","Set up windows file associations for .SVG and .SVGZ when making Firefox the default browser","2018-05-02 08:33:23",,"2008-09-12 15:33:32","Windows XP",6,,,,0,"Client Software"," --",,"unspecified",3,6,
457572,"Firefox","Shell Integration","nobody","NEW"," ---","Firefox 3.0x will not open links from OS or other applications unless already running.","2010-01-24 01:24:53",,"2008-09-28 12:25:15","Mac OS X",13,,,,2,"Client Software"," --",,"3.0 Branch",2,6,
469648,"Firefox","Shell Integration","nobody","NEW"," ---","Firefox doesn't recognize it's the default browser in GNOME and set web browser to Custom","2013-09-04 08:40:03",,"2008-12-15 02:45:57","Linux",4,,,,1,"Client Software"," --",,"unspecified",0,3,
471991,"Firefox","Shell Integration","nobody","NEW"," ---","nsWindowsShellService::GetDefaultFeedReader should close the registry key","2009-01-03 14:09:45",,"2009-01-03 14:09:45","Windows XP",1,,,,0,"Client Software"," --",,"Trunk",0,0,
495988,"Firefox","Shell Integration","nobody","NEW"," ---","""There was a problem sending the command to the program"" error message when opening a url","2016-01-02 10:03:00",491947,"2009-06-02 11:20:21","Windows 7",13,,,,0,"Client Software"," --",,"3.0 Branch",1,8,
504017,"Firefox","Shell Integration","nobody","NEW"," ---","On Vista and above 'Set your programs and defaults' doesn't set all of the defaults","2009-07-13 21:35:38",,"2009-07-13 21:33:02","Windows Vista",1,,,,0,"Client Software"," --",,"unspecified",1,2,
513349,"Firefox","Shell Integration","nobody","NEW"," ---","Need more (some!) shell integration tests","2009-08-31 11:15:35",,"2009-08-28 15:02:47","All",2,,,,0,"Client Software"," --",,"Trunk",1,3,
516502,"Firefox","Shell Integration","nobody","NEW"," ---","Re-add AppleScript support for getting the current URL","2018-10-15 11:51:38",608049,"2009-09-14 13:35:29","Mac OS X",39,,,,2,"Client Software"," --",,"Trunk",60,37,
519985,"Firefox","Shell Integration","nobody","NEW"," ---","Define additional jump lists items for Firefox","2013-05-08 11:24:51","506955, 518666, 577212, 607722, 612654","2009-10-01 08:47:08","Windows 7",19,,,,0,"Client Software"," --",,"Trunk",4,18,
522035,"Firefox","Shell Integration","nobody","NEW"," ---","Investigate alternate behaviors for Aero Peek","2012-06-09 02:18:41",616720,"2009-10-13 07:50:47","Windows 7",41,,,,2,"Client Software"," --",,"Trunk",5,21,
522855,"Firefox","Shell Integration","nobody","NEW"," ---","Use the favicon service for the taskbar preview icon","2014-06-20 09:25:45","522416, 553489, 573638, 619233","2009-10-17 02:59:46","All",33,,,,0,"Client Software"," --",,"unspecified",2,11,
524338,"Firefox","Shell Integration","nobody","NEW"," ---","[10.6] Add dock tile plugin support to allow entering safe mode without command line","2017-08-18 07:33:32",,"2009-10-24 22:03:38","Mac OS X",12,,,,0,"Client Software"," --",,"Trunk",2,6,
524468,"Firefox","Shell Integration","nobody","NEW"," ---","Improve Tab Preview interpolation to reduce poor dithering","2018-05-02 08:35:43",486918,"2009-10-26 08:57:03","Windows 7",7,,,,1,"Client Software"," --",,"Trunk",10,16,
526697,"Firefox","Shell Integration","nobody","NEW"," ---","Selecting a frequent item or a task item in the jump list results in Firefox telling me it is already running with -no-remote.","2017-09-21 19:17:58",,"2009-11-04 19:06:13","Windows 7",6,,,,0,"Client Software"," --",,"Trunk",4,9,
527230,"Firefox","Shell Integration","nobody","NEW"," ---","Aero Peek shows Adobe Reader tabs black","2013-09-28 13:20:10",,"2009-11-07 08:23:38","Windows 7",7,,,,0,"Client Software"," --",,"unspecified",1,3,
527516,"Firefox","Shell Integration","nobody","NEW"," ---","[win7] Aero Peek ""Firefox"" submenu item opens version of primary instance","2011-02-20 13:56:03",,"2009-11-09 12:28:06","Windows 7",6,,,,0,"Client Software"," --",,"3.6 Branch",1,4,
531969,"Firefox","Shell Integration","nobody","NEW"," ---","Drag'n'dropping extensions from Nautilus or Thunar file managers into Addon Manager dialog doesn't work well.","2013-09-06 17:50:32",,"2009-11-30 15:04:34","Linux",4,,,,0,"Client Software"," --",,"Trunk",2,2,
532516,"Firefox","Shell Integration","nobody","NEW"," ---","tooltip window from the search widget is misplaced","2009-12-02 14:35:31",,"2009-12-02 14:35:31","Linux",1,,,,0,"Client Software"," --",,"3.5 Branch",0,0,
535845,"Firefox","Shell Integration","nobody","NEW"," ---","URL-encoded UTF-8 doesn't work on the commandline","2010-09-24 16:42:43",,"2009-12-18 11:51:29","Mac OS X",8,,,,0,"Client Software"," --",,"Trunk",0,2,
538487,"Firefox","Shell Integration","nobody","NEW"," ---","With taskbar previews enabled, print preview gets its ""own tab"".  Switching tabs causes the print preview toolbar to persist and won't close","2018-10-15 01:42:50",,"2010-01-07 15:49:15","Windows 7",27,,,,0,"Client Software"," --",,"Trunk",1,12,
541344,"Firefox","Shell Integration","nobody","NEW"," ---","Possibility to change window icon ""default16.png"" from userChrome.css (taskbar/tasklist/windowlist)","2010-06-26 14:47:52",,"2010-01-22 03:20:57","All",2,,,,0,"Client Software"," --",,"unspecified",0,1,
542170,"Firefox","Shell Integration","nobody","NEW"," ---",".html .htm filetype associations lost in registry","2016-02-24 04:56:24",,"2010-01-25 23:21:34","Windows 7",11,"2011-02-02 05:53:37",,,0,"Client Software"," --",,"unspecified",5,7,
559036,"Firefox","Shell Integration","nobody","NEW"," ---","keeps asking to make firefox default browser","2010-04-23 06:55:00",,"2010-04-13 06:53:45","Windows XP",4,,,,0,"Client Software"," --",,"unspecified",0,1,
565258,"Firefox","Shell Integration","nobody","NEW"," ---","Firefox should register itself as an SVG handler","2015-12-24 00:52:50",,"2010-05-12 00:17:50","All",4,,,,0,"Client Software"," --",,"unspecified",1,2,
566881,"Firefox","Shell Integration","nobody","NEW"," ---","Improve accuracy of recent jumplist site list","2013-05-08 11:26:08",518666,"2010-05-19 08:53:58","Windows 7",2,,,,0,"Client Software"," --",,"Trunk",1,5,
568752,"Firefox","Shell Integration","nobody","NEW"," ---","AeroPeek Thumbbar buttons - set mImage and flags","2010-05-29 18:29:38",,"2010-05-27 21:09:13","Windows 7",4,,,,0,"Client Software"," --",,"Trunk",0,1,
569811,"Firefox","Shell Integration","nobody","NEW"," ---","Dragging and Dropping Link from Other Application onto Minefield Breaks Window Functionality","2010-06-03 03:08:35",,"2010-06-03 03:08:35","Mac OS X",1,,,,0,"Client Software"," --",,"Trunk",0,0,
571664,"Firefox","Shell Integration","nobody","NEW"," ---","Scrolling while keeping mouse at thumbnail preview of a page should scroll the page just like Safari 4/5 and IE8 does in Windows 7","2018-05-02 08:36:58",,"2010-06-12 02:55:09","Windows 7",12,,,,0,"Client Software"," --",,"Trunk",1,3,
572439,"Firefox","Shell Integration","nobody","NEW"," ---","Windows thumbnail previews should acquire player controls when playing video/audio. This will lead to better win7 integration","2011-05-04 18:11:04",,"2010-06-16 09:48:55","Windows 7",17,,,,0,"Client Software"," --",,"Trunk",3,7,
596647,"Firefox","Shell Integration","nobody","NEW"," ---","Add app tabs to the windows taskbar jump list","2017-09-21 23:42:51",597753,"2010-09-15 10:19:16","Windows 7",1,,,,0,"Client Software"," --",,"Trunk",2,8,
596789,"Firefox","Shell Integration","nobody","NEW"," ---","Opening new window wile using Aero Snap creates wrong sized window","2015-03-19 08:20:56",,"2010-09-15 16:16:42","Windows 7",4,,,,0,"Client Software"," --",,"unspecified",0,4,
600063,"Firefox","Shell Integration","nobody","NEW"," ---","Opening a single or multiple html files from Finder creates new windows","2011-03-27 11:46:54",,"2010-09-27 16:16:17","Mac OS X",5,,,,0,"Client Software"," --",,"Trunk",0,4,
602973,"Firefox","Shell Integration","nobody","NEW"," ---","Tab previews in W7 taskbar don't close at their original position","2015-01-14 03:40:23",,"2010-10-08 13:20:24","Windows 7",9,,,,1,"Client Software"," --",,"Trunk",1,7,
604975,"Firefox","Shell Integration","nobody","NEW"," ---","New window shouldn't point to about:home when launched by Windows to provide additional login information","2015-03-19 08:18:59",562917,"2010-10-17 03:47:59","Windows 7",5,,,,0,"Client Software"," --",,"Trunk",0,9,
605659,"Firefox","Shell Integration","nobody","NEW"," ---","Invalidate all the window's tab previews when the chrome is invalidated","2010-10-21 08:55:31",,"2010-10-19 16:23:16","Windows 7",2,,,,0,"Client Software"," --",,"unspecified",0,2,
607154,"Firefox","Shell Integration","nobody","NEW"," ---","Aero Peek + screen lock + js dialog = broken Firefox","2012-01-29 02:08:58",,"2010-10-25 16:43:26","Windows 7",9,,,,0,"Client Software"," --",,"unspecified",1,7,
608049,"Firefox","Shell Integration","nobody","NEW"," ---","Add Applescript Support to Firefox","2018-07-16 08:03:22",,"2010-10-28 11:43:06","Mac OS X",23,,,,1,"Client Software"," --",,"unspecified",28,31,
617389,"Firefox","Shell Integration","nobody","NEW"," ---","XUL applications stay in offline mode when built with --disable-necko-wifi","2012-09-05 14:51:38",,"2010-12-07 11:11:40","Linux",8,,,,0,"Client Software"," --",,"unspecified",0,4,
621941,"Firefox","Shell Integration","nobody","NEW"," ---","Unable pin web locations to taskbar on Windows 7","2012-12-07 19:47:03",,"2010-12-29 11:06:22","Windows 7",5,,,,0,"Client Software"," --",,"unspecified",1,2,
626987,"Firefox","Shell Integration","nobody","NEW"," ---","Improper rendering after Firefox restart if Win7 gadgets are activated","2011-01-19 04:46:54",,"2011-01-19 04:45:15","Windows 7",1,,,,0,"Client Software"," --",,"Trunk",0,3,
632720,"Firefox","Shell Integration","nobody","NEW"," ---","""Hide Others"" should disable ""Hide Firefox"" and ""Hide Others""","2011-02-09 00:28:30",,"2011-02-08 22:39:51","Mac OS X",1,,,,0,"Client Software"," --",,"Trunk",0,4,
634359,"Firefox","Shell Integration","nobody","NEW"," ---","[KDE interop] Track upcoming 'Exposed Tabs' extension of KWin window manager","2015-06-23 09:06:51",,"2011-02-15 11:49:55","Linux",2,,,,0,"Client Software"," --",,"unspecified",0,7,
642851,"Firefox","Shell Integration","nobody","NEW"," ---","When windows taskbar is set to auto-hide and is docked to the top of the monitor on which Firefox is maximized, Fx fails to draw bottom row of pixels","2015-12-31 03:21:35",758280,"2011-03-18 09:46:46","Windows 7",10,,,,2,"Client Software"," --",,"unspecified",3,8,
655774,"Firefox","Shell Integration","nobody","NEW"," ---","Change window icon to match app tab","2011-12-24 23:55:05",,"2011-05-09 11:29:08","Windows 7",1,,,,0,"Client Software"," --",,"5 Branch",0,1,
656087,"Firefox","Shell Integration","nobody","NEW"," ---","Windows jumplists don't work with different app-name","2014-01-14 12:08:12",,"2011-05-10 11:53:38","Windows 7",6,,,,0,"Client Software"," --",,"Trunk",2,4,
656971,"Firefox","Shell Integration","nobody","NEW"," ---","Aero Peek thumbnail caching wastefully monitors paint events for pages at all times","2011-07-03 19:44:36",,"2011-05-13 11:29:01","Windows 7",1,,,,0,"Client Software"," --",,"unspecified",0,5,
675697,"Firefox","Shell Integration","nobody","NEW"," ---","Windows and OS X jumplists should be kept in sync","2014-01-12 10:22:00",,"2011-08-01 11:48:58","All",4,,,,0,"Client Software"," --",,"unspecified",0,6,
699803,"Firefox","Shell Integration","nobody","NEW"," ---","Set required HKLM keys / values for default browser if they are not set using the maintenance service","2013-10-02 09:34:07",,"2011-11-04 08:04:35","Windows Vista",11,,,,0,"Client Software"," --",,"unspecified",0,1,
704544,"Firefox","Shell Integration","nobody","NEW"," ---","Scroll bar appears to be a draggable image on Google Maps result frame","2011-11-22 10:49:13",,"2011-11-22 10:49:13","Mac OS X",1,,,,0,"Client Software"," --",,"9 Branch",0,0,
710002,"Firefox","Shell Integration","nobody","NEW"," ---","Shortcuts to about: URLs created by dragging the identity-block to the desktop causes a shortcut that is launched with Internet Explorer","2011-12-12 15:34:47",,"2011-12-12 15:30:22","Windows 7",1,,,,0,"Client Software"," --",,"Trunk",0,1,
716828,"Firefox","Shell Integration","nobody","NEW"," ---","Remove shell service as a component","2014-02-18 07:12:35",716837,"2012-01-10 00:54:28","All",1,,,,0,"Client Software"," --",,"unspecified",1,2,
