"Bug ID","Product","Component","Assignee","Status","Resolution","Summary","Changed","Depends on","Opened","OS","Number of Comments","Last Resolved","Last Visit","Crash Signature","Duplicate Count","Classification","Priority","Rank","Version","Votes","CC Count","Bug Interest"
717764,"Firefox","Shell Integration","nobody","NEW"," ---","using AppleScript to show Firefox window on OS X results in strange square outside of Firefox window","2016-03-11 07:09:55",,"2012-01-12 14:41:08","Mac OS X",6,,,,0,"Client Software"," --",,"Trunk",0,3,
720599,"Firefox","Shell Integration","nobody","NEW"," ---","Autoscroll icon doesn't scale with system DPI","2013-06-03 18:12:05",,"2012-01-23 19:33:03","Windows 7",2,,,,0,"Client Software"," --",,"9 Branch",0,0,
722174,"Firefox","Shell Integration","nobody","NEW"," ---","When opening a link in an external video player that supports streaming (e.g. Windows Media Player), we should hand the video player the URL, instead of downloading the video and then giving it to the video player","2018-01-05 05:46:17",,"2012-01-29 10:17:49","Windows 7",4,,,,0,"Client Software"," --",,"Trunk",0,8,
725979,"Firefox","Shell Integration","nobody","NEW"," ---","Set as Wallpaper dialog should not use the same string for window and button titles","2013-12-14 02:46:16",,"2012-02-10 06:15:50","All",2,,,,0,"Client Software"," --",,"unspecified",0,3,
729909,"Firefox","Shell Integration","nobody","NEW"," ---","taskbar and tabbar preview preferences not honored","2012-02-24 09:03:43",,"2012-02-23 06:14:44","Windows 7",2,,,,0,"Client Software"," --",,"10 Branch",0,4,
734331,"Firefox","Shell Integration","nobody","NEW"," ---","Convert shell integration into a JavaScript component","2012-03-16 14:56:05",,"2012-03-08 22:47:51","Windows 7",5,,,,0,"Client Software"," --",,"unspecified",1,4,
736940,"Firefox","Shell Integration","nobody","NEW"," ---","Windows's right click menu to close windows does not work on bookmarks subfolder in library","2014-05-08 12:52:28",,"2012-03-18 23:12:41","Windows 7",5,,,,0,"Client Software"," --",,"11 Branch",1,2,
738340,"Firefox","Shell Integration","nobody","NEW"," ---","Phantom tabs appear when using Exposé / Mission Control in Mac OS X","2012-03-22 10:37:01",,"2012-03-22 10:35:24","Mac OS X",3,,,,0,"Client Software"," --",,"14 Branch",0,0,
744302,"Firefox","Shell Integration","nobody","NEW"," ---","Enabling Windows Aero after launching Firefox with it disabled causes broken window frame","2016-10-05 02:27:46",,"2012-04-10 20:06:34","Windows 7",5,,,,0,"Client Software"," --",,"unspecified",0,5,
762533,"Firefox","Shell Integration","nobody","NEW"," ---","Cannot drag and drop from Firefox to foobar2000 (DROPEFFECT_LINK)","2012-06-07 09:34:13",,"2012-06-07 09:15:17","Windows 7",1,,,,0,"Client Software"," --",,"16 Branch",1,1,
765593,"Firefox","Shell Integration","nobody","NEW"," ---","Unresponsive script errors in File Dialog if dialog stays open too long.","2012-06-17 10:50:59",,"2012-06-17 10:50:59","Linux",1,,,,0,"Client Software"," --",,"Trunk",0,0,
771938,"Firefox","Shell Integration","nobody","NEW"," ---"," -bin suffix no longer present on Linux","2012-07-08 13:05:12",,"2012-07-08 13:05:12","Linux",1,,,,0,"Client Software"," --",,"unspecified",0,0,
776303,"Firefox","Shell Integration","nobody","NEW"," ---","Kernel panic during Firefox shutdown on Retina Macbook","2016-12-27 17:53:48",,"2012-07-21 18:16:39","Mac OS X",12,,,,0,"Client Software"," --",,"14 Branch",0,6,
780118,"Firefox","Shell Integration","nobody","NEW"," ---","Firefox asks for default browser although it already is","2015-11-01 04:58:35",,"2012-08-03 05:01:41","Windows XP",18,,,,0,"Client Software"," --",,"Trunk",2,8,
796081,"Firefox","Shell Integration","nobody","NEW"," ---","Green processing bar applies to wrong taskbar item","2012-10-01 12:42:28",,"2012-10-01 12:42:28","Windows 7",1,,,,0,"Client Software"," --",,"14 Branch",1,0,
796860,"Firefox","Shell Integration","nobody","NEW"," ---","Messed up branding when setting browser as default with multiple installs","2013-10-02 09:45:19",,"2012-10-02 02:50:26","Windows 8",12,,,,0,"Client Software"," --",,"Trunk",0,7,
797064,"Firefox","Shell Integration","nobody","NEW"," ---","Error per tab when trying to taskbar preview an unloaded tab.","2013-03-10 03:08:50",,"2012-10-02 12:01:03","Windows 7",5,,,,0,"Client Software"," --",,"Trunk",0,4,
807810,"Firefox","Shell Integration","nobody","NEW"," ---","dragging icons to GNOME Shell workspace opens window in currently focused workspace.","2014-08-28 10:27:26",,"2012-11-01 14:29:53","Linux",5,,,,0,"Client Software"," --",,"31 Branch",1,5,
808891,"Firefox","Shell Integration","nobody","NEW"," ---","Firefox does not open on second desktop when using Profile Manager","2013-07-22 08:57:42",,"2012-11-05 18:49:16","Windows 7",3,,,,0,"Client Software"," --",,"16 Branch",0,2,
815237,"Firefox","Shell Integration","nobody","NEW"," ---","Windows tab previews for unrestored tabs are shown as if they were in loading","2013-01-03 10:53:15",,"2012-11-26 10:56:25","Windows 7",6,,,,0,"Client Software"," --",,"18 Branch",0,4,
816076,"Firefox","Shell Integration","nobody","NEW"," ---","leaving private mode on OS X does not respect virtual desktops","2012-12-04 04:26:32",,"2012-11-28 06:48:10","Mac OS X",1,,,,0,"Client Software"," --",,"17 Branch",0,1,
830513,"Firefox","Shell Integration","nobody","NEW"," ---","Problem of opened links in Firefox from e-mails on two simultaneously running Thunderbird profiles","2013-01-16 07:12:51",,"2013-01-14 14:25:54","Windows 7",3,,,,0,"Client Software"," --",,"18 Branch",0,1,
849571,"Firefox","Shell Integration","nobody","NEW"," ---","WM_CLASS changes after a restart (gnome-shell)","2018-10-10 10:27:37",,"2013-03-09 15:04:49","Linux",8,,,,1,"Client Software"," --",,"21 Branch",3,6,
862285,"Firefox","Shell Integration","nobody","NEW"," ---","mailcap entry for application/pdf makes firefox windows invisible","2013-11-08 23:57:50",,"2013-04-16 03:57:33","OpenBSD",4,,,,0,"Client Software"," --",,"19 Branch",0,4,
880138,"Firefox","Shell Integration","nobody","NEW"," ---","Mark the Cache folder within Profiles as a FilesNotToBackup","2013-08-14 15:42:06",,"2013-06-05 23:41:18","Windows 7",1,,,,0,"Client Software"," --",,"Trunk",0,1,
914441,"Firefox","Shell Integration","nobody","NEW"," ---","[Mac] Nightly icon is low-res","2014-04-16 15:14:13",,"2013-09-09 18:37:19","Mac OS X",4,,,,0,"Client Software"," --",,"Trunk",0,0,
937580,"Firefox","Shell Integration","nobody","NEW"," ---","windows 8 full screen metro app switcher (up left corner)","2013-11-28 23:34:44",,"2013-11-12 04:48:52","Windows 8.1",6,,,,0,"Client Software"," --",,"25 Branch",0,2,
951737,"Firefox","Shell Integration","nobody","NEW"," ---","getting error ""Firefox is already running..."" when selecting any jumplist option from the taskbar","2015-11-02 07:10:37",,"2013-12-18 09:20:31","Windows 8.1",3,,,,0,"Client Software"," --",,"Trunk",0,1,
953139,"Firefox","Shell Integration","nobody","NEW"," ---","Windows Desktop Shortcuts hijacked by 3rd party Software","2015-06-16 20:22:55",,"2013-12-25 17:43:12","Windows 7",7,,,,0,"Client Software"," --",,"unspecified",0,9,
960998,"Firefox","Shell Integration","nobody","NEW"," ---","Setting Firefox as default browser randomly picks installed browser of used branch (latest installed?), using different binary/patch/executable","2014-01-17 05:05:04",,"2014-01-17 05:05:04","Windows 8.1",1,,,,0,"Client Software"," --",,"Trunk",0,0,
961003,"Firefox","Shell Integration","nobody","NEW"," ---","Windows 8.1: setting Firefox as default browser: files and protocols use icons from different branches","2014-01-17 09:59:40",,"2014-01-17 05:16:11","Windows 8.1",1,,,,0,"Client Software"," --",,"Trunk",0,2,
983284,"Firefox","Shell Integration","nobody","NEW"," ---","Opens tabs in wrong window from cmdline","2014-03-13 11:44:56",,"2014-03-13 11:44:56","Linux",1,,,,0,"Client Software"," --",,"unspecified",0,0,
997452,"Firefox","Shell Integration","nobody","NEW"," ---","[Win] Nightly icon is low-res (but Aurora/Firefox icons are OK)","2014-12-01 03:09:59",,"2014-04-16 15:13:14","Windows 8.1",1,,,,0,"Client Software"," --",,"Trunk",0,1,
997537,"Firefox","Shell Integration","nobody","NEW"," ---","Capture of pointer with multiple monitors","2016-06-15 10:09:29",,"2014-04-16 18:45:55","Mac OS X",1,,,,0,"Client Software"," --",,"unspecified",0,6,
1000946,"Firefox","Shell Integration","nobody","NEW"," ---","WindowsPreviewPerTab showing up as 10% of time for app with animating large canvas","2016-07-07 03:29:27",,"2014-04-24 08:49:42","Windows 8",8,,,,0,"Client Software"," --",,"unspecified",0,5,
1009132,"Firefox","Shell Integration","nobody","NEW"," ---","""Locking to launcher"" doesn't work in Ubuntu Unity","2014-05-16 22:49:53",,"2014-05-12 11:40:32","Linux",1,,,,0,"Client Software"," --",,"unspecified",0,0,
1025467,"Firefox","Shell Integration","nobody","NEW"," ---","Support for remote file upload on Linux through GTK file chooser","2017-12-06 09:59:07",,"2014-06-14 01:54:11","Linux",2,,,,0,"Client Software"," --",,"30 Branch",2,2,
1031011,"Firefox","Shell Integration","nobody","NEW"," ---","Don't capture Windows taskbar thumbnails while scrolling","2014-08-25 13:55:19",712478,"2014-06-26 14:46:03","Windows 8.1",2,,,,0,"Client Software"," --",,"unspecified",3,9,
1054009,"Firefox","Shell Integration","nobody","NEW"," ---","[UX] Tweak the Default Status notification bar to work in smaller window sizes","2015-11-07 06:51:48",,"2014-08-14 13:38:22","All",1,,,,0,"Client Software"," --",,"unspecified",0,3,
1058431,"Firefox","Shell Integration","nobody","NEW"," ---","The Nightly icon is not vertically centered on notification bar for setting the default browser","2015-11-07 06:53:25",,"2014-08-26 00:22:00","Windows 7",1,,,,0,"Client Software"," --",,"34 Branch",0,0,
1058507,"Firefox","Shell Integration","nobody","NEW"," ---","The Firefox taskbar icon disappears after enter/exit Unity Dead Trigger 2 fullscreen","2014-08-27 15:35:50",,"2014-08-26 02:52:32","Windows 8.1",6,,,,0,"Client Software"," --",,"Trunk",0,2,
1061479,"Firefox","Shell Integration","nobody","NEW"," ---","No confirmation message when I set Firefox as my default browser","2014-12-29 07:00:11",,"2014-09-02 01:55:36","All",1,,,,0,"Client Software"," --",,"34 Branch",0,2,
1065838,"Firefox","Shell Integration","nobody","NEW"," ---","Windows Speech Recognition makes Firefox very laggy.","2014-09-11 10:50:15",,"2014-09-10 20:02:03","Windows 8.1",1,,,,0,"Client Software"," --",,"unspecified",0,5,
1107094,"Firefox","Shell Integration","nobody","NEW"," ---","In Firefox 34 on OS X clicking on the Window menu won't show my other open windows","2014-12-22 22:43:32",,"2014-12-03 08:22:23","Mac OS X",16,,,,6,"Client Software"," --",,"34 Branch",0,12,
1118150,"Firefox","Shell Integration","nobody","NEW"," ---","nsIShellService.isDefaultBrowser may throw an exception on Windows","2015-01-13 20:50:18",,"2015-01-05 23:48:31","Windows 7",40,,,,0,"Client Software"," --",,"unspecified",0,4,
1128772,"Firefox","Shell Integration","nobody","NEW"," ---","Activate existing window instead of create new window when clicked tile from Windows Start screen","2016-08-05 12:36:38",,"2015-02-02 16:43:35","Windows 8.1",6,,,,0,"Client Software"," --",,"35 Branch",0,2,
1131428,"Firefox","Shell Integration","nobody","NEW"," ---","WindowsPreviewPerTab.jsm's _imageFromURI doesn't always call its callback","2016-01-26 02:30:40",,"2015-02-09 18:34:47","All",1,,,,0,"Client Software"," --",,"Trunk",0,1,
1134720,"Firefox","Shell Integration","nobody","NEW"," ---","Firefox Nightly cannot be set as a default browser because of broken .desktop file","2015-04-13 15:48:17",,"2015-02-19 10:11:06","Linux",2,,,,0,"Client Software"," --",,"38 Branch",0,1,
1178212,"Firefox","Shell Integration","nobody","NEW"," ---","Favicon shortcuts should not unconditionally squash icon down to 16x16","2018-01-08 18:35:23",,"2015-06-29 02:24:50","Windows 7",3,,,,0,"Client Software"," --",,"Trunk",1,2,
1188135,"Firefox","Shell Integration","nobody","NEW"," ---","Windows 10 upgrade has switch-to-Edge unchecked but Firefox is not listed as the default in the modern Settings application","2015-08-03 15:37:52",,"2015-07-27 15:01:26","Unspecified",7,,,,0,"Client Software"," --",,"unspecified",1,8,
1191249,"Firefox","Shell Integration","nobody","NEW"," ---","Defer showing the default browser prompt to 2nd run (and only show it a maximum of three times)","2015-08-05 03:08:03",,"2015-08-05 03:08:03","All",1,,,,0,"Client Software"," --",,"42 Branch",0,1,
1197754,"Firefox","Shell Integration","nobody","NEW"," ---","Remove preprocessing from browser/components/shell XUL file","2015-08-24 03:37:49",1197745,"2015-08-24 03:37:49","Unspecified",1,,,,0,"Client Software"," --",,"38 Branch",0,0,
1199845,"Firefox","Shell Integration","nobody","NEW"," ---","Add a cross-platform library for determining if default browser prompt should be shown","2015-08-28 16:31:45",,"2015-08-28 16:31:45","Unspecified",1,,,,0,"Client Software"," --",,"Trunk",0,0,
1202181,"Firefox","Shell Integration","nobody","NEW"," ---","Firefox application button in the task bar doesn't display tooltip with title after ~10 seconds Firefox was launched","2016-05-24 01:22:44",,"2015-09-05 15:26:09","Unspecified",5,,,,1,"Client Software"," --",,"Trunk",1,1,
1205066,"Firefox","Shell Integration","nobody","NEW"," ---","nsMacShellService::SetDefaultBrowser throws","2015-09-16 05:17:25",,"2015-09-15 15:01:31","Unspecified",3,,,,0,"Client Software"," --",,"Trunk",0,3,
1217547,"Firefox","Shell Integration","nobody","NEW"," ---","Windows shell buttons (minimize/maximize/close) disappear when Windowblinds theme is applied if OMTC is enabled","2015-12-07 12:16:42",,"2015-10-22 12:27:38","Windows 8",16,,,,1,"Client Software"," --",,"32 Branch",0,3,
1223805,"Firefox","Shell Integration","nobody","NEW"," ---","Window doesn't launch in the Dock window","2017-07-27 05:12:08",,"2015-11-11 07:06:52","Mac OS X",1,,,,0,"Client Software"," --",,"unspecified",0,0,
1223833,"Firefox","Shell Integration","nobody","NEW"," ---","Remove the #ifndef RELEASE_BUILD guards around skipping the default-browser dialog on first-run","2015-11-30 17:37:41",,"2015-11-11 08:25:15","Unspecified",3,,,,0,"Client Software"," --",,"Trunk",0,3,
1225098,"Firefox","Shell Integration","nobody","NEW"," ---","Browser default dialog rowcount histogram increases incorrectly","2015-11-16 05:21:18",,"2015-11-16 05:21:18","All",1,,,,0,"Client Software"," --",,"Trunk",0,1,
1225780,"Firefox","Shell Integration","nobody","NEW"," ---","[MAC] Browser_set_ default_error histogram is true while setting Firefox as default browser","2015-11-18 02:24:16",,"2015-11-18 02:24:16","Mac OS X",1,,,,0,"Client Software"," --",,"Trunk",0,1,
1225814,"Firefox","Shell Integration","nobody","NEW"," ---","[Ubuntu] Browser_set_ default_time_to_completion_seconds histogram does not appear in about:telemetry","2015-11-18 04:36:30",,"2015-11-18 04:36:30","Linux",1,,,,0,"Client Software"," --",,"Trunk",0,1,
1228162,"Firefox","Shell Integration","nobody","NEW"," ---","Save/open modal windows don't allow dragging a file to another applications","2018-05-02 11:22:11",,"2015-11-25 15:32:03","Unspecified",3,,,,0,"Client Software"," --",,"Trunk",0,0,
1230203,"Firefox","Shell Integration","nobody","NEW"," ---","Firefox window loses focus when I open a file/site from downloads popup (or from an application running in background)","2016-03-08 15:19:05",,"2015-12-03 09:08:19","Unspecified",3,,,,0,"Client Software"," --",,"Trunk",0,1,
1231125,"Firefox","Shell Integration","nobody","NEW"," ---","Implement Gnome Application menu","2015-12-08 07:37:44",,"2015-12-08 07:06:27","Unspecified",2,,,,0,"Client Software"," --",,"unspecified",0,0,
1235318,"Firefox","Shell Integration","nobody","NEW"," ---","[tablet mode] Shrink the window when the on-screen keyboard is visible and docked","2016-02-05 06:41:23",,"2015-12-28 00:08:24","Windows 10",5,,,,0,"Client Software"," --",,"unspecified",1,3,
1243603,"Firefox","Shell Integration","nobody","NEW"," ---","Add telemetry to record when Firefox is launched with an external URL","2016-01-27 21:35:49",,"2016-01-27 17:28:30","Unspecified",2,,,,0,"Client Software"," --",,"Trunk",0,1,
1245466,"Firefox","Shell Integration","nobody","NEW"," ---","(feat req) show profile name in the application switcher","2016-02-04 06:27:47",,"2016-02-03 03:55:29","All",3,,,,0,"Client Software"," --",,"44 Branch",0,3,
1247818,"Firefox","Shell Integration","nobody","NEW"," ---","[QX cluster] Fix a number of default browser prompt issues","2017-08-02 22:31:31","1041514, 1143116, 1189038, 1196098, 1240892, 1272162, 1276027, 1286651, 1306045","2016-02-11 17:48:56","Unspecified",1,,,,0,"Client Software"," --",,"Trunk",1,1,
1253372,"Firefox","Shell Integration","nobody","NEW"," ---","Email link does not open in Firefox when Firefox is closed","2016-06-13 01:47:21",,"2016-03-03 11:35:54","Mac OS X",3,,,,0,"Client Software"," --",,"44 Branch",0,2,
1262234,"Firefox","Shell Integration","nobody","NEW"," ---","Prompted on Firefox restart to make Safari my default browser","2017-08-18 07:31:33",,"2016-04-05 11:51:33","Mac OS X",6,,,,0,"Client Software"," --",,"unspecified",0,2,
1263651,"Firefox","Shell Integration","nobody","NEW"," ---","Setting default browser to Firefox on win10 fails (reproducible)","2016-04-11 10:21:52",,"2016-04-11 09:23:43","Unspecified",4,,,,0,"Client Software"," --",,"47 Branch",0,6,
1274517,"Firefox","Shell Integration","nobody","NEW"," ---","Remove DefaultBrowserOptOut code after the stub installer and installer no longer support setting Firefox as the default browser","2016-11-04 14:56:41",1272162,"2016-05-20 01:25:42","Unspecified",6,,,,0,"Client Software"," --",,"unspecified",0,1,
1301752,"Firefox","Shell Integration","nobody","NEW"," ---","Firefox's instructions for setting it as default browser on Windows 10 **do not work** (they're for a different config tool than the one that actually appears)","2016-09-27 12:43:20",,"2016-09-09 11:32:58","Unspecified",8,,,,0,"Client Software"," --",,"unspecified",0,2,
1304803,"Firefox","Shell Integration","nobody","NEW"," ---","Can't set Nightly as the default browser in Windows 10 Anniversary Update","2016-09-30 07:00:45",,"2016-09-22 10:59:25","Windows 10",6,,,,0,"Client Software"," --",,"unspecified",0,1,
1306045,"Firefox","Shell Integration","nobody","NEW"," ---","Improve the default browser prompt experience","2017-04-04 13:32:05",,"2016-09-28 10:17:28","Unspecified",4,,,,0,"Client Software"," --",,"Trunk",1,10,
1325109,"Firefox","Shell Integration","nobody","NEW"," ---","Create a ""Host Application"" for connecting with the WebExtension message passing API","2017-03-09 06:18:50",,"2016-12-21 08:48:20","Unspecified",3,,,,0,"Client Software"," --",,"unspecified",0,5,
1339325,"Firefox","Shell Integration","nobody","NEW"," ---","Firefox does not recognize local Windows group to allow access from a user (on Program Files directory or accessed files)","2017-02-13 20:43:15",,"2017-02-13 20:43:15","Windows",1,,,,0,"Client Software"," --",,"unspecified",0,0,
1362775,"Firefox","Shell Integration","nobody","NEW"," ---","Intermittent browser/components/shell/test/browser_633221.js | application terminated with exit code -139","2018-03-11 18:44:11",,"2017-05-06 12:02:50","Unspecified",21,,,,1,"Client Software"," --",,"unspecified",0,1,
1403908,"Firefox","Shell Integration","nobody","NEW"," ---","Unable to set Nightly as default browser in Linux/Cinnamon","2018-01-19 02:13:13",,"2017-09-28 05:57:35","Linux",4,,,,0,"Client Software"," --",,"57 Branch",0,1,
1422429,"Firefox","Shell Integration","nobody","NEW"," ---","dragging images to desktop in os x does not drop properly","2018-01-12 02:01:10",,"2017-12-01 15:39:48","Mac OS X",3,,,,0,"Client Software"," --",,"58 Branch",0,2,
1437690,"Firefox","Shell Integration","nobody","NEW"," ---","Cancelling and closing the Windows 10 default browser window janks Firefox heavily","2018-02-12 14:32:59",,"2018-02-12 14:32:59","Windows",1,,,,0,"Client Software"," --",,"Trunk",0,0,
1455846,"Firefox","Shell Integration","nobody","NEW"," ---","Firefox on macOS changes default apps for viewing / editing image files when dragged to the deskop / Finder","2018-04-25 10:57:57",,"2018-04-21 06:16:52","Unspecified",2,,,,0,"Client Software"," --",,"59 Branch",0,1,
1460760,"Firefox","Shell Integration","nobody","NEW"," ---","command line parameters: text interpreted as url depending on presence of -console","2018-05-10 15:51:06",,"2018-05-10 15:51:06","Unspecified",1,,,,0,"Client Software"," --",,"unspecified",0,0,
1461759,"Firefox","Shell Integration","nobody","NEW"," ---","[snap] Opening a file with ""Url Handler Script"" does nothing","2018-07-17 04:41:44",,"2018-05-15 11:05:36","Unspecified",4,,,,0,"Client Software"," --",,"59 Branch",3,4,
1465153,"Firefox","Shell Integration","nobody","NEW"," ---","Cannot set FF release as default on Win 10, always takes FF Nightly.exe instead.","2018-06-03 07:19:30",,"2018-05-29 10:19:04","Windows 10",4,,,,0,"Client Software"," --",,"60 Branch",0,1,
1466735,"Firefox","Shell Integration","nobody","NEW"," ---","Clicking on a link from another app should go to last-used Firefox window","2018-06-05 16:39:31",,"2018-06-04 19:04:10","Mac OS X",3,,,,0,"Client Software"," --",,"Trunk",0,0,
1470785,"Firefox","Shell Integration","nobody","NEW"," ---","Separate Mac Nightly apps both think they are the default browser","2018-08-21 12:51:48",,"2018-06-24 17:23:16","Mac OS X",5,,,,1,"Client Software"," --",,"Trunk",0,5,
1476631,"Firefox","Shell Integration","nobody","NEW"," ---","Icon size Windows 10 is too large","2018-10-16 08:51:38",,"2018-07-18 07:34:37","Unspecified",3,,,,0,"Client Software"," --",,"Trunk",0,3,
1478198,"Firefox","Shell Integration","nobody","NEW"," ---","Need a way to redirect stdout/stderr in child process to console","2018-07-25 10:33:54",,"2018-07-24 17:55:39","Windows",1,,,,0,"Client Software"," --",,"unspecified",0,2,
1480686,"Firefox","Shell Integration","nobody","NEW"," ---","[windows] Tab previews are not displayed in the taskbar for more than 20 tabs","2018-08-06 11:19:29",,"2018-08-03 00:29:07","Windows",1,,,,0,"Client Software"," --",,"Trunk",0,1,
1493817,"Firefox","Shell Integration","nobody","NEW"," ---","app switching doesn't show users","2018-10-15 11:28:27",,"2018-09-24 14:55:14","Unspecified",3,,,,0,"Client Software"," --",,"62 Branch",0,1,
1494371,"Firefox","Shell Integration","nobody","NEW"," ---","[DevEdition][Linux] I can't select DevEdition as my default browser","2018-09-26 12:52:31",,"2018-09-26 10:21:35","Linux",1,,,,0,"Client Software"," --",,"63 Branch",0,0,
1494436,"Firefox","Shell Integration","nobody","NEW"," ---","[Linux][Nightly] I can no longer open external links in Nightly after the 2nd selection of the ""Use Nightly as my default browser""","2018-09-26 13:10:40",,"2018-09-26 13:10:40","Linux",1,,,,0,"Client Software"," --",,"64 Branch",0,0,
1494480,"Firefox","Shell Integration","nobody","NEW"," ---","[Linux] Unable to open external link - Failed to execute child process error","2018-09-26 15:16:31",,"2018-09-26 15:14:45","Linux",1,,,,0,"Client Software"," --",,"unspecified",0,0,
1239694,"Firefox","Shell Integration","ozoder","NEW"," ---","[gnome] firefox should have a search provider","2018-08-24 06:49:02",,"2016-01-14 07:39:41","Linux",4,,,,0,"Client Software"," --",,"unspecified",0,2,
761651,"Firefox","Shell Integration","pjasicek","NEW"," ---","[Linux] Normal Firefox icon displayed in launcher instead of Nightly icon","2016-03-14 06:52:58",,"2012-06-05 09:06:49","Linux",13,,,,0,"Client Software"," --",,"Trunk",2,9,
527181,"Firefox","Shell Integration","tellrob","NEW"," ---","Aero Peek needs to invalidate previews when chrome redraws","2010-04-21 19:39:57",,"2009-11-06 21:03:32","Windows 7",2,,,,1,"Client Software"," --",,"Trunk",1,3,
1404199,"Firefox","Shell Integration","nobody","NEW"," ---","Click URL from Skype, Firefox Nightly is launched but only default window, it doesn't open url","2017-10-11 21:39:38",,"2017-09-28 21:12:20","Linux",2,,,,0,"Client Software","P2",,"57 Branch",0,1,
1169925,"Firefox","Shell Integration","nobody","NEW"," ---","[tablet mode] Integrate with Windows 10 global back button","2016-04-22 17:33:54",,"2015-05-30 08:14:55","Unspecified",6,,,,1,"Client Software","P3",,"unspecified",3,9,
1179468,"Firefox","Shell Integration","nobody","NEW"," ---","[tablet mode] Links opened from the Win 10 mail app in tablet mode should snap Firefox on the side","2016-02-05 08:26:14",,"2015-07-01 13:14:57","Unspecified",2,,,,0,"Client Software","P3",,"unspecified",1,0,
1180259,"Firefox","Shell Integration","nobody","NEW"," ---","[tablet mode] Restart for updates fails to bring the browser back","2016-02-06 02:55:41",,"2015-07-03 09:26:03","Unspecified",2,,,,0,"Client Software","P3",,"Trunk",1,2,
1184944,"Firefox","Shell Integration","nobody","NEW"," ---","[Windows 10] Allow right-click on caption buttons to show the system titlebar menu","2015-10-28 12:07:58",1173725,"2015-07-17 06:07:34","Unspecified",2,,,,0,"Client Software","P3",,"38 Branch",1,2,
1258943,"Firefox","Shell Integration","nobody","NEW"," ---","Intermittent browser_633221.js | application timed out after 330 seconds with no output","2016-09-01 12:00:31",,"2016-03-22 21:31:18","Unspecified",2,,,,0,"Client Software","P3",,"unspecified",0,0,
1286651,"Firefox","Shell Integration","nobody","NEW"," ---","Switch the Default Browser prompt to a global notification bar","2016-08-30 04:46:36",,"2016-07-13 13:05:01","Unspecified",3,,,,0,"Client Software","P3",,"Trunk",1,2,
1310392,"Firefox","Shell Integration","nobody","NEW"," ---","Links from external sources not opening correctly","2017-04-04 13:31:50",,"2016-10-14 21:43:37","Linux",20,,,,0,"Client Software","P3",,"52 Branch",0,3,
