"Bug ID","Product","Component","Assignee","Status","Resolution","Summary","Changed","Depends on","Opened","OS","Number of Comments","Last Resolved","Last Visit","Crash Signature","Duplicate Count","Classification","Priority","Rank","Version","Votes","CC Count","Bug Interest"
418548,"Firefox","Build Config","nobody","UNCONFIRMED"," ---","build fails on libsoftokn3.so (for undefined symbol in libsqlite3.so)","2016-02-09 15:22:22",,"2008-02-19 18:48:06","SunOS",8,,,,0,"Client Software"," --",,"3.0 Branch",1,7,
419604,"Firefox","Build Config","nobody","UNCONFIRMED"," ---","Stub comment is required for xptcstubsdef.inc which works on all platforms","2008-02-26 03:24:11",,"2008-02-26 03:24:11","All",1,,,,0,"Client Software"," --",,"unspecified",1,0,
607556,"Firefox","Build Config","nobody","UNCONFIRMED"," ---","""TypeError: this.generalBranch is undefined"" error while closing windows.","2013-10-03 06:26:49",,"2010-10-26 22:17:26","Windows 7",3,"2013-10-03 13:22:58",,,0,"Client Software"," --",,"4.0 Branch",0,2,
643417,"Firefox","Build Config","nobody","UNCONFIRMED"," ---","Build error due to non-empty environment variable $GREP_OPTIONS","2012-08-20 08:55:05",,"2011-03-21 08:04:40","Linux",2,,,,0,"Client Software"," --",,"4.0 Branch",1,0,
674133,"Firefox","Build Config","nobody","UNCONFIRMED"," ---","build fails with nsStringAPI.h : size of array arg is negative","2011-08-23 00:18:40",,"2011-07-25 17:30:57","Linux",5,,,,0,"Client Software"," --",,"8 Branch",0,4,
815075,"Firefox","Build Config","nobody","UNCONFIRMED"," ---","libffi fails to build when --target=arm-linux-gnueabi","2012-11-27 03:54:36",,"2012-11-26 02:07:58","Windows 7",2,,,,0,"Client Software"," --",,"17 Branch",0,1,
870107,"Firefox","Build Config","nobody","UNCONFIRMED"," ---","Firefox's _NET_WM_NAME ends with a junk \177 character","2013-05-14 23:21:31",,"2013-05-08 14:24:08","Linux",4,,,,0,"Client Software"," --",,"20 Branch",0,1,
903764,"Firefox","Build Config","nobody","UNCONFIRMED"," ---","error ""Library not loaded: @executable_path/libmozglue.dylib"" on Mac builds","2013-09-19 10:16:03",,"2013-08-10 08:17:25","Mac OS X",2,,,,0,"Client Software"," --",,"23 Branch",0,1,
937008,"Firefox","Build Config","nobody","UNCONFIRMED"," ---","ArgumentsObject.cpp:637:2: fatal error: opening dependency file .deps/ArgumentsObject.o.pp: No such file or directory","2013-11-11 14:45:47",,"2013-11-10 23:17:08","Linux",5,,,,0,"Client Software"," --",,"25 Branch",0,4,
1101501,"Firefox","Build Config","nobody","UNCONFIRMED"," ---","[Cosmetic] Add description to missing Firefox's EXE and DLL File description field for better clarity","2014-11-19 04:40:43",,"2014-11-19 04:17:33","Windows 7",1,,,,0,"Client Software"," --",,"33 Branch",1,0,
1195266,"Firefox","Build Config","nobody","UNCONFIRMED"," ---","Build failure: ""error: ‘nsIWidget’ has not been declared"" when --disable-printing","2016-02-15 01:24:13",,"2015-08-17 05:20:19","Unspecified",2,,,,0,"Client Software"," --",,"40 Branch",1,2,
1213579,"Firefox","Build Config","nobody","UNCONFIRMED"," ---","Compilation: Bootstrap.py missing parantheses to print on line 67","2015-12-14 19:07:09",,"2015-10-10 06:12:49","Unspecified",1,,,,0,"Client Software"," --",,"unspecified",0,0,
1213608,"Firefox","Build Config","nobody","UNCONFIRMED"," ---","DLL Hijacking with dbghelp.dll that doesn't exist at Application's Folder","2016-05-05 17:37:22",,"2015-10-10 13:25:44","Unspecified",9,,,,0,"Client Software"," --",,"41 Branch",0,7,
1243074,"Firefox","Build Config","nobody","UNCONFIRMED"," ---","Add disable extension verifying flag to makefile","2016-01-27 06:12:09",,"2016-01-26 11:02:32","Unspecified",1,,,,0,"Client Software"," --",,"43 Branch",0,1,
1314306,"Firefox","Build Config","nobody","UNCONFIRMED"," ---","Build fails outside clean chroot","2016-11-15 04:54:56",,"2016-11-01 09:04:14","Linux",2,,,,0,"Client Software"," --",,"50 Branch",0,0,
1320018,"Firefox","Build Config","nobody","UNCONFIRMED"," ---","mozillabuild-Unable to call a suitable vcvars script(start-shell-msvc2015.bat)","2017-03-27 21:03:05",,"2016-11-23 23:50:54","Windows 7",2,,,,0,"Client Software"," --",,"24 Branch",0,1,
383348,"Firefox","Build Config","allamsetty.anup","NEW"," ---","configure should fail if you don't have gconf, gnome-vfs","2015-06-12 11:36:56",,"2007-06-05 12:50:23","Linux",15,,,,2,"Client Software"," --",,"Trunk",1,14,
1286788,"Firefox","Build Config","enes.goktas","NEW"," ---","LLVMgold.so missing in the clang package on the Try Server, causes -flto to fail","2017-03-17 07:34:40",1272629,"2016-07-14 02:19:41","Unspecified",30,,,,0,"Client Software"," --",,"unspecified",0,6,
356594,"Firefox","Build Config","nobody","NEW"," ---","Need to support locale-specific removed-files","2017-08-18 07:03:23",,"2006-10-13 11:08:43","All",6,,,,0,"Client Software"," --",,"2.0 Branch",1,5,
397609,"Firefox","Build Config","nobody","NEW"," ---","make package doesn't work with --enable-jprof","2007-09-27 18:45:58",,"2007-09-25 22:20:43","Linux",1,,,,0,"Client Software"," --",,"Trunk",1,1,
449936,"Firefox","Build Config","nobody","NEW"," ---","configure on linux requires ogg with --disable-compile-environment","2016-04-23 11:52:17",,"2008-08-09 04:23:24","Linux",2,,,,0,"Client Software"," --",,"Trunk",0,1,
460548,"Firefox","Build Config","nobody","NEW"," ---","Port |Bug 450983 - use leakThreshold for SeaMonkey testers| to Firefox","2009-06-15 08:24:07","450983, 462545, 465952, 466248, 469581, 471647, 472677, 473802, 495533","2008-10-17 19:57:05","All",24,,,,0,"Client Software"," --",,"Trunk",0,9,
462477,"Firefox","Build Config","nobody","NEW"," ---","Centralize -DOFFICIAL_BUILD and add to --enable-official-branding","2009-07-01 23:52:24",,"2008-10-30 21:04:47","All",3,,,,0,"Client Software"," --",,"Trunk",0,5,
486943,"Firefox","Build Config","nobody","NEW"," ---","symbolstore.py: |command timed out: 1200 seconds without output|","2011-12-15 18:01:24",,"2009-04-05 07:40:54","Windows Server 2003",2,,,,0,"Client Software"," --",,"Trunk",1,2,
519393,"Firefox","Build Config","nobody","NEW"," ---","configure should check for the presence of bfd.h (binutils headers) when building leaky","2011-04-27 00:03:41",,"2009-09-28 22:37:19","Linux",2,,,,0,"Client Software"," --",,"Trunk",0,2,
519396,"Firefox","Build Config","nobody","NEW"," ---","leaky build fails: JB_BP undefined","2009-09-29 04:38:03",,"2009-09-28 23:11:14","Linux",2,,,,0,"Client Software"," --",,"Trunk",0,1,
529578,"Firefox","Build Config","nobody","NEW"," ---","duplicate definition of 'enum NXByteOrder' breaks compilation","2009-12-06 16:12:52",,"2009-11-18 10:46:48","Mac OS X",3,,,,0,"Client Software"," --",,"Trunk",0,0,
530253,"Firefox","Build Config","nobody","NEW"," ---","Give the default theme a name in the extensions list","2009-11-20 23:22:40",,"2009-11-20 20:16:48","All",1,,,,0,"Client Software"," --",,"Trunk",0,1,
549954,"Firefox","Build Config","nobody","NEW"," ---","Upload textfile with l10n changeset for nightly and hourly builds","2013-02-26 11:36:25",,"2010-03-03 10:28:47","All",4,,,,0,"Client Software"," --",,"Trunk",0,6,
591158,"Firefox","Build Config","nobody","NEW"," ---","Media-disabled Built: 'NS_MOZAUDIOAVAILABLE' was not declared in nsEventListenerManager.cpp","2010-08-26 21:10:36",,"2010-08-26 21:09:21","Linux",1,,,,0,"Client Software"," --",,"Trunk",0,0,
667058,"Firefox","Build Config","nobody","NEW"," ---","Stray ASCII DEL (0x7F) glyph in the window title, due to misuse of """" in a Makefile","2011-11-30 06:08:59",,"2011-06-24 14:20:37","Linux",6,,,,0,"Client Software"," --",,"unspecified",0,5,
714325,"Firefox","Build Config","nobody","NEW"," ---","Package 'necko_websocket.xpt' in Firefox after |Bug 640003 - WebSockets - upgrade to ietf-07|","2012-02-06 16:07:56",640003,"2011-12-30 11:27:10","All",3,,,,0,"Client Software"," --",,"Trunk",0,4,
715866,"Firefox","Build Config","nobody","NEW"," ---","Build Error: Typelib._header.unpack(map[:Typelib._header.size])","2012-01-06 05:31:28",,"2012-01-06 05:30:24","Linux",2,,,,0,"Client Software"," --",,"10 Branch",0,1,
769823,"Firefox","Build Config","nobody","NEW"," ---","eliminate redundancy between testing/mozbase and build/ python","2015-02-14 12:21:32",,"2012-06-29 14:58:11","All",2,,,,0,"Client Software"," --",,"unspecified",0,4,
774442,"Firefox","Build Config","nobody","NEW"," ---","Normalize browser/locales/Makefile.in","2012-08-04 05:47:43",,"2012-07-16 13:45:57","All",3,,,,0,"Client Software"," --",,"11 Branch",0,2,
784209,"Firefox","Build Config","nobody","NEW"," ---","package dist/bin/webapprt/modules/*","2012-08-20 16:53:19",,"2012-08-20 16:53:19","All",1,,,,0,"Client Software"," --",,"Trunk",0,0,
819961,"Firefox","Build Config","nobody","NEW"," ---","Errors in config/writemozinfo.py should be fatal to configure","2012-12-10 08:10:27",,"2012-12-10 08:10:27","All",1,,,,0,"Client Software"," --",,"unspecified",0,1,
986072,"Firefox","Build Config","nobody","NEW"," ---","Configure should require DirectX SDK when building WebRTC","2014-03-20 11:15:05",,"2014-03-20 11:13:09","Windows 8.1",2,,,,0,"Client Software"," --",,"unspecified",0,1,
1030815,"Firefox","Build Config","nobody","NEW"," ---","Remove dangerous --disable-<feature> mozconfig options","2014-06-27 04:01:26",,"2014-06-26 09:17:14","All",4,,,,0,"Client Software"," --",,"31 Branch",0,5,
1145767,"Firefox","Build Config","nobody","NEW"," ---","Prevent the same file in both EXTRA_PP_JS_MODULES and EXTRA_JS_MODULES","2015-03-20 12:51:36",,"2015-03-20 12:51:36","All",1,,,,0,"Client Software"," --",,"unspecified",0,0,
1150859,"Firefox","Build Config","nobody","NEW"," ---","Remove preprocessor directives from browser code","2015-11-30 18:38:16","1150860, 1195780, 1195962, 1195965, 1197745, 1197754, 1197755, 1197758, 1197763, 1197764, 1228627, 1228655","2015-04-03 05:15:33","All",8,,,,0,"Client Software"," --",,"32 Branch",1,19,
1160516,"Firefox","Build Config","nobody","NEW"," ---","Build fails with ""fatal error: 'linux/ethtool.h' file not found"" on OS X","2015-05-01 10:07:24",,"2015-05-01 07:42:02","Mac OS X",20,,,,0,"Client Software"," --",,"unspecified",0,2,
1179803,"Firefox","Build Config","nobody","NEW"," ---","Use --with-libdir on linux to ensure libdir is not auto-detected based on build distro","2015-07-02 14:39:00",,"2015-07-02 08:17:47","All",4,,,,0,"Client Software"," --",,"unspecified",0,3,
1215332,"Firefox","Build Config","nobody","NEW"," ---","Context menu wrong size when css.layout.devPixelsPerPx changed.","2015-11-10 13:37:23",,"2015-10-15 15:33:08","Mac OS X",2,,,,0,"Client Software"," --",,"44 Branch",0,1,
1249405,"Firefox","Build Config","nobody","NEW"," ---","Error processing libyuv/moz.build while reticularing splines","2016-02-19 17:30:23",,"2016-02-18 13:09:31","Linux",5,,,,0,"Client Software"," --",,"unspecified",0,3,
1260401,"Firefox","Build Config","nobody","NEW"," ---","netErrorApp.dtd in top level omni.ja of firefox-45 zh-CN is ill-formed, which makes netError.xhtml unusable","2016-03-29 04:04:29",,"2016-03-29 03:36:22","Unspecified",3,,,,0,"Client Software"," --",,"unspecified",0,1,
1281151,"Firefox","Build Config","nobody","NEW"," ---","locale.Error: unsupported locale setting whenever running mach","2016-06-21 04:53:21",,"2016-06-21 04:52:35","Unspecified",2,,,,0,"Client Software"," --",,"unspecified",0,0,
1297074,"Firefox","Build Config","nobody","NEW"," ---","mach / the build system really don't like mozconfig paths with spaces (at least on Windows)","2016-08-22 09:35:13",,"2016-08-22 06:51:12","Unspecified",2,,,,0,"Client Software"," --",,"Trunk",0,3,
1316735,"Firefox","Build Config","nobody","NEW"," ---","Relative symlinks in the dist directory","2016-12-15 16:41:07",,"2016-11-10 14:22:52","Unspecified",14,,,,0,"Client Software"," --",,"unspecified",0,5,
1323741,"Firefox","Build Config","nobody","NEW"," ---","Define CAN_DRAW_IN_TITLEBAR in a single central place","2017-01-13 04:14:18",,"2016-12-15 06:54:36","Unspecified",4,,,,0,"Client Software"," --",,"unspecified",0,3,
1334436,"Firefox","Build Config","nobody","NEW"," ---","nested preprocessing rules in removed-files.in remain in output/update mar file, likely because of leading whitespace","2017-01-27 03:59:29",,"2017-01-27 03:59:29","Unspecified",1,,,,0,"Client Software"," --",,"unspecified",0,0,
1338223,"Firefox","Build Config","nobody","NEW"," ---","Confusing RecursiveMake error messages when adding non-existing entries into jar.mn file","2017-02-09 10:42:08",,"2017-02-09 09:16:59","Unspecified",2,,,,0,"Client Software"," --",,"53 Branch",0,4,
1341674,"Firefox","Build Config","nobody","NEW"," ---","Set TZ, LC_ALL and umask to improve build reproducibility","2017-03-24 13:53:59",,"2017-02-22 08:33:47","Unspecified",1,,,,0,"Client Software"," --",,"Trunk",0,2,
1349010,"Firefox","Build Config","nobody","NEW"," ---","Report files referenced in our code but not shipped","2017-03-30 01:53:12",,"2017-03-20 15:37:23","Unspecified",2,,,,0,"Client Software"," --",,"unspecified",1,0,
1351892,"Firefox","Build Config","nobody","NEW"," ---","Can we avoid shipping skin files for all platforms in resource://app/features/ ?","2017-03-29 15:29:13",,"2017-03-29 15:29:13","Unspecified",1,,,,0,"Client Software"," --",,"unspecified",0,0,
487373,"Firefox","Build Config","jeremyhu","ASSIGNED"," ---","using system libxul-sdk causes infinite recursion on file system","2009-04-08 11:39:09",,"2009-04-07 23:07:50","Mac OS X",3,,,,0,"Client Software"," --",,"unspecified",0,1,
818333,"Firefox","Build Config","nobody","REOPENED"," ---","Make confvars.sh for desktop the same across branches where possible","2012-12-19 11:32:58",817723,"2012-12-04 17:14:14","Windows 7",22,"2012-12-14 15:45:33",,,0,"Client Software"," --",,"unspecified",0,6,
1363195,"Firefox","Build Config","nobody","REOPENED"," ---","Build system should warn more clearly about invalid OBJDIR paths","2017-05-12 13:53:39",,"2017-05-08 14:20:57","Unspecified",5,"2017-05-08 22:47:41",,,0,"Client Software"," --",,"unspecified",0,2,