"Bug ID","Product","Component","Assignee","Status","Resolution","Summary","Changed","Depends on","Opened","OS","Number of Comments","Last Resolved","Last Visit","Crash Signature","Duplicate Count","Classification","Priority","Rank","Version","Votes","CC Count","Bug Interest"
1421690,"Firefox","Preferences","nobody","NEW"," ---","[meta] Storage (Site Data and Cookies) Management V2","2018-09-04 01:40:19","862465, 1252998, 1312351, 1340861, 1348223, 1354170, 1354500, 1422160, 1422365, 1428306, 1431027, 1431029, 1432743, 1432745, 1432759, 1436568, 1437880, 1438147, 1438524, 1438629, 1438634, 1439547, 1441198, 1441566, 1441804, 1441847, 1441861, 1442179, 1442183, 1442191, 1442542, 1442547, 1442553, 1443644, 1447952, 1450448, 1453587, 1453589, 1459229, 1459603, 1459974, 1460768, 1462418, 1463114, 1469500, 1469502, 1480175","2017-11-29 09:17:53","Unspecified",11,,,,0,"Client Software","P2",,"58 Branch",6,39,
1425539,"Firefox","Preferences","nobody","NEW"," ---","preferences.js goToPref scrollTop=0 triggers style flush","2017-12-21 10:23:57",,"2017-12-15 12:36:13","Unspecified",1,,,,0,"Client Software","P2",,"unspecified",0,2,
1426355,"Firefox","Preferences","nobody","NEW"," ---","_rebuildFonts does a sync layout flush when opening about:preferences","2017-12-21 10:24:23",,"2017-12-20 05:30:45","Unspecified",1,,,,0,"Client Software","P2",,"Trunk",0,1,
1426357,"Firefox","Preferences","nobody","NEW"," ---","buildFontList causes jank soon after displaying about:preferences","2018-05-29 14:07:19",,"2017-12-20 05:38:08","Unspecified",1,,,,0,"Client Software","P2",,"Trunk",0,3,
1439547,"Firefox","Preferences","nobody","NEW"," ---","SiteDataManager.jsm should have unit/xpcshell tests","2018-03-15 08:58:20",,"2018-02-20 04:54:56","Unspecified",3,,,,0,"Client Software","P2",,"60 Branch",0,3,
1470366,"Firefox","Preferences","nobody","NEW"," ---","Spotlight feature in about:preferences does not work when Firefox Accounts is disabled","2018-07-02 12:09:45",,"2018-06-21 21:39:54","Unspecified",16,,,,0,"Client Software","P2",,"Trunk",0,8,
1487340,"Firefox","Preferences","nobody","NEW"," ---","Preference page for FF 61.0.1 is mostly blank when general.useragent.locale is unset but intl.locale.matchOS is set to false","2018-09-20 07:27:22",1491857,"2018-08-30 02:55:23","Unspecified",31,,,,0,"Client Software","P2",,"61 Branch",0,9,
1485779,"Firefox","Preferences","jsavage","NEW"," ---","Document the multilingual functionality on SUMO","2018-09-19 12:44:42",,"2018-08-23 12:16:34","Unspecified",4,,,,0,"Client Software","P3",,"unspecified",0,4,
1449207,"Firefox","Preferences","khudson","NEW"," ---","The buttons under the Custom URLs option are not displayed when searched","2018-04-18 08:18:18",,"2018-03-27 08:11:50","All",6,,,,0,"Client Software","P3",,"61 Branch",0,7,
1469690,"Firefox","Preferences","mstriemer","NEW"," ---","Allow uninstalling language packs from the configure dialog","2018-09-27 09:35:59",,"2018-06-19 13:25:00","Unspecified",2,,,,0,"Client Software","P3",,"unspecified",1,4,
1495804,"Firefox","Preferences","mstriemer","NEW"," ---","Reduce markup for message-bar styles","2018-10-02 09:58:51",1469696,"2018-10-02 09:58:51","Unspecified",1,,,,0,"Client Software","P3",,"unspecified",0,0,
283791,"Firefox","Preferences","nobody","NEW"," ---","On OS X, ""Sanitize Firefox"" should be a part of the ""Firefox"" menu (instead of the Tools menu)","2018-05-02 08:25:58",288322,"2005-02-26 01:11:10","Mac OS X",9,,,,1,"Client Software","P3",,"unspecified",0,7,
315174,"Firefox","Preferences","nobody","NEW"," ---","cannot make multiple selections in Cookie; delete key has no effect","2017-04-05 22:02:31",,"2005-11-04 22:44:46","All",11,,,,2,"Client Software","P3",,"Trunk",4,14,
404081,"Firefox","Preferences","nobody","NEW"," ---","""Warn me when I close multiple tabs"" preference can be overridden","2017-08-02 20:34:54",,"2007-11-16 12:18:06","All",29,,,,2,"Client Software","P3",,"Trunk",15,30,
1116584,"Firefox","Preferences","nobody","NEW"," ---","The sortable headers on lists/treeviews in the preferences (applications, cookie list, popup blocker exceptions list, password manager list, ...) are not keyboard-accessible","2016-02-17 15:01:28",,"2014-12-30 13:37:03","All",4,,,,0,"Client Software","P3",,"31 Branch",1,4,
1190001,"Firefox","Preferences","nobody","NEW"," ---","Intermittent browser_subdialogs.js | Check the sub-dialog was unloaded - Got subdialog.xul, expected about:blank","2016-09-01 11:52:44",,"2015-07-31 16:46:33","Unspecified",11,,,,0,"Client Software","P3",,"unspecified",0,0,
1194506,"Firefox","Preferences","nobody","NEW"," ---","Change copy for mobile download solicitation on Sync preferences to say ""Complete your Firefox experience...""","2016-11-07 15:29:03",,"2015-08-13 15:35:47","Unspecified",5,,,,0,"Client Software","P3",,"unspecified",0,5,
1218424,"Firefox","Preferences","nobody","NEW"," ---","""Do not disturb"" doesn't belong in about:preferences","2018-11-05 04:55:11",1209601,"2015-10-26 08:57:32","Unspecified",5,,,,0,"Client Software","P3",,"Trunk",0,5,
1228085,"Firefox","Preferences","nobody","NEW"," ---","Intermittent browser_subdialogs.js | Dialog title should be updated with changes - Got Sample sub-dialog, expected Updated title","2016-09-01 11:57:58",,"2015-11-25 12:19:23","Unspecified",2,,,,0,"Client Software","P3",,"Trunk",0,0,
1231376,"Firefox","Preferences","nobody","NEW"," ---","[experiment] Audit telemetry probes for Tracking Protection","2016-05-09 11:34:06",,"2015-12-09 07:41:29","Unspecified",7,,,,1,"Client Software","P3",,"Trunk",0,9,
1243517,"Firefox","Preferences","nobody","NEW"," ---","Intermittent browser_connection_bug388287.js | This test exceeded the timeout threshold. It should be rewritten or split up. If that's not possible, use requestLongerTimeout(N), but only as a last resort. -","2016-09-01 11:57:58",,"2016-01-27 13:04:47","Unspecified",3,,,,0,"Client Software","P3",,"unspecified",0,0,
1258937,"Firefox","Preferences","nobody","NEW"," ---","Intermittent browser_bug795764_cachedisabled.js | Test timed out","2017-11-01 15:00:20",,"2016-03-22 21:20:09","Unspecified",3,,,,0,"Client Software","P3",,"unspecified",0,0,
1278124,"Firefox","Preferences","nobody","NEW"," ---","Feature Request: easier management of allowed / blocked sites for cookies","2018-11-05 04:56:42",,"2016-06-05 11:29:20","All",2,,,,0,"Client Software","P3",,"46 Branch",0,2,
1280353,"Firefox","Preferences","nobody","NEW"," ---","adding popup blocking exceptions -- inconsistency between editor and notifications","2016-07-07 11:19:09",,"2016-06-16 00:27:33","Unspecified",1,,,,0,"Client Software","P3",,"46 Branch",0,2,
1280511,"Firefox","Preferences","nobody","NEW"," ---","[a11y] Major keyboard problems with remember history choice","2018-11-05 04:56:43",,"2016-06-16 10:31:45","All",7,,,,0,"Client Software","P3",,"Trunk",0,3,
1286701,"Firefox","Preferences","nobody","NEW"," ---","When exactly does/should the SOCKS remote DNS preference apply?","2018-02-20 03:30:15",1292899,"2016-07-13 15:53:25","Unspecified",11,,,,1,"Client Software","P3",,"Trunk",0,9,
1297533,"Firefox","Preferences","nobody","NEW"," ---","Update and clarify text under the ""History"" section of about:preferences#privacy","2017-11-29 12:18:22",1278811,"2016-08-23 14:56:48","All",5,,,,0,"Client Software","P3",,"51 Branch",0,7,
1297634,"Firefox","Preferences","nobody","NEW"," ---","Intermittent browser_homepages_filter_aboutpreferences.js | Test timed out","2017-07-23 18:17:50",,"2016-08-24 01:39:34","Unspecified",3,,,,0,"Client Software","P3",,"49 Branch",0,0,
1321115,"Firefox","Preferences","nobody","NEW"," ---","about:preferences requires a large width","2017-11-10 09:30:49",,"2016-11-29 15:29:30","Unspecified",1,,,,0,"Client Software","P3",,"43 Branch",2,3,
1335467,"Firefox","Preferences","nobody","NEW"," ---","Cleanup browser/components/preferences/in-content/search.js to remove the EngineStore object","2017-02-28 08:53:21",,"2017-01-31 09:07:02","Unspecified",2,,,,0,"Client Software","P3",,"53 Branch",0,3,
1340993,"Firefox","Preferences","nobody","NEW"," ---","Help Button in Container Tab Settings page (about:preferences#containers) not functioning","2018-11-05 04:58:44",,"2017-02-20 01:53:24","All",10,,,,0,"Client Software","P3",,"55 Branch",0,4,
1345643,"Firefox","Preferences","nobody","NEW"," ---","about:preferences#containers accessible via URL even though privacy.userContext.enabled;false","2017-09-18 23:44:13",,"2017-03-08 14:24:34","All",3,,,,0,"Client Software","P3",,"55 Branch",0,0,
1354170,"Firefox","Preferences","nobody","NEW"," ---","Should change the communication mechanism between SiteDataManager and Preferences page","2018-04-06 03:36:56",,"2017-04-06 08:11:45","Unspecified",1,,,,0,"Client Software","P3",,"unspecified",0,2,
1356656,"Firefox","Preferences","nobody","NEW"," ---","Hide the Personal Certificate group if there are no personal certificates installed","2018-11-05 04:59:44",,"2017-04-14 13:45:35","Unspecified",2,,,,0,"Client Software","P3",,"55 Branch",0,2,
1371313,"Firefox","Preferences","nobody","NEW"," ---","If you don't specify an icon for a search engine, default icon doesn't display in default dropdown","2018-06-29 13:38:29",,"2017-06-08 09:09:54","Unspecified",3,,,,0,"Client Software","P3",,"Trunk",0,1,
1381481,"Firefox","Preferences","nobody","NEW"," ---","disabled multi-e10s: Replace wiki.mozilla.org link with user-friendly SUMO link","2018-11-07 15:22:29",,"2017-07-17 06:52:16","Unspecified",5,,,,0,"Client Software","P3",,"unspecified",0,3,
1383592,"Firefox","Preferences","nobody","NEW"," ---","""Clear All History"" buttons vanish when checkbox unchecked","2018-06-05 18:42:45",,"2017-07-23 17:17:18","Unspecified",15,,,,1,"Client Software","P3",,"54 Branch",0,6,
1389578,"Firefox","Preferences","nobody","NEW"," ---","""Always check if Nightly is your default browser"" is not triggering set default dialog (OSX)","2018-01-20 15:27:02",,"2017-08-11 10:53:08","Mac OS X",8,,,,0,"Client Software","P3",,"57 Branch",0,5,
1391325,"Firefox","Preferences","nobody","NEW"," ---","Scroll region is not clear between Side menu pane and the right side detail pane of Preferences and Addon Manager.","2017-11-03 02:42:43",,"2017-08-17 10:45:58","Unspecified",14,"2017-10-05 06:35:19",,,1,"Client Software","P3",,"57 Branch",0,9,
1394231,"Firefox","Preferences","nobody","NEW"," ---","Use of accesskeys doesn't bring preferences' option into view if it has to scroll up, stays hidden/not visible","2018-03-20 13:02:52",,"2017-08-27 08:50:47","Unspecified",2,,,,1,"Client Software","P3",,"unspecified",0,2,
1399883,"Firefox","Preferences","nobody","NEW"," ---","Clicking empty area in about:preferences can change preferences","2017-09-18 13:13:33",,"2017-09-14 07:48:01","Unspecified",5,,,,0,"Client Software","P3",,"56 Branch",0,2,
1400420,"Firefox","Preferences","nobody","NEW"," ---","Focusing to element can be covered by browser.preferences.search header (either because moving focus upwards, or because prefs are scrolled down but focus is at the top)","2018-10-18 16:48:43",,"2017-09-15 15:42:49","Unspecified",3,,,,1,"Client Software","P3",,"57 Branch",1,4,
1401493,"Firefox","Preferences","nobody","NEW"," ---","[META] QA bugs of anti-fingerprinting protection","2018-03-29 23:10:58","1403813, 1403876, 1413707, 1413837, 1413842, 1414001, 1414153, 1414311, 1428331","2017-09-20 03:13:34","Unspecified",1,,,,0,"Client Software","P3",,"unspecified",2,5,
1410302,"Firefox","Preferences","nobody","NEW"," ---","about:preferences doesn't scroll with PgUp, PgDn, Up, Down, Home, and End keys","2018-10-31 03:29:14",,"2017-10-19 20:30:39","Unspecified",12,"2017-11-07 10:06:09",,,2,"Client Software","P3",,"58 Branch",0,5,
1415730,"Firefox","Preferences","nobody","NEW"," ---","[tracking] Migrate Preferences to the new Localization API","2018-11-08 00:10:13","1363864, 1415733, 1419547, 1424681, 1424682, 1426451, 1435464, 1445084, 1445694, 1446180, 1448853, 1449505, 1451579, 1453480, 1453540, 1453765, 1457948","2017-11-08 16:25:34","Unspecified",1,,,,0,"Client Software","P3",,"unspecified",4,6,
1419805,"Firefox","Preferences","nobody","NEW"," ---","Make search bar preferences illustrations clickable","2018-01-29 03:31:11",,"2017-11-22 08:36:54","Unspecified",4,,,,0,"Client Software","P3",,"unspecified",0,5,
1424681,"Firefox","Preferences","nobody","NEW"," ---","[tracking] Migrate the ""General"" section of Preferences to the new Localization API","2018-02-14 15:34:26","1435912, 1435915, 1438375","2017-12-10 23:35:57","Unspecified",9,,,,0,"Client Software","P3",,"unspecified",3,2,
1426358,"Firefox","Preferences","nobody","NEW"," ---","about:preferences needs performance browser mochitests","2018-01-19 14:43:17",1426360,"2017-12-20 05:40:11","Unspecified",4,,,,0,"Client Software","P3",,"Trunk",0,3,
1429865,"Firefox","Preferences","nobody","NEW"," ---","Allow managing canvas permissions in about:preferences when resistFingerprinting is on","2018-11-01 11:14:32",,"2018-01-11 10:29:20","Unspecified",17,,,,4,"Client Software","P3",,"58 Branch",0,13,
1430165,"Firefox","Preferences","nobody","NEW"," ---","Input clear icons does not match the design system","2018-03-20 04:24:02",,"2018-01-12 09:04:25","Unspecified",5,,,,0,"Client Software","P3",,"unspecified",0,2,
1430357,"Firefox","Preferences","nobody","NEW"," ---","Error: createFromField requires a password or username field in a document when opening the Change Master Password dialog","2018-01-18 10:38:21",,"2018-01-12 22:25:55","All",2,,,,0,"Client Software","P3",,"Trunk",0,1,
1438147,"Firefox","Preferences","nobody","NEW"," ---","Investigate improving SiteDataManager richlistbox performance","2018-04-06 04:03:55","1421737, 1451412","2018-02-14 04:49:42","Unspecified",3,,,,0,"Client Software","P3",,"60 Branch",2,4,
1439521,"Firefox","Preferences","nobody","NEW"," ---","Preferences -> Search: Show deleted search engines","2018-02-27 10:38:36",,"2018-02-20 02:33:39","Unspecified",5,,,,0,"Client Software","P3",,"58 Branch",0,4,
1442179,"Firefox","Preferences","nobody","NEW"," ---","The website added in the Exceptions list must  have the exact address to take the exception state","2018-04-05 13:42:32",,"2018-03-01 01:41:16","All",3,,,,1,"Client Software","P3",,"60 Branch",1,4,
1442191,"Firefox","Preferences","nobody","NEW"," ---","Consider moving the cookies exception button to give it better context","2018-04-17 03:15:33",,"2018-03-01 02:32:22","Unspecified",6,,,,0,"Client Software","P3",,"Trunk",1,4,
1442553,"Firefox","Preferences","nobody","NEW"," ---","[meta] Improve brittle Site Data browser mochitests","2018-04-13 02:49:23",1445188,"2018-03-02 02:29:04","Unspecified",1,,,,0,"Client Software","P3",,"60 Branch",0,1,
1442993,"Firefox","Preferences","nobody","NEW"," ---","Learn more link for telemetry is not aligned to the right","2018-10-28 07:53:51",,"2018-03-04 07:29:37","Unspecified",7,,,,0,"Client Software","P3",,"60 Branch",0,7,
1446359,"Firefox","Preferences","nobody","NEW"," ---","Remove ""tree"" from the search preferences","2018-03-16 09:58:42",,"2018-03-16 06:09:40","Unspecified",1,,,,0,"Client Software","P3",,"Trunk",0,2,
1446360,"Firefox","Preferences","nobody","NEW"," ---","Remove ""tree"" from the blocklist preferences","2018-03-16 09:58:42",,"2018-03-16 06:11:18","Unspecified",1,,,,0,"Client Software","P3",,"Trunk",0,2,
1446367,"Firefox","Preferences","nobody","NEW"," ---","Remove ""tree"" from the home page selection preferences","2018-08-06 03:48:18",,"2018-03-16 06:23:30","Unspecified",8,,,,0,"Client Software","P3",,"Trunk",0,4,
1446369,"Firefox","Preferences","nobody","NEW"," ---","Remove ""tree"" from the translation preferences","2018-11-05 17:02:59",,"2018-03-16 06:33:55","Unspecified",8,,,,0,"Client Software","P3",,"Trunk",0,7,
1446389,"Firefox","Preferences","nobody","NEW"," ---","Inform Fluent to not attempt to localize a sorry-message-query in Search Results of Preferences","2018-03-19 14:31:07",1445084,"2018-03-16 06:59:29","Unspecified",1,,,,0,"Client Software","P3",,"unspecified",0,1,
1450832,"Firefox","Preferences","nobody","NEW"," ---","Text or background colors remain on custom setting even when i click ""display"" never","2018-04-28 11:31:13",,"2018-04-02 17:01:00","All",13,,,,0,"Client Software","P3",,"59 Branch",0,6,
1451756,"Firefox","Preferences","nobody","NEW"," ---","Bookmarks folder can't be set as Start Page","2018-04-16 07:56:47",,"2018-04-05 07:45:33","All",4,,,,0,"Client Software","P3",,"Trunk",0,3,
1453770,"Firefox","Preferences","nobody","NEW"," ---","Intermittent browser/components/preferences/in-content/tests/siteData/browser_siteData2.js | Timed out","2018-04-16 07:13:23",,"2018-04-12 12:38:02","Unspecified",2,,,,0,"Client Software","P3",,"unspecified",0,3,
1458733,"Firefox","Preferences","nobody","NEW"," ---","React to Subdialog sizing change with a resize of the outer iframe","2018-05-17 21:01:57",,"2018-05-02 16:33:24","Unspecified",7,,,,0,"Client Software","P3",,"unspecified",0,4,
1459076,"Firefox","Preferences","nobody","NEW"," ---","Colors -> Override list is too narrow, and truncates options on Windows","2018-05-07 06:45:17",,"2018-05-03 16:06:13","Windows 10",3,,,,0,"Client Software","P3",,"Trunk",0,1,
1460627,"Firefox","Preferences","nobody","NEW"," ---","When searching in about:preferences, tooltips can overlap buttons/UI, making them hard to click","2018-09-09 20:44:37",,"2018-05-10 08:02:46","Unspecified",2,,,,1,"Client Software","P3",,"59 Branch",0,4,
1461755,"Firefox","Preferences","nobody","NEW"," ---","Remove ""Use a background service to install updates"" option in preferences","2018-05-22 12:44:21",,"2018-05-15 10:53:09","Windows",3,,,,0,"Client Software","P3",,"unspecified",1,5,
1463114,"Firefox","Preferences","nobody","NEW"," ---","Clear Site Data dialog should remember checkbox values","2018-05-25 05:54:14",,"2018-05-21 05:46:10","Unspecified",4,,,,0,"Client Software","P3",,"unspecified",1,4,
1467173,"Firefox","Preferences","nobody","NEW"," ---","Color boxes not are aligned in the Colors subdialog","2018-07-20 08:10:28",,"2018-06-06 08:44:37","All",5,,,,0,"Client Software","P3",,"Trunk",0,4,
1467469,"Firefox","Preferences","nobody","NEW"," ---","Firefox Data Collection Use hyperlinks are misaligned (Learn more)","2018-10-29 17:46:51",,"2018-06-07 07:39:28","All",11,,,,1,"Client Software","P3",,"Trunk",0,6,
1468312,"Firefox","Preferences","nobody","NEW"," ---","Calling openPreferences in a private window opens a new tab every time","2018-06-15 07:27:59",,"2018-06-12 04:02:04","All",2,,,,0,"Client Software","P3",,"unspecified",0,2,
1468314,"Firefox","Preferences","nobody","NEW"," ---","Preferences spotlight breaks back button","2018-06-15 07:28:45",,"2018-06-12 04:10:51","All",2,,,,0,"Client Software","P3",,"unspecified",0,2,
1469502,"Firefox","Preferences","nobody","NEW"," ---","Remove permissions along with site data","2018-06-19 22:35:59",1460768,"2018-06-19 01:41:22","Unspecified",8,,,,0,"Client Software","P3",,"unspecified",2,4,
1476664,"Firefox","Preferences","nobody","NEW"," ---","The searched string is not displayed as highlighted above the ""Add"" button in the preferences page","2018-10-24 08:07:24",,"2018-07-18 08:39:16","All",6,,,,0,"Client Software","P3",,"Trunk",0,4,
1479414,"Firefox","Preferences","nobody","NEW"," ---","Data deletion for IndexedDB  requires extra step  in the UI","2018-08-06 07:24:38",,"2018-07-30 05:45:26","Other",2,,,,0,"Client Software","P3",,"56 Branch",0,3,
1480175,"Firefox","Preferences","nobody","NEW"," ---","No longer able to filter/delete cookies and data on a per-container basis","2018-10-29 17:46:35",,"2018-08-01 11:21:39","All",9,,,,0,"Client Software","P3",,"61 Branch",3,8,
1480809,"Firefox","Preferences","nobody","NEW"," ---","Option in dropdown list for trackers is unnecessarily truncated","2018-08-06 06:56:39",,"2018-08-03 08:27:57","Mac OS X",2,,,,0,"Client Software","P3",,"unspecified",0,1,
1482284,"Firefox","Preferences","nobody","NEW"," ---","Add auto-complete in the url input textbox in order to help user more easily to find the url they want to enter","2018-08-28 05:16:39",,"2018-08-09 15:55:42","Unspecified",4,,,,0,"Client Software","P3",,"unspecified",1,5,
1483308,"Firefox","Preferences","nobody","NEW"," ---","Safe Mode doesn't reset browser.display.use_system_colors","2018-08-16 08:48:24",,"2018-08-14 10:56:14","All",2,,,,0,"Client Software","P3",,"Trunk",0,1,
1485181,"Firefox","Preferences","nobody","NEW"," ---","Search in Preferences/Options removes visual accesskey indicator (underline)","2018-08-23 07:41:30",,"2018-08-21 14:58:29","Unspecified",1,,,,0,"Client Software","P3",,"unspecified",0,1,
1485894,"Firefox","Preferences","nobody","NEW"," ---","[mac] Arrow icon displayed out of the content area inside the Set Home Page panel","2018-08-27 10:33:08",,"2018-08-23 23:42:44","Mac OS X",3,,,,0,"Client Software","P3",,"59 Branch",0,1,
1485897,"Firefox","Preferences","nobody","NEW"," ---","[Linux] - Text in about:preferences page is truncated on shrinking browser","2018-08-27 22:40:26",,"2018-08-24 00:01:37","Linux",4,,,,0,"Client Software","P3",,"Trunk",0,1,
1485964,"Firefox","Preferences","nobody","NEW"," ---","Search result tooltip shifts onto button in about:preferences","2018-08-27 07:15:22",,"2018-08-24 05:48:12","All",3,,,,0,"Client Software","P3",,"Trunk",1,3,
1490936,"Firefox","Preferences","nobody","NEW"," ---","'Query OCSP responder servers' setting in Preferences could use some context help","2018-09-17 03:30:53",,"2018-09-13 02:10:01","Unspecified",4,,,,0,"Client Software","P3",,"Trunk",0,3,
1490940,"Firefox","Preferences","nobody","NEW"," ---","Excessive padding for bottom row buttons in modal dialogs","2018-09-14 10:17:10",,"2018-09-13 02:27:55","Unspecified",4,,,,0,"Client Software","P3",,"Trunk",0,2,
1490946,"Firefox","Preferences","nobody","NEW"," ---","Modal dialogs in General Preferences show up too slow","2018-09-24 08:27:42",,"2018-09-13 02:55:08","Unspecified",5,,,,0,"Client Software","P3",,"Trunk",0,5,
1490953,"Firefox","Preferences","nobody","NEW"," ---","Preferences subdialogs - align start of grids with rest of content","2018-09-13 10:00:04",,"2018-09-13 03:19:12","Unspecified",1,,,,0,"Client Software","P3",,"Trunk",0,3,
1492875,"Firefox","Preferences","nobody","NEW"," ---","Do an animated fade out of the background colour of spotlighted (highlighted) preferences sections","2018-09-20 08:32:39",,"2018-09-20 08:15:55","Unspecified",1,,,,0,"Client Software","P3",,"55 Branch",0,1,
1493524,"Firefox","Preferences","nobody","NEW"," ---","In the preferences/options, access keys on the main page (outside the subdialog) can be used/activated while the subdialog is open","2018-09-24 07:37:38",,"2018-09-23 07:31:59","Unspecified",2,,,,0,"Client Software","P3",,"unspecified",0,1,
1493705,"Firefox","Preferences","nobody","NEW"," ---","Provide a UI to manage installed dictionaries","2018-09-24 12:30:56",,"2018-09-24 08:45:04","Unspecified",1,,,,0,"Client Software","P3",,"unspecified",1,6,
1494353,"Firefox","Preferences","nobody","NEW"," ---","The back button is enabled but nonfunctional when about:preferences is accessed from other menus","2018-10-05 10:43:16",,"2018-09-26 09:32:13","All",3,,,,0,"Client Software","P3",,"Trunk",0,5,
1494416,"Firefox","Preferences","nobody","NEW"," ---","Nightly: Sorry! There are no results in Preferences for ""extensions"". (or ""addons"")","2018-11-01 10:07:07",,"2018-09-26 12:24:26","Unspecified",4,,,,1,"Client Software","P3",,"unspecified",0,1,
1494668,"Firefox","Preferences","nobody","NEW"," ---","Restore Defaults is not fully functional for all the Content Blocking settings","2018-10-05 10:43:22",,"2018-09-27 07:05:58","All",5,,,,0,"Client Software","P3",,"Trunk",0,5,
1497296,"Firefox","Preferences","nobody","NEW"," ---","[RTL] Mirror the search icon in search textboxes","2018-10-11 07:29:25",,"2018-10-08 10:46:03","Unspecified",1,,,,0,"Client Software","P3",,"unspecified",0,1,
1498035,"Firefox","Preferences","nobody","NEW"," ---","Remove performance section and the UI component for content process count setting","2018-10-25 07:29:18",,"2018-10-10 14:48:15","Unspecified",11,,,,0,"Client Software","P3",,"unspecified",0,6,
1498039,"Firefox","Preferences","nobody","NEW"," ---","For a particular configuration, it looks like Firefox is blocking 3rd party cookies when in reality it is not","2018-10-11 07:00:31",,"2018-10-10 14:58:00","Unspecified",2,,,,0,"Client Software","P3",,"64 Branch",0,4,
1498977,"Firefox","Preferences","nobody","NEW"," ---","Dropdown list for cookies and site data (""Keep until"") is unnecessarily truncated","2018-10-22 08:37:53",,"2018-10-14 22:05:27","Unspecified",8,,,,0,"Client Software","P3",,"unspecified",0,6,
1499350,"Firefox","Preferences","nobody","NEW"," ---","Look at removing _storingAction logic from preferences' main.js now that the feed handler code is gone","2018-10-16 05:23:43",1477669,"2018-10-16 05:23:43","Unspecified",1,,,,0,"Client Software","P3",,"Trunk",0,1,
1500444,"Firefox","Preferences","nobody","NEW"," ---","about:preferences is wider in German","2018-10-19 12:14:32",,"2018-10-19 07:27:40","Unspecified",3,,,,0,"Client Software","P3",,"64 Branch",1,2,
1501691,"Firefox","Preferences","nobody","NEW"," ---","Add close without save alert for Notifications Modal in Preferences","2018-11-01 07:28:59",,"2018-10-24 07:59:52","Unspecified",3,,,,0,"Client Software","P3",,"65 Branch",0,2,
1502277,"Firefox","Preferences","nobody","NEW"," ---","In-content preferences ""manage devices"" subdialog is cut off - no OK,  resizer and x button","2018-10-29 08:09:39","1044597, 1128237","2018-10-25 23:59:23","Windows 10",3,,,,0,"Client Software","P3",,"Trunk",0,6,
1505845,"Firefox","Preferences","nobody","NEW"," ---","Column text not aligned with the 'Action' header when there's a vertical scrollbar, under Applications","2018-11-08 09:51:16",,"2018-11-08 09:37:23","Unspecified",6,,,,0,"Client Software","P3",,"unspecified",0,3,
