"Bug ID","Product","Component","Assignee","Status","Resolution","Summary","Changed","Depends on","Opened","OS","Number of Comments","Last Resolved","Last Visit","Crash Signature","Duplicate Count","Classification","Priority","Rank","Version","Votes","CC Count","Bug Interest"
606425,"Firefox","Preferences","nobody","NEW"," ---","Unable to access most history options when ""Use custom settings"" is selected without opening combo box","2010-10-22 04:08:27",,"2010-10-22 00:59:51","Windows 7",4,,,,0,"Client Software"," --",,"Trunk",0,2,
608151,"Firefox","Preferences","nobody","NEW"," ---","Unbalanced margins in the icon tab switcher thing","2010-10-28 16:58:48",,"2010-10-28 16:58:10","Windows 7",2,,,,0,"Client Software"," --",,"unspecified",0,0,
614854,"Firefox","Preferences","nobody","NEW"," ---","on Font Selection Page - selecting option to allow sites to override font selection also overrides size; this is wrong","2015-03-05 11:05:33",,"2010-11-25 12:29:23","All",5,,,,1,"Client Software"," --",,"Trunk",1,4,
619323,"Firefox","Preferences","nobody","NEW"," ---","browser.shell.checkDefaultBrowser = False for not stable versions","2011-12-09 11:35:10",,"2010-12-15 06:31:47","Windows XP",2,,,,0,"Client Software"," --",,"Trunk",0,1,
619501,"Firefox","Preferences","nobody","NEW"," ---","Font sizes in preference/options dialogs do not indicate what units they use","2017-08-24 21:34:15",,"2010-12-15 14:28:15","Windows 7",4,,,,0,"Client Software"," --",,"3.6 Branch",0,3,
623694,"Firefox","Preferences","nobody","NEW"," ---","Buttons are mis-aligned in ""Allowed Sites - Pop-ups"" window","2013-08-31 00:32:42",,"2011-01-06 12:35:03","Windows 7",1,,,,0,"Client Software"," --",,"unspecified",1,1,
626821,"Firefox","Preferences","nobody","NEW"," ---","about:config dialogs for setting pref values should not use window title bar for modify_title","2011-01-18 14:32:52",,"2011-01-18 14:32:52","Linux",1,,,,0,"Client Software"," --",,"unspecified",0,0,
631198,"Firefox","Preferences","nobody","NEW"," ---","Location Bar Setting goes completely blank.","2011-02-03 04:55:57",,"2011-02-03 04:55:57","Mac OS X",1,,,,0,"Client Software"," --",,"unspecified",0,0,
631504,"Firefox","Preferences","nobody","NEW"," ---","Limiting browser network bandwidth usage dynamically","2011-02-08 02:10:48",,"2011-02-04 04:16:23","Linux",2,,,,0,"Client Software"," --",,"unspecified",1,1,
635023,"Firefox","Preferences","nobody","NEW"," ---","preferences/main.dtd:useMultiple needs its own accesskey","2011-02-17 13:26:19",,"2011-02-17 13:25:44","Linux",1,,,,0,"Client Software"," --",,"Trunk",0,1,
642636,"Firefox","Preferences","nobody","NEW"," ---","Add Sorani Kurdish (ckb) to the Accept-Language selection menu","2018-05-17 11:15:33",,"2011-03-17 16:45:38","All",2,,,,0,"Client Software"," --",,"unspecified",0,3,
643809,"Firefox","Preferences","nobody","NEW"," ---","Should be an option to open only app tabs on start up","2011-10-22 03:55:57",,"2011-03-22 10:43:30","All",1,,,,0,"Client Software"," --",,"unspecified",0,1,
646029,"Firefox","Preferences","nobody","NEW"," ---","clicking home button repeatedly duplicates home tabs","2011-04-21 07:24:48",,"2011-03-29 05:51:56","Mac OS X",4,,,,0,"Client Software"," --",,"unspecified",0,1,
649703,"Firefox","Preferences","nobody","NEW"," ---","Update channel setting not available from the preferences dialog ""Update"" page","2011-04-13 14:20:39",,"2011-04-13 10:59:56","Mac OS X",4,,,,0,"Client Software"," --",,"unspecified",0,6,
658778,"Firefox","Preferences","nobody","NEW"," ---","Page permissions should offer a 'Disable page styles' preference","2011-05-24 02:42:14",,"2011-05-21 06:38:51","All",3,,,,0,"Client Software"," --",,"Trunk",0,2,
659306,"Firefox","Preferences","nobody","NEW"," ---","unexptected favicon connection to Web when open Preferences/Applications","2015-12-26 18:06:14",,"2011-05-24 07:07:39","All",5,,,,0,"Client Software"," --",,"Trunk",0,4,
662287,"Firefox","Preferences","nobody","NEW"," ---","Create comprehensive tests for visibility/selection of permission menuitems","2011-06-06 09:02:28",661819,"2011-06-06 08:45:12","All",1,,,,0,"Client Software"," --",,"Trunk",0,1,
662483,"Firefox","Preferences","nobody","NEW"," ---","Download in the channel switcher is restarted after pressing the ""Change"" button although branch is not changed","2011-11-14 07:29:00",,"2011-06-07 00:48:13","All",3,,,,0,"Client Software"," --",,"Trunk",0,2,
662488,"Firefox","Preferences","nobody","NEW"," ---","Aurora branding after channel switched to Beta in the Dock and Finder","2011-06-07 07:45:24",,"2011-06-07 01:14:56","Mac OS X",2,,,,0,"Client Software"," --",,"Trunk",0,1,
662510,"Firefox","Preferences","nobody","NEW"," ---","Closing and reopening the about window while applying the channel change (download in progress) hangs the download","2011-11-04 06:08:34",,"2011-06-07 06:34:41","Windows 7",3,,,,0,"Client Software"," --",,"Trunk",0,3,
666520,"Firefox","Preferences","nobody","NEW"," ---","Enhancement - Make new Javascript annoyance stoppable","2011-10-02 01:42:08",,"2011-06-23 01:10:44","All",3,,,,0,"Client Software"," --",,"unspecified",0,3,
667357,"Firefox","Preferences","nobody","NEW"," ---","Add an item in preferences window to allow user to decide to prevent autoplay for video/audio content","2018-07-23 09:03:14",727273,"2011-06-26 17:01:57","All",9,"2012-01-23 22:32:45",,,0,"Client Software"," --",,"unspecified",4,6,
678807,"Firefox","Preferences","nobody","NEW"," ---","Provide option for ignoring »target=""_blank""«","2015-05-22 10:26:11",,"2011-08-14 04:44:38","All",5,,,,0,"Client Software"," --",,"unspecified",4,6,
691086,"Firefox","Preferences","nobody","NEW"," ---","Should add 'apply' in Option-Content-( Font & Color )","2012-05-08 16:48:39",,"2011-10-01 12:31:54","All",2,,,,0,"Client Software"," --",,"7 Branch",0,0,
692311,"Firefox","Preferences","nobody","NEW"," ---","Firefox ""move up"" button for languages does not move language as expected","2014-09-17 09:01:32",,"2011-10-05 16:04:43","Mac OS X",2,,,,0,"Client Software"," --",,"7 Branch",0,2,
693136,"Firefox","Preferences","nobody","NEW"," ---","Option to disable DNS caching in settings","2011-10-10 08:20:30",,"2011-10-09 02:55:00","Linux",10,,,,0,"Client Software"," --",,"7 Branch",0,3,
696073,"Firefox","Preferences","nobody","NEW"," ---","preferences window on mac is not resizable, cutting off content","2012-04-15 14:49:21",,"2011-10-20 07:40:23","Mac OS X",4,,,,0,"Client Software"," --",,"unspecified",0,3,
696296,"Firefox","Preferences","nobody","NEW"," ---","Cache usage message disappears on Windows after the cache is cleared","2011-10-20 18:47:21",,"2011-10-20 18:47:21","Windows XP",1,,,,0,"Client Software"," --",,"7 Branch",0,0,
696643,"Firefox","Preferences","nobody","NEW"," ---","merge Latin varieties into one","2011-10-24 06:08:17",,"2011-10-23 09:01:11","Linux",2,,,,0,"Client Software"," --",,"9 Branch",0,3,
697284,"Firefox","Preferences","nobody","NEW"," ---","Double-clicking empty space in about:config tree should not twiddle pref","2015-07-17 05:16:04",,"2011-10-25 15:26:55","Mac OS X",2,,,,0,"Client Software"," --",,"Trunk",0,1,
699479,"Firefox","Preferences","nobody","NEW"," ---","Allowing only first-party cookies from a whitelist is not possible","2016-10-15 07:15:55",,"2011-11-03 11:00:26","All",7,,,,0,"Client Software"," --",,"8 Branch",0,3,
700850,"Firefox","Preferences","nobody","NEW"," ---","""Don't load tabs until selected"" checkbox is worded negatively","2012-06-25 22:51:38",,"2011-11-08 15:53:17","Mac OS X",6,,,,0,"Client Software"," --",,"unspecified",0,7,
702415,"Firefox","Preferences","nobody","NEW"," ---","Clearing site preferences shouldn't clear cookie exceptions","2013-06-01 22:40:51",,"2011-11-14 13:26:59","Windows 7",4,,,,1,"Client Software"," --",,"8 Branch",1,4,
706768,"Firefox","Preferences","nobody","NEW"," ---","The Ask dialog is displayed with remember option checked when Use Okular is selected for pdf files","2012-01-27 07:27:46",,"2011-12-01 01:07:42","Linux",8,,,,0,"Client Software"," --",,"Trunk",0,1,
710994,"Firefox","Preferences","nobody","NEW"," ---","""Don't load tabs until selected"" feature for manual ""Restore previous session""","2014-05-13 01:43:27",,"2011-12-14 23:51:36","All",4,,,,2,"Client Software"," --",,"Trunk",1,4,
717977,"Firefox","Preferences","nobody","NEW"," ---","Submit performance data not showing properly in bn-IN Firefox","2012-01-13 10:10:42",,"2012-01-13 10:10:42","Windows 7",1,,,,0,"Client Software"," --",,"unspecified",0,0,
718013,"Firefox","Preferences","nobody","NEW"," ---","The font preferences UI is misleading","2012-01-13 11:55:17",,"2012-01-13 11:55:17","Mac OS X",1,,,,0,"Client Software"," --",,"unspecified",0,0,
722573,"Firefox","Preferences","nobody","NEW"," ---","""Use hardware acceleration when available"" does not say what is being accelerated","2016-04-25 19:11:44",,"2012-01-30 16:54:53","All",1,,,,0,"Client Software"," --",,"Trunk",0,2,
726897,"Firefox","Preferences","nobody","NEW"," ---","On update, check for stale Google Toolbar preferences and undo the damage if needed","2013-10-09 11:24:05",,"2012-02-13 18:33:47","Mac OS X",1,,,,0,"Client Software"," --",,"unspecified",0,0,
727274,"Firefox","Preferences","nobody","NEW"," ---","Allow preference changes to be reverted or reset to default during some time duration after making a change","2017-04-18 05:30:51",718011,"2012-02-14 14:57:22","All",1,,,,0,"Client Software"," --",,"Trunk",3,6,
735566,"Firefox","Preferences","nobody","NEW"," ---","Cached Web Content does not display how much space is currently being used","2013-03-09 04:29:45",,"2012-03-13 21:03:27","Windows 7",11,,,,0,"Client Software"," --",,"13 Branch",1,4,
744255,"Firefox","Preferences","nobody","NEW"," ---","Add link to MDN preference reference to about:config","2014-04-18 17:18:22",,"2012-04-10 16:34:01","All",4,,,,0,"Client Software"," --",,"14 Branch",1,4,
745436,"Firefox","Preferences","nobody","NEW"," ---","Sort cookies/exceptions by date","2012-04-14 03:45:48",,"2012-04-14 03:45:48","All",1,,,,0,"Client Software"," --",,"unspecified",0,0,
752719,"Firefox","Preferences","nobody","NEW"," ---","Interaction redesign for in-content Preferences","2017-05-16 06:40:43","216931, 530209, 560172, 565550, 738796, 752197, 753648, 754344, 767313, 1166213","2012-05-07 15:49:23","All",14,,,,0,"Client Software"," --",,"unspecified",11,42,
753463,"Firefox","Preferences","nobody","NEW"," ---","Preferences window immediately goes blank, redraws after switching back from another window","2012-07-11 07:20:55",,"2012-05-09 11:52:45","Mac OS X",1,,,,0,"Client Software"," --",,"11 Branch",1,1,
755147,"Firefox","Preferences","nobody","NEW"," ---","When accessing preferences through the about:home icon it should default to 'general' section","2012-05-14 18:19:30",,"2012-05-14 17:45:51","Mac OS X",4,,,,0,"Client Software"," --",,"15 Branch",0,1,
763259,"Firefox","Preferences","nobody","NEW"," ---","""Show a blank page"" text in the ""When Firefox starts"" dropdown should instead use the wording bug 743613 implements.","2018-07-03 01:30:49",743613,"2012-06-10 00:32:47","All",4,,,,0,"Client Software"," --",,"Trunk",0,3,
765391,"Firefox","Preferences","nobody","NEW"," ---","Privacy settings not changed when set","2013-04-12 08:04:27",,"2012-06-15 15:16:19","All",1,,,,0,"Client Software"," --",,"Trunk",0,4,
781983,"Firefox","Preferences","nobody","NEW"," ---","IndexedDB ignores ""remember cookies for session only"" - there is no alternate preferences option.","2016-02-17 11:13:23",1166710,"2012-08-10 17:31:08","All",5,,,,0,"Client Software"," --",,"Trunk",2,1,
796113,"Firefox","Preferences","nobody","NEW"," ---","The meaning of ""Allow First Party Only"" is unclear","2013-04-28 08:52:14",,"2012-10-01 13:44:13","All",14,,,,0,"Client Software"," --",,"Trunk",0,10,
801072,"Firefox","Preferences","nobody","NEW"," ---","Add a visible preference to disable ""Close other tabs"" prompt","2016-01-28 09:33:52",772319,"2012-10-12 12:55:20","All",28,,,,2,"Client Software"," --",,"Trunk",26,32,
802862,"Firefox","Preferences","nobody","NEW"," ---","preferences checkboxes react to clicks incorrectly","2012-10-25 08:19:30",,"2012-10-17 16:07:39","Mac OS X",1,,,,0,"Client Software"," --",,"18 Branch",0,1,
804149,"Firefox","Preferences","nobody","NEW"," ---","""Accept third-party cookies"" option label is confusing","2012-10-22 07:12:00",,"2012-10-22 07:12:00","Windows 7",1,,,,0,"Client Software"," --",,"18 Branch",0,0,
804338,"Firefox","Preferences","nobody","NEW"," ---","defaultPref browser.startup.homepage is interacting strangely with autocomplete","2012-10-30 06:58:01",,"2012-10-22 14:17:28","Windows 7",5,,,,0,"Client Software"," --",,"16 Branch",0,3,
824478,"Firefox","Preferences","nobody","NEW"," ---","Access keys should be displayed when pressing the combo keys as stated in ui.key.contentAccess","2016-06-13 01:57:06",,"2012-12-24 07:06:53","All",6,,,,0,"Client Software"," --",,"20 Branch",1,6,
827374,"Firefox","Preferences","nobody","NEW"," ---","Menu Bar is not restored after Firefox crashes","2016-08-21 07:58:56",,"2013-01-07 08:44:33","Windows 8",3,,,,0,"Client Software"," --",,"18 Branch",0,2,
831369,"Firefox","Preferences","nobody","NEW"," ---","Data Choices menu is empty","2013-01-18 03:59:53",,"2013-01-16 10:15:15","Linux",6,,,,0,"Client Software"," --",,"21 Branch",0,1,
833902,"Firefox","Preferences","nobody","NEW"," ---","UI changes to explain propagation of cleared data (desktop)","2017-04-18 05:21:30",,"2013-01-23 11:09:37","All",1,,,,0,"Client Software"," --",,"Trunk",0,1,
839035,"Firefox","Preferences","nobody","NEW"," ---","restore last session and delete history conflict","2013-02-07 14:29:11",,"2013-02-07 05:32:34","Mac OS X",2,,,,0,"Client Software"," --",,"18 Branch",0,1,
839441,"Firefox","Preferences","nobody","NEW"," ---","Disable master password via about:config isn't possible","2016-05-10 14:56:02",,"2013-02-08 03:29:10","Windows 7",6,,,,0,"Client Software"," --",,"17 Branch",0,3,
841046,"Firefox","Preferences","nobody","NEW"," ---","Options -> Network - Connection settings for Use system Proxy Settings give unexpected results for Auto Detect.","2015-06-23 11:52:36",,"2013-02-13 09:37:13","Windows 7",1,,,,0,"Client Software"," --",,"unspecified",0,3,
845787,"Firefox","Preferences","nobody","NEW"," ---","enable to set cookie permission ""Allow First Party Only"" from Cookie Permission dialog","2017-09-21 09:58:29",845758,"2013-02-27 05:11:12","All",3,,,,1,"Client Software"," --",,"unspecified",0,2,
851707,"Firefox","Preferences","nobody","NEW"," ---","Do not surface the certificate manager in our UI","2017-04-18 05:37:47",1116593,"2013-03-15 16:19:23","All",8,,,,0,"Client Software"," --",,"Trunk",3,19,
858867,"Firefox","Preferences","nobody","NEW"," ---","Rename Do Not Track","2017-04-18 05:21:50",,"2013-04-05 18:46:21","All",3,,,,0,"Client Software"," --",,"unspecified",0,2,
859982,"Firefox","Preferences","nobody","NEW"," ---","the constructor for preference element behaves differently in-content than in windowed mode","2013-04-09 12:24:22",,"2013-04-09 12:24:22","All",1,,,,0,"Client Software"," --",,"Trunk",0,0,
860440,"Firefox","Preferences","nobody","NEW"," ---","[UX] Fix confusion between ""Cookies"" and ""Active Logins"" in the ""Clear Recent History"" (sanitize) dialog","2018-06-01 07:36:25",483422,"2013-04-10 12:54:25","All",10,,,,0,"Client Software"," --",,"Trunk",3,8,
871116,"Firefox","Preferences","nobody","NEW"," ---","Advanced->Network page is cut off in DE language","2013-05-12 14:45:30",,"2013-05-11 00:07:46","Linux",2,,,,0,"Client Software"," --",,"21 Branch",0,1,
873506,"Firefox","Preferences","nobody","NEW"," ---","There should be an easy way to select and export settings from about:config","2014-03-13 04:14:56",,"2013-05-17 09:05:45","Windows Vista",4,,,,0,"Client Software"," --",,"21 Branch",3,5,
876541,"Firefox","Preferences","nobody","NEW"," ---","Locale casing and spacing resulting from Languages Selection and the same shipped by default should be consistent","2013-06-10 07:50:24",,"2013-05-27 16:47:11","All",3,,,,0,"Client Software"," --",,"Trunk",0,1,
883525,"Firefox","Preferences","nobody","NEW"," ---","Firefox Preferences -> Advanced -> General -> Browsing -> ""Use auto-scrolling"" is ambiguous / unclear name/description.","2014-05-21 07:41:19",,"2013-06-15 07:08:06","All",13,,,,0,"Client Software"," --",,"21 Branch",0,5,
890215,"Firefox","Preferences","nobody","NEW"," ---","Option in about:config for a single-password-deletion confirmation window","2014-04-05 13:02:25",,"2013-07-04 03:12:09","All",2,,,,0,"Client Software"," --",,"Trunk",0,1,
891981,"Firefox","Preferences","nobody","NEW"," ---","Add setting to select default search engine in Options/Preferences","2014-09-23 00:06:24",,"2013-07-10 10:50:47","All",3,,,,0,"Client Software"," --",,"unspecified",0,4,
896742,"Firefox","Preferences","nobody","NEW"," ---","localStorage() cleared when Firefox closes","2014-07-07 04:29:28",,"2013-07-22 15:23:58","Windows 7",5,,,,0,"Client Software"," --",,"Trunk",0,5,
908266,"Firefox","Preferences","nobody","NEW"," ---","Add a way to provide more information that explains the meaning of prefs in about:config","2014-04-18 17:17:43",,"2013-08-22 10:05:24","All",2,,,,0,"Client Software"," --",,"unspecified",0,2,
926153,"Firefox","Preferences","nobody","NEW"," ---","Cookies dialog - can't use ""select all"" shortcut on filtered result","2014-10-07 05:22:31",,"2013-10-13 01:51:16","All",3,,,,1,"Client Software"," --",,"Trunk",0,4,
926373,"Firefox","Preferences","nobody","NEW"," ---","cookie settings aren't remembered","2016-06-06 01:41:43",,"2013-10-14 04:27:24","Windows 7",3,,,,0,"Client Software"," --",,"24 Branch",0,2,
928339,"Firefox","Preferences","nobody","NEW"," ---","instantApply is ignored by the sanitize.xul dialog","2013-12-25 13:59:51",,"2013-10-18 04:30:56","All",1,,,,0,"Client Software"," --",,"Trunk",0,1,
935191,"Firefox","Preferences","nobody","NEW"," ---","When middle clicking opens a tab in the background diverted windows should also open in the background","2013-12-03 08:09:48",,"2013-11-05 12:57:17","Mac OS X",1,,,,0,"Client Software"," --",,"unspecified",0,1,
936855,"Firefox","Preferences","nobody","NEW"," ---","Preference window icons need Retina-quality versions added","2013-11-10 08:54:40",,"2013-11-09 18:36:47","Mac OS X",1,,,,0,"Client Software"," --",,"unspecified",1,3,
943095,"Firefox","Preferences","nobody","NEW"," ---","browser/components/preferences/in-content/tests/browser_connection.js times out when test is run on EC2","2014-06-25 14:52:31",,"2013-11-25 14:55:32","All",3,,,,0,"Client Software"," --",,"unspecified",0,2,
945051,"Firefox","Preferences","nobody","NEW"," ---","Specify download locations per filetype","2014-08-08 17:48:21",,"2013-12-01 15:33:34","All",2,,,,0,"Client Software"," --",,"28 Branch",0,4,
946743,"Firefox","Preferences","nobody","NEW"," ---","allow user to copy preference words","2017-08-27 17:40:01",,"2013-12-05 07:47:37","All",1,,,,0,"Client Software"," --",,"27 Branch",0,2,
953399,"Firefox","Preferences","nobody","NEW"," ---","spacebar and PgDn scrolling in about:config","2014-08-08 17:48:45",,"2013-12-29 05:13:04","Linux",2,,,,0,"Client Software"," --",,"28 Branch",0,1,
956603,"Firefox","Preferences","nobody","NEW"," ---","config option to make browser lie about screen width","2015-03-03 21:30:40",,"2014-01-05 16:28:09","All",5,,,,0,"Client Software"," --",,"Trunk",2,1,
967362,"Firefox","Preferences","nobody","NEW"," ---","""warn me if closing multiple tabs"" is nonfunctional","2017-01-11 07:37:26",,"2014-02-03 20:28:13","Linux",3,,,,0,"Client Software"," --",,"26 Branch",1,2,
969282,"Firefox","Preferences","nobody","NEW"," ---","""Use proxy for all protocols"" should not copy to SOCKS.","2014-02-07 01:27:51",,"2014-02-07 01:27:51","All",1,,,,0,"Client Software"," --",,"Trunk",0,0,
985410,"Firefox","Preferences","nobody","NEW"," ---","browser_bug735471.js | A promise chain failed to handle a rejection","2014-03-19 06:04:07",,"2014-03-19 06:04:07","All",1,,,,0,"Client Software"," --",,"unspecified",0,3,
995429,"Firefox","Preferences","nobody","NEW"," ---","Expose preference for 'safe' browsing hint","2015-01-23 20:02:02",995070,"2014-04-11 14:12:17","All",1,,,,0,"Client Software"," --",,"unspecified",0,1,
997020,"Firefox","Preferences","nobody","NEW"," ---","Removed RSS Feed Handlers keep reappearing","2016-02-11 13:16:16",,"2014-04-15 22:49:57","Linux",6,,,,0,"Client Software"," --",,"24 Branch",0,2,
1006303,"Firefox","Preferences","nobody","NEW"," ---","In-content preferences: Remove unneeded checks for recent window and add tests.","2014-05-05 23:10:48",1005038,"2014-05-05 23:10:30","All",1,,,,0,"Client Software"," --",,"Trunk",0,2,
1007329,"Firefox","Preferences","nobody","NEW"," ---","In-content prefs: Move the styling from <button> to a class-based selector so that it won't apply to the help button","2014-05-07 13:40:48",,"2014-05-07 13:40:48","All",1,,,,0,"Client Software"," --",,"unspecified",0,0,
1014208,"Firefox","Preferences","nobody","NEW"," ---","Updated InContent Preferences Design Based on Project Chameleon","2017-04-18 05:49:17","993359, 993524, 998229, 1012396, 1012399, 1012701, 1012767, 1013689, 1013692, 1013698, 1013708, 1013709, 1013711, 1013714, 1013715, 1013718, 1013719, 1013721, 1013724, 1017555, 1017631, 1017722, 1017725, 1018703, 1018717, 1018796, 1025687, 1036090, 1038288, 1038291, 1052318, 1111332, 1135508, 1136645, 1136671, 1148749","2014-05-21 13:12:19","All",52,,,,2,"Client Software"," --",,"unspecified",1,21,
1014478,"Firefox","Preferences","nobody","NEW"," ---","""Facebook doesn't work"" (Javascript deactivated without user interaction?)","2017-01-30 07:58:40",,"2014-05-22 03:03:49","All",4,,,,0,"Client Software"," --",,"29 Branch",0,3,
1018339,"Firefox","Preferences","nobody","NEW"," ---","Workaround bug 451254 in in-content-preferences","2014-05-30 11:05:33",1013904,"2014-05-30 11:05:33","All",1,,,,0,"Client Software"," --",,"unspecified",0,0,
1027821,"Firefox","Preferences","nobody","NEW"," ---","Remove advance-pane-loaded notification from the in-content preferences","2014-06-19 13:20:28",,"2014-06-19 13:20:28","All",1,,,,0,"Client Software"," --",,"Trunk",0,0,
1027822,"Firefox","Preferences","nobody","NEW"," ---","Add more info to the history.state object when navigating through the in-content preferences","2014-06-19 13:21:34",,"2014-06-19 13:21:34","All",1,,,,0,"Client Software"," --",,"Trunk",0,0,
1027827,"Firefox","Preferences","nobody","NEW"," ---","Replace usages of internal preference category names with friendly names","2014-06-19 13:29:55",,"2014-06-19 13:29:25","All",1,,,,0,"Client Software"," --",,"Trunk",0,0,
1031968,"Firefox","Preferences","nobody","NEW"," ---","Feature request: Pinned Tab option in 'Settings for Clearing History'","2016-02-12 12:54:48",,"2014-06-29 18:41:10","All",2,,,,0,"Client Software"," --",,"unspecified",0,3,
1043509,"Firefox","Preferences","nobody","NEW"," ---","in-content subdialog is no longer resizable  by keyboard shortcut","2015-11-07 06:55:30",,"2014-07-24 11:00:44","Windows 7",2,,,,0,"Client Software"," --",,"34 Branch",0,2,
1049254,"Firefox","Preferences","nobody","NEW"," ---","A few http:// urls in preferences can be https://","2014-08-18 12:44:48",,"2014-08-05 17:27:22","All",15,,,,0,"Client Software"," --",,"unspecified",0,6,
1053039,"Firefox","Preferences","nobody","NEW"," ---","Sites are shown multiple times in the cookie menu","2014-08-13 07:43:04",,"2014-08-12 22:37:47","All",4,,,,0,"Client Software"," --",,"32 Branch",0,3,
1055323,"Firefox","Preferences","nobody","NEW"," ---","Breakdown: ""Set as Default"" Notification Bar Test","2017-08-18 07:03:08",,"2014-08-18 16:15:29","All",1,,,,0,"Client Software"," --",,"unspecified",0,9,
1056056,"Firefox","Preferences","nobody","NEW"," ---","[Linux] Firefox can't be set as default browser","2018-01-31 02:37:17",,"2014-08-20 06:20:25","Linux",5,,,,0,"Client Software"," --",,"34 Branch",0,3,
1056478,"Firefox","Preferences","nobody","NEW"," ---","Resizer of sub-dialog follows only half of the movement of mouse pointer","2015-01-28 14:45:42",1105906,"2014-08-20 22:48:05","All",9,,,,0,"Client Software"," --",,"34 Branch",1,7,
1060629,"Firefox","Preferences","nobody","NEW"," ---","[UX] Design for preferences switch between tabs on top and side tabs","2017-04-18 05:41:29",,"2014-08-29 14:43:09","All",1,,,,0,"Client Software"," --",,"33 Branch",2,0,
1061973,"Firefox","Preferences","nobody","NEW"," ---","""Remove..."" button beside list of websites that are allowed to store data for offline use is disabled","2014-09-17 11:23:00",,"2014-09-02 15:49:02","Linux",4,,,,0,"Client Software"," --",,"Trunk",0,5,
1063112,"Firefox","Preferences","nobody","NEW"," ---","Selected action icon too big at the applications prefpane","2018-04-02 13:35:30",,"2014-09-04 13:52:18","All",1,,,,0,"Client Software"," --",,"unspecified",0,1,
1063410,"Firefox","Preferences","nobody","NEW"," ---","Investigate why cookie exception test (browser_cookies_exceptions.js) has observer callbacks where we weren't expecting any","2015-11-07 06:51:52",,"2014-09-05 01:39:35","Mac OS X",2,,,,0,"Client Software"," --",,"Trunk",0,1,
1067316,"Firefox","Preferences","nobody","NEW"," ---","Allow deferred restart after changing the preferences of how Firefox will remember history","2016-05-04 16:42:59",973014,"2014-09-15 04:45:06","All",2,,,,0,"Client Software"," --",,"33 Branch",0,3,
1074244,"Firefox","Preferences","nobody","NEW"," ---","Add new timeframes (5 minutes, 24 hours) and data source (open tabs and windows) to Clear Recent History dialog","2018-06-01 07:41:47","463553, 581308, 1069300","2014-09-29 08:45:57","All",1,,,,0,"Client Software"," --",,"Trunk",1,2,
1078139,"Firefox","Preferences","nobody","NEW"," ---","Add a ""Show a new tab page"" to replace ""Show a blank page""","2017-03-09 06:45:01",,"2014-10-06 00:20:15","All",9,,,,0,"Client Software"," --",,"33 Branch",0,8,
