"Bug ID","Product","Component","Assignee","Status","Resolution","Summary","Changed","Depends on","Opened","OS","Number of Comments","Last Resolved","Last Visit","Crash Signature","Duplicate Count","Classification","Priority","Rank","Version","Votes","CC Count","Bug Interest"
1303521,"Firefox","Search","nobody","NEW"," ---","Intermittent browser/base/content/test/general/browser_keywordSearch_postData.js | Test timed out -","2017-03-21 03:06:48",,"2016-09-17 01:05:56","Unspecified",1,,,,0,"Client Software","P3",,"Trunk",0,0,
1306270,"Firefox","Search","nobody","NEW"," ---","[One-off searches] Change of default search engine takes effect only after closing/reopening the Awesomebar","2017-03-21 03:05:40",,"2016-09-29 05:26:22","All",1,,,,0,"Client Software","P3",,"Trunk",0,2,
1311013,"Firefox","Search","nobody","NEW"," ---","One-off searches from about:home are not counted in UITelemetry","2018-11-05 04:57:44",,"2016-10-18 06:28:00","Unspecified",4,,,,0,"Client Software","P3",,"Trunk",0,4,
1311691,"Firefox","Search","nobody","NEW"," ---","Clean up uses of |_selectionDetails/telemetrySearchDetails | in autocomplete","2017-04-04 13:30:05",,"2016-10-20 07:04:34","Unspecified",2,,,,0,"Client Software","P3",,"Trunk",0,3,
1315509,"Firefox","Search","nobody","NEW"," ---","Ctrl+K shortcut should add ? in URL bar if search bar is removed","2018-05-02 11:40:38","1177895, 1308931, 1360040","2016-11-05 20:37:42","Unspecified",12,,,,1,"Client Software","P3",,"Trunk",3,4,
1327070,"Firefox","Search","nobody","NEW"," ---","Searchbar shows suggestions even if I no longer interact with it (when it gains focus)","2018-06-25 11:30:32",,"2017-01-01 00:11:40","Unspecified",7,,,,0,"Client Software","P3",,"Trunk",0,4,
1327616,"Firefox","Search","nobody","NEW"," ---","Search engine is added without favicon if the engine in some cases","2017-03-21 03:37:50",,"2017-01-01 02:27:22","Unspecified",1,,,,0,"Client Software","P3",,"Trunk",0,1,
1334639,"Firefox","Search","nobody","NEW"," ---","Add a probe for the remembered suggestions in search bar","2017-03-21 07:40:22",,"2017-01-27 12:35:44","Unspecified",4,,,,0,"Client Software","P3",,"Trunk",0,3,
1334640,"Firefox","Search","nobody","NEW"," ---","Add any missing search bar telemetry probes","2017-03-21 07:44:03",,"2017-01-27 12:37:11","Unspecified",2,,,,0,"Client Software","P3",,"Trunk",0,2,
1340814,"Firefox","Search","nobody","NEW"," ---","Intermittent browser/components/search/test/browser_searchbar_openpopup.js | Test timed out -, and more search related failures","2018-03-27 10:36:12",,"2017-02-18 09:48:03","Unspecified",3,,,,0,"Client Software","P3",,"unspecified",0,0,
1344931,"Firefox","Search","nobody","NEW"," ---","Enable handoff from new tab/ about:home in-content SAP to Awesome Bar","2017-04-03 13:54:48",,"2017-03-06 14:55:22","Unspecified",2,,,,0,"Client Software","P3",,"unspecified",2,1,
1351715,"Firefox","Search","nobody","NEW"," ---","[userstory] Ask user why they're switching when user changes default search","2017-03-29 08:51:43",,"2017-03-29 08:51:21","Unspecified",1,,,,0,"Client Software","P3",,"unspecified",0,0,
1358835,"Firefox","Search","nobody","NEW"," ---","Backspace is ignored if it's quickly followed by enter in the search box with a search suggestion selected","2017-09-13 09:47:54",,"2017-04-22 17:33:26","Unspecified",9,,,,0,"Client Software","P3",,"52 Branch",0,6,
1360170,"Firefox","Search","nobody","NEW"," ---","Change Search Settings button is not blue/orange when selected using the UP/DOWN keys","2017-05-26 06:48:44",,"2017-04-27 04:38:18","All",5,,,,0,"Client Software","P3",,"55 Branch",0,4,
1369299,"Firefox","Search","nobody","NEW"," ---","Disable GeoIP/RegionDefault Search lookup when 'privacy.resistFingerprinting' is true","2018-09-24 18:14:27",,"2017-06-01 01:06:15","Unspecified",11,,,,0,"Client Software","P3",,"unspecified",2,7,
1372374,"Firefox","Search","nobody","NEW"," ---","Awesomebar search onboarding feels slow","2018-05-15 05:39:00",,"2017-06-12 14:10:30","Unspecified",3,,,,0,"Client Software","P3",,"Trunk",0,4,
1373990,"Firefox","Search","nobody","NEW"," ---","One-off search buttons separators don't have the same width if DPI > 100%","2017-12-13 09:31:43",,"2017-06-17 14:39:20","Unspecified",10,,,,0,"Client Software","P3",,"unspecified",0,7,
1388575,"Firefox","Search","nobody","NEW"," ---","About:home / About:newtab Search Suggest Pop-up Doesn't Have a Fixed Width","2018-04-19 12:39:01",,"2017-08-08 17:30:43","All",5,,,,1,"Client Software","P3",,"57 Branch",0,4,
1389080,"Firefox","Search","nobody","NEW"," ---","When Search Panel is hidden by resize, the search string is reset","2018-04-19 12:42:56",,"2017-08-10 07:04:37","All",2,,,,0,"Client Software","P3",,"Trunk",0,1,
1392320,"Firefox","Search","nobody","NEW"," ---","Re-enable browser_urlbar_keyed_search_reflows.js for Linux and Windows debug builds","2017-09-14 06:47:42",,"2017-08-21 09:58:12","Unspecified",1,,,,0,"Client Software","P3",,"unspecified",0,2,
1394383,"Firefox","Search","nobody","NEW"," ---","Hovering the Search Engines from the Search Suggestions menu in about:newtab or about:home does not change the ""Search for <keyword> with:"" string","2018-04-24 13:31:15",,"2017-08-28 05:04:14","All",5,,,,0,"Client Software","P3",,"Trunk",0,3,
1394387,"Firefox","Search","nobody","NEW"," ---","Search Suggestions do not re-appear after the menu is dismissed","2018-07-17 08:31:24",,"2017-08-28 05:30:32","All",8,,,,0,"Client Software","P3",,"Trunk",0,5,
1397248,"Firefox","Search","nobody","NEW"," ---","The One-Off search 2nd line buttons are not visible in the search bar when switching OS themes","2018-01-05 06:24:34",,"2017-09-06 04:38:11","Unspecified",2,,,,0,"Client Software","P3",,"Trunk",0,2,
1403461,"Firefox","Search","nobody","NEW"," ---","Search module with diacritics in their name cannot be hidden","2018-05-03 11:05:09",,"2017-09-27 00:53:09","Unspecified",6,,,,0,"Client Software","P3",,"57 Branch",0,3,
1405671,"Firefox","Search","nobody","NEW"," ---","Remove the search service synchronous initialization code paths","2018-02-09 17:56:10",888958,"2017-10-04 06:57:08","Unspecified",2,,,,0,"Client Software","P3",,"Trunk",1,6,
1411048,"Firefox","Search","nobody","NEW"," ---","Add a search button to ""server not found"" page.","2018-04-24 13:27:36",,"2017-10-23 14:16:20","Unspecified",2,,,,0,"Client Software","P3",,"unspecified",0,2,
1411224,"Firefox","Search","nobody","NEW"," ---","[Ubuntu][Search bar] ""Change Search Settings"" is partially displayed if the window is on half of the screen","2018-01-16 15:25:42",,"2017-10-24 04:33:35","Linux",2,,,,0,"Client Software","P3",,"Trunk",0,2,
1414393,"Firefox","Search","nobody","NEW"," ---","Cleanup encoding in nsSearchService","2018-04-30 10:56:16",,"2017-11-03 12:35:21","Unspecified",1,,,,0,"Client Software","P3",,"57 Branch",0,2,
1417147,"Firefox","Search","nobody","NEW"," ---","Firefox could automatically switch to e.g. Duckduckgo whenever the user is in incognito mode","2018-08-18 08:41:41",1411340,"2017-11-14 10:15:50","Unspecified",6,,,,2,"Client Software","P3",,"57 Branch",3,9,
1420085,"Firefox","Search","nobody","NEW"," ---","Offer to add search module uses website favicon instead the module icon","2018-02-12 10:40:51",,"2017-11-22 23:47:38","Unspecified",3,,,,0,"Client Software","P3",,"unspecified",0,1,
1421269,"Firefox","Search","nobody","NEW"," ---","When absearch doesn't specify default engine, clear stored default engine attribute from the previous absearch","2017-11-29 08:59:44",,"2017-11-28 06:30:01","All",2,,,,0,"Client Software","P3",,"Trunk",0,3,
1433263,"Firefox","Search","nobody","NEW"," ---","""Restore Default Search Engines"" is misleading","2018-02-27 10:38:36",,"2018-01-25 12:44:23","Unspecified",3,,,,0,"Client Software","P3",,"unspecified",0,2,
1433991,"Firefox","Search","nobody","NEW"," ---","Enhance error message to handle failed unified bar search","2018-02-09 17:44:06",482874,"2018-01-29 10:41:34","Unspecified",2,,,,0,"Client Software","P3",,"57 Branch",0,1,
1437528,"Firefox","Search","nobody","NEW"," ---","One-off search buttons no longer accessible via the keyboard","2018-09-05 15:06:56",1437524,"2018-02-12 06:52:31","All",16,,,,0,"Client Software","P3",,"Trunk",0,7,
1445134,"Firefox","Search","nobody","NEW"," ---","Support in-memory-only search engines","2018-06-18 13:58:37",,"2018-03-12 22:39:52","Unspecified",11,,,,0,"Client Software","P3",,"Trunk",0,5,
1446934,"Firefox","Search","nobody","NEW"," ---","The Ecosia search engine is reset to Google after migrating to the WebExtension","2018-05-02 17:33:34",,"2018-03-19 03:49:20","All",1,,,,0,"Client Software","P3",,"Trunk",0,1,
1455734,"Firefox","Search","nobody","NEW"," ---","Collect One Off Search Data","2018-05-11 07:45:31",,"2018-04-20 12:57:00","Unspecified",11,,,,0,"Client Software","P3",,"unspecified",0,5,
1457069,"Firefox","Search","nobody","NEW"," ---","Title and favicon of OpenSearch engines offered by pages do not necessarily match title and favicon they're installed with","2018-10-05 03:19:08",,"2018-04-26 00:44:47","All",5,,,,1,"Client Software","P3",,"61 Branch",0,4,
1458579,"Firefox","Search","nobody","NEW"," ---","""Release-sysaddon"" channel doesn't allow the browser to get any updates on Mac and Linux","2018-05-11 17:12:42",,"2018-05-02 08:50:30","Unspecified",9,,,,0,"Client Software","P3",,"unspecified",0,5,
1459211,"Firefox","Search","nobody","NEW"," ---","Search bar doesn’t keep the search input if resizing the browser","2018-05-07 06:34:10",,"2018-05-04 07:45:12","All",3,,,,0,"Client Software","P3",,"Trunk",0,3,
1461868,"Firefox","Search","nobody","NEW"," ---","search suggestions should bold the suggested test (not the already-typed text)","2018-06-01 10:02:05",,"2018-05-15 19:16:11","Unspecified",2,,,,0,"Client Software","P3",,"unspecified",0,3,
1463858,"Firefox","Search","nobody","NEW"," ---","Regression in SEARCH_SERVICE_INIT_MS on or around 2018-04-22","2018-06-01 10:34:57",,"2018-05-23 12:38:05","Unspecified",3,,,,0,"Client Software","P3",,"Trunk",0,4,
1474675,"Firefox","Search","nobody","NEW"," ---","Provide a way to have one wikipedia search engine","2018-07-10 11:35:46",,"2018-07-10 11:35:46","Unspecified",1,,,,0,"Client Software","P3",,"Trunk",0,0,
1479480,"Firefox","Search","nobody","NEW"," ---","Expand SearchStaticData for other search sources","2018-07-30 10:09:57",,"2018-07-30 09:11:08","Unspecified",1,,,,0,"Client Software","P3",,"52 Branch",0,0,
1490614,"Firefox","Search","nobody","NEW"," ---","Search suggestion dropdown  inside Overflow menu is not dismissed when open another panel","2018-11-08 08:32:59",,"2018-09-12 02:17:48","All",4,,,,0,"Client Software","P3",,"Trunk",0,0,
1494679,"Firefox","Search","nobody","NEW"," ---","Intermittent browser/components/search/test/browser_426329.js | form history entry 'test' should exist - when Gecko 64 merges to Beta on 2018-10-15","2018-10-01 00:10:26",,"2018-09-27 07:29:43","Unspecified",2,,,,0,"Client Software","P3",,"unspecified",0,1,
1096922,"Firefox","Search","mv.nsaad","NEW"," ---","search engine cache should be invalidated when removing engines (built-In DuckDuckGo doesn't come back after uninstall of previous DuckDuckGo)","2018-04-30 10:56:22",,"2014-11-11 04:56:13","All",12,,,,0,"Client Software","P4",45,"Trunk",1,7,
248955,"Firefox","Search","nobody","NEW"," ---","search box should be tab-specific (content should not persist when switching tabs)","2017-11-23 19:00:54",,"2004-06-28 13:52:31","All",86,,,,8,"Client Software","P4",45,"Trunk",15,41,
253331,"Firefox","Search","nobody","NEW"," ---","Search bar's text should be cleared after a search is performed","2018-09-12 18:57:46",,"2004-07-27 14:28:23","All",56,"2005-07-15 09:04:25",,,14,"Client Software","P4",45,"Trunk",18,48,
261124,"Firefox","Search","nobody","NEW"," ---","Textbox context menu should have ""Add to Search Bar...""","2017-08-11 17:08:06","236587, 317107","2004-09-22 21:13:37","All",20,,,,6,"Client Software","P4",45,"Trunk",28,47,
275193,"Firefox","Search","nobody","NEW"," ---","Clear Search Button","2018-05-18 02:56:42",,"2004-12-18 10:41:13","All",15,,,,4,"Client Software","P4",45,"Trunk",3,13,
338636,"Firefox","Search","nobody","NEW"," ---","Want to delete a search engine via context menu","2015-09-23 09:12:37",,"2006-05-20 05:25:19","All",6,,,,0,"Client Software","P4",45,"unspecified",1,5,
340693,"Firefox","Search","nobody","NEW"," ---","google's search suggest should look at accepted languages","2015-09-23 09:12:45",,"2006-06-07 09:50:35","All",3,,,,1,"Client Software","P4",45,"2.0 Branch",1,9,
343829,"Firefox","Search","nobody","NEW"," ---","Send relevant search plugin loading errors to the Error Console","2015-09-23 09:12:36",,"2006-07-06 20:45:15","All",2,,,,0,"Client Software","P4",45,"2.0 Branch",1,5,
347936,"Firefox","Search","nobody","NEW"," ---","Allow browser search order to be set for positions beyond 1 and 2","2017-08-18 07:56:17",,"2006-08-08 14:39:33","All",4,,,,0,"Client Software","P4",35,"2.0 Branch",2,6,
369739,"Firefox","Search","nobody","NEW"," ---","when an engine update changes the engine's name, getEngineByName will only work with the old name","2015-09-23 09:12:47",335102,"2007-02-08 07:44:02","All",3,,,,0,"Client Software","P4",45,"2.0 Branch",1,5,
407197,"Firefox","Search","nobody","NEW"," ---","Hovering over search engine should show URL","2015-09-23 09:13:01",,"2007-12-06 12:31:48","All",1,,,,0,"Client Software","P4",45,"12 Branch",1,1,
415424,"Firefox","Search","nobody","NEW"," ---","Multiple ""Add new engine"" options in search bar dropdown list if page is reloaded in the background and advertised engine name changes","2015-09-23 09:12:56",,"2008-02-03 04:44:12","Windows XP",6,,,,1,"Client Software","P4",45,"Trunk",0,5,
427028,"Firefox","Search","nobody","NEW"," ---","firefox lacks hooks to properly upgrade through packging system (Was: After upgrade in ubuntu address bar sometimes triggers ""ASSERT: *** Search: _installLocation: engine has no file!"" instead of loading URL)","2015-09-23 09:12:57",,"2008-04-04 07:23:39","All",17,,,,7,"Client Software","P4",45,"3.0 Branch",1,17,
429183,"Firefox","Search","nobody","NEW"," ---","if browser.search.openintab==true and search bar is absent; search page opens in current tab","2015-09-23 09:12:41",,"2008-04-15 13:44:31","Windows XP",2,,,,0,"Client Software","P4",45,"Trunk",2,6,
430314,"Firefox","Search","nobody","NEW"," ---","Use a Wikipedia search icon with no white background","2015-09-23 09:12:59",,"2008-04-22 12:01:08","All",23,,,,0,"Client Software","P4",45,"Trunk",2,11,
458810,"Firefox","Search","nobody","NEW"," ---","Implement search service test suite","2016-01-21 15:02:57",699856,"2008-10-06 14:49:42","All",10,,,,0,"Client Software","P4",35,"Trunk",2,10,
529345,"Firefox","Search","nobody","NEW"," ---","need to ensure that updateIntervals are not negative","2015-09-23 09:12:38",,"2009-11-17 12:18:36","All",5,,,,0,"Client Software","P4",45,"unspecified",0,4,
547837,"Firefox","Search","nobody","NEW"," ---","_isDefault called during from-the-web engine installation only accidentally works, breaks stuff","2016-03-02 06:22:20",,"2010-02-22 14:29:55","All",4,,,,0,"Client Software","P4",45,"unspecified",0,2,
773344,"Firefox","Search","nobody","NEW"," ---","Investigation - searchbar suggestions not chosen after highlighting and pressing ENTER","2015-11-03 06:13:33",,"2012-07-12 10:30:19","Windows 7",3,,,,0,"Client Software","P4",45,"13 Branch",0,4,
959572,"Firefox","Search","nobody","NEW"," ---","UX to investigate separating search and history in the Awesomebar","2017-04-18 05:40:43",,"2014-01-14 05:26:11","Mac OS X",1,,,,0,"Client Software","P4",45,"Trunk",2,9,
959581,"Firefox","Search","nobody","NEW"," ---","Add probes to measure whether or not highlighting the search provider in the awesomebar is yielding the desired results","2017-08-11 16:31:22",959571,"2014-01-14 05:33:10","All",1,,,,0,"Client Software","P4",35,"28 Branch",2,5,
986676,"Firefox","Search","nobody","NEW"," ---","Store the search engine icons more efficiently","2015-09-16 06:06:45",,"2014-03-21 14:13:37","All",6,,,,0,"Client Software","P4",,"unspecified",1,8,
1001528,"Firefox","Search","nobody","NEW"," ---","Evaluate additional potential search suggestion options for Yahoo search plugin.","2017-01-26 05:41:19",,"2014-04-25 10:39:14","All",3,,,,0,"Client Software","P4",45,"unspecified",0,5,
1016808,"Firefox","Search","nobody","NEW"," ---","Use XMLHttpRequest's responseType = ""json"" for search suggestions","2015-09-17 11:17:56",,"2014-05-27 23:16:38","All",1,,,,0,"Client Software","P4",46,"Trunk",0,1,
1041338,"Firefox","Search","nobody","NEW"," ---","Hitting Enter twice in SearchBar triggers installing add-on","2015-09-23 09:12:43",,"2014-07-20 13:12:34","Windows 7",3,,,,0,"Client Software","P4",45,"Trunk",0,2,
1041665,"Firefox","Search","nobody","NEW"," ---","Robustly re-initialize nsSearchService when locale preference changes","2015-10-12 10:43:08","896688, 1018240","2014-07-21 11:02:18","All",3,,,,0,"Client Software","P4",45,"Trunk",0,4,
1042604,"Firefox","Search","nobody","NEW"," ---","Measure how many searches, for each engine, result in a final URL that can be parsed","2015-11-03 06:13:24",1040721,"2014-07-23 04:24:14","All",2,,,,0,"Client Software","P4",45,"Trunk",1,1,
1046943,"Firefox","Search","nobody","NEW"," ---","SearchSuggestionController should move remote results that are also in form history to the local results","2015-11-03 06:13:47",1007979,"2014-07-31 11:34:34","All",5,,,,0,"Client Software","P4",45,"Trunk",0,3,
1048127,"Firefox","Search","nobody","NEW"," ---","addEngine ""dataType"" parameter documentation is potentially confusing","2015-09-23 09:12:40",,"2014-08-03 23:57:19","All",9,,,,0,"Client Software","P4",45,"31 Branch",0,5,
1051873,"Firefox","Search","nobody","NEW"," ---","Cannot reach the New Tab Page Search Provider button via keyboard navigation, nor select a provider from the list","2015-11-03 06:13:42",962490,"2014-08-11 08:26:40","All",3,,,,0,"Client Software","P4",46,"Trunk",0,2,
1060847,"Firefox","Search","nobody","NEW"," ---","Form history dropdown does not pop up by double click/up arrow key in search field of about:home/about:newtab","2015-09-23 09:12:40",1066787,"2014-08-30 12:02:07","All",10,,,,0,"Client Software","P4",45,"33 Branch",1,9,
1065997,"Firefox","Search","nobody","NEW"," ---","Update localized search plugins to use rel=""searchform""","2017-10-30 08:33:43",990799,"2014-09-11 05:02:38","All",9,,,,0,"Client Software","P4",45,"Trunk",0,7,
1071361,"Firefox","Search","nobody","NEW"," ---","Change the search purpose for current search engine and aliased search engine autocomplete results","2017-04-18 05:40:39","1063530, 1067888, 1067896","2014-09-22 18:49:54","All",3,,,,0,"Client Software","P4",45,"Trunk",0,1,
1073603,"Firefox","Search","nobody","NEW"," ---","can't order newly added default search engines","2015-11-03 06:14:05",,"2014-09-26 10:55:22","All",3,,,,0,"Client Software","P4",45,"Trunk",0,4,
1082078,"Firefox","Search","nobody","NEW"," ---","Add additional search engines for the Developer Edition (formerly Aurora)","2017-11-13 06:52:02",,"2014-10-13 11:06:46","All",25,,,,1,"Client Software","P4",45,"unspecified",0,14,
1105272,"Firefox","Search","nobody","NEW"," ---","Search suggestions are displayed in Customize Mode when browser is in Window Mode","2015-09-17 11:17:21",,"2014-11-26 06:34:41","All",3,,,,1,"Client Software","P4",45,"34 Branch",0,2,
1106924,"Firefox","Search","nobody","NEW"," ---","hidden open search providers should be offered in the list providers that can be added","2015-11-03 06:13:57",,"2014-12-02 16:35:48","Mac OS X",1,,,,0,"Client Software","P4",45,"34 Branch",0,0,
1107178,"Firefox","Search","nobody","NEW"," ---","add test coverage for one-off buttons","2015-11-03 06:12:58",,"2014-12-03 12:25:45","All",5,,,,0,"Client Software","P4",45,"unspecified",0,3,
1107503,"Firefox","Search","nobody","NEW"," ---","The new search popup shows up for a short moment and then hides","2015-11-03 06:12:55",,"2014-12-04 06:32:04","Linux",11,,,,0,"Client Software","P4",45,"unspecified",0,5,
1107506,"Firefox","Search","nobody","NEW"," ---","Search suggestions dropdown is misplaced if changing device orientation","2015-09-23 09:12:39",,"2014-12-04 06:54:42","Windows 8.1",2,,,,0,"Client Software","P4",45,"Trunk",0,1,
1108466,"Firefox","Search","nobody","NEW"," ---","Make it easier to do image search","2015-09-17 11:13:29",,"2014-12-07 22:57:47","Linux",1,,,,0,"Client Software","P4",45,"unspecified",0,0,
1113692,"Firefox","Search","nobody","NEW"," ---","A search engine that was set as default removed and then restored is used at searches from url bar","2016-01-07 09:06:03",,"2014-12-19 08:15:01","All",7,,,,0,"Client Software","P4",45,"Trunk",0,2,
1115009,"Firefox","Search","nobody","NEW"," ---","Remove useless focus calls from search.xml now that the search popup doesn't disappear and reappear when searching in a separate tab","2017-01-03 03:54:06",1313403,"2014-12-23 07:47:12","All",8,,,,2,"Client Software","P4",45,"36 Branch",3,6,
1115012,"Firefox","Search","nobody","NEW"," ---","[Windows] Search dropdown only fits 2 search engines per row at minimum width","2015-09-23 09:12:51",,"2014-12-23 08:03:25","Windows 7",1,,,,0,"Client Software","P4",45,"35 Branch",0,2,
1118691,"Firefox","Search","nobody","NEW"," ---","Hover highlight of suggestions should disappear when moving the mouse out of the suggestions area","2015-11-09 13:07:50","1106032, 1142334","2015-01-07 02:33:00","All",3,,,,0,"Client Software","P4",45,"36 Branch",0,5,
1120641,"Firefox","Search","nobody","NEW"," ---","Add tests for the default search engine header added to the search suggestions popup","2015-11-03 06:13:14",,"2015-01-12 13:28:58","All",6,,,,0,"Client Software","P4",45,"unspecified",0,2,
1120642,"Firefox","Search","nobody","NEW"," ---","Add tests for the opensearch discovery support in the new search bar","2015-11-03 06:13:38",,"2015-01-12 13:29:31","All",1,,,,0,"Client Software","P4",45,"unspecified",0,1,
1124678,"Firefox","Search","nobody","NEW"," ---","Changing default search-engine with Ctrl+mousewheel closes and reopens search-panel","2015-11-03 06:14:05",,"2015-01-22 07:06:48","All",12,,,,0,"Client Software","P4",45,"36 Branch",0,4,
1124747,"Firefox","Search","nobody","NEW"," ---","closing the search panel with (shift+)<tab> doesn't revert the searchbox's text field value to what the user typed","2015-11-03 06:14:17",,"2015-01-22 09:18:07","All",2,,,,0,"Client Software","P4",45,"Trunk",0,1,
1126804,"Firefox","Search","nobody","NEW"," ---","The search panel appears above the bookmarks panel","2015-11-03 06:13:11",,"2015-01-28 06:46:45","Mac OS X",3,,,,0,"Client Software","P4",45,"Trunk",0,2,
1141144,"Firefox","Search","nobody","NEW"," ---","search dropdown appears and covers context menu","2015-09-23 09:12:53",,"2015-03-09 09:22:02","Linux",7,,,,0,"Client Software","P4",45,"38 Branch",1,4,
1147383,"Firefox","Search","nobody","NEW"," ---","[Implement] Navigation and Hover spec for search providers component","2015-11-03 06:13:15",,"2015-03-25 07:05:53","Mac OS X",1,,,,0,"Client Software","P4",45,"Trunk",0,0,
1165341,"Firefox","Search","nobody","NEW"," ---","No ""engine-default"" is notified when removing a default engine","2016-02-01 07:33:07",,"2015-05-15 07:52:28","All",6,,,,0,"Client Software","P4",35,"Trunk",0,4,
1169220,"Firefox","Search","nobody","NEW"," ---","Search panel is not updated after deleting history items","2015-09-23 09:12:33",1136139,"2015-05-28 04:03:34","All",1,,,,0,"Client Software","P4",45,"41 Branch",0,0,
1171399,"Firefox","Search","nobody","NEW"," ---","Left button not working in Search Bar","2015-06-17 09:56:16",,"2015-06-04 03:23:27","Windows 7",2,,,,0,"Client Software","P4",43,"38 Branch",0,1,
1172444,"Firefox","Search","nobody","NEW"," ---","Searchbar should be able to get the query string from search engine.","2015-06-17 09:52:46",,"2015-06-08 02:58:30","Unspecified",1,,,,0,"Client Software","P4",45,"unspecified",0,0,
1175479,"Firefox","Search","nobody","NEW"," ---","BrowserUtils.jsm throws an error for trying to add search keywords to the internal search fields","2015-06-17 09:47:09",,"2015-06-17 04:41:17","All",1,,,,0,"Client Software","P4",46,"Trunk",0,0,
1184475,"Firefox","Search","nobody","NEW"," ---","Firefox could not install the search plugin from ... because an engine with the same name already exists.","2018-08-02 23:38:17",,"2015-07-16 02:05:08","All",11,,,,0,"Client Software","P4",45,"39 Branch",1,4,
1190311,"Firefox","Search","nobody","NEW"," ---","Context menu and suggestions panel both appear when right clicking an unfocused searchbar above or below the text field","2018-07-09 03:07:59",,"2015-08-03 03:17:14","Unspecified",6,,,,1,"Client Software","P4",45,"Trunk",0,6,
1202521,"Firefox","Search","nobody","NEW"," ---","Search bar flickers (hides and reopens) when I add new search engines","2016-01-04 01:56:27",,"2015-09-07 17:49:45","Unspecified",1,,,,0,"Client Software","P4",45,"Trunk",0,1,
1203170,"Firefox","Search","nobody","NEW"," ---","redesign the distribution/ feature to support signing or search plugins with low startup impact","2016-05-12 00:23:01",,"2015-09-09 08:43:01","Unspecified",5,,,,0,"Client Software","P4",40,"Trunk",0,4,
1204242,"Firefox","Search","nobody","NEW"," ---","There's no way to determine whether I should press Ctrl+Up or Ctrl+Down to set the desired search engine as default one","2016-01-26 13:07:29",1109851,"2015-09-12 09:53:51","Unspecified",4,,,,0,"Client Software","P4",45,"Trunk",0,2,
1206968,"Firefox","Search","nobody","NEW"," ---","One-click search button right-click menu: ""search in new tab"" logic should be inverted if browser.search.openintab is true","2017-09-01 11:39:20",,"2015-09-21 16:48:24","Unspecified",7,,,,0,"Client Software","P4",45,"Trunk",0,5,
